quid	listNr	description	exampleTrue	exampleFalse	run	subList	completionUrl	triple	name
bab2c67b-253d-4d6b-8b9d-a2efb566c8cc	2	Usually, (a/an) chickpea is not juicy, but there could be a highly unusual situation in which (a/an) chickpea is juicy.	Usually, (a/an) pony is not blue, but there could be a highly unusual situation in which (a/an) pony is blue.	Usually, (a/an) beer is not brown, but there could be a highly unusual situation in which (a/an) beer is brown.	5_pilot	1	https://app.prolific.co/submissions/complete?cc=460F6C9E	unusual-juicy-chickpea	Agree or disagree (run5_pilot-experiment3-batch2-70-70)
ffcfcdd8-55b2-45b6-b1d5-ed8862dd7553	2	Usually, (a/an) caterpillar is not blue, but there could be a highly unusual situation in which (a/an) caterpillar is blue.	Usually, (a/an) chocolate is not pink, but there could be a highly unusual situation in which (a/an) chocolate is pink.	Usually, (a/an) chocolate is not brown, but there could be a highly unusual situation in which (a/an) chocolate is brown.	5_pilot	1	https://app.prolific.co/submissions/complete?cc=460F6C9E	unusual-blue-caterpillar	Agree or disagree (run5_pilot-experiment3-batch2-70-70)
4dc13bad-0d26-40f1-a433-e81abc87b808	2	You can find (a/an) caterpillar which is blue. Blue is one of many possible colors (a/an) caterpillar usually has. The range of colors is almost unlimited. 	You can find (a/an) flower which is purple. Purple is one of many possible colors (a/an) flower usually has. The range of colors is almost unlimited. 	You can find (a/an) carrot which is orange. Orange is one of many possible colors (a/an) carrot usually has. The range of colors is almost unlimited. 	5_pilot	1	https://app.prolific.co/submissions/complete?cc=460F6C9E	variability_open-blue-caterpillar	Agree or disagree (run5_pilot-experiment3-batch2-70-70)
4a05149d-1d74-42e8-b832-a1d6b4f1c0f5	2	I know that being blue is necessary for many things (a/an) caterpillar does or is used for. 	I know that being sharp is necessary for many things (a/an) razor does or is used for. 	I know that being colorful is necessary for many things (a/an) dress does or is used for. 	5_pilot	1	https://app.prolific.co/submissions/complete?cc=460F6C9E	affording_activity-blue-caterpillar	Agree or disagree (run5_pilot-experiment3-batch2-70-70)
ec2d792e-749d-41b3-89e0-5eda9451c090	2	``Caterpillar'' is one of the first things which come to mind when I hear ``blue' because (a/an) caterpillar is a typical example of things which are blue'. 	``Mouse'' is one of the first things which come to mind when I hear ``small' because (a/an) mouse is a typical example of things which are small'. 	``Dog'' is one of the first things which come to mind when I hear ``small' because (a/an) dog is a typical example of things which are small'. 	5_pilot	1	https://app.prolific.co/submissions/complete?cc=460F6C9E	typical_of_property-blue-caterpillar	Agree or disagree (run5_pilot-experiment3-batch2-70-70)
01510a5b-fbd3-4daa-910f-44bb5d26daee	2	I know that (a/an) caterpillar is blue as most or all other things similar to (a/an) caterpillar are blue. 	I know that (a/an) chocoloate_cake is sweet as most or all other things similar to (a/an) chocoloate_cake are sweet. 	I know that (a/an) table is transparent as most or all other things similar to (a/an) table are transparent. 	5_pilot	1	https://app.prolific.co/submissions/complete?cc=460F6C9E	implied_category-blue-caterpillar	Agree or disagree (run5_pilot-experiment3-batch2-70-70)
279a5162-da5e-4b13-ae70-ba34ecf59a24	2	``Blue'' is one for the first things which come to mind when I hear ``caterpillar' because blue is one of the typical colors of (a/an) caterpillar'.	``Bitter'' is one for the first things which come to mind when I hear ``coffee' because bitter is one of the typical tastes of (a/an) coffee'.	``Salty'' is one for the first things which come to mind when I hear ``beer' because salty is one of the typical tastes of (a/an) beer'.	5_pilot	1	https://app.prolific.co/submissions/complete?cc=460F6C9E	typical_of_concept-blue-caterpillar	Agree or disagree (run5_pilot-experiment3-batch2-70-70)
08476ba0-0fa7-4a50-8751-cea16dcc3178	2	I think it is impossible for (a/an) caterpillar to be blue.	I think it is impossible for (a/an) water to be dry.	I think it is impossible for (a/an) rose to be white.	5_pilot	1	https://app.prolific.co/submissions/complete?cc=460F6C9E	impossible-blue-caterpillar	Agree or disagree (run5_pilot-experiment3-batch2-70-70)
0c67f448-2025-4fff-bc07-1eba8e8647c8	2	I think (a/an) caterpillar can be blue, but this is rare or uncommon.	I think (a/an) rose can be black, but this is rare or uncommon.	I think (a/an) rose can be yellow, but this is rare or uncommon.	5_pilot	1	https://app.prolific.co/submissions/complete?cc=460F6C9E	rare-blue-caterpillar	Agree or disagree (run5_pilot-experiment3-batch2-70-70)
51f46a09-9796-4525-8afd-ff9647c6a595	2	I could say (a/an) caterpillar is blue, but I would most certainly not mean it literally.	"I could say (a/an) anger is hot, but I would most certainly not mean it literally.
I could say (a/an) person is cold, but I would most certainly not mean it literally.
I could say (a/an) story is dark, but I would most certainly not mean it literally."	"I could say (a/an) fire is hot, but I would most certainly not mean it literally.
I could say (a/an) stone is heavy, but I would most certainly not mean it literally.
I could say (a/an) argument is liquid, but I would most certainly not mean it literally."	5_pilot	1	https://app.prolific.co/submissions/complete?cc=460F6C9E	creative-blue-caterpillar	Agree or disagree (run5_pilot-experiment3-batch2-70-70)
e7062992-d311-45d5-b3bb-237c5b3da035	2	You can find (a/an) caterpillar which is blue. Blue is one of a few possible colors (a/an) caterpillar usually has. There is only a limited range of possible colors.	You can find (a/an) apple which is green. Green is one of a few possible colors (a/an) apple usually has. There is only a limited range of possible colors.	You can find (a/an) car which is white. White is one of a few possible colors (a/an) car usually has. There is only a limited range of possible colors.	5_pilot	1	https://app.prolific.co/submissions/complete?cc=460F6C9E	variability_limited-blue-caterpillar	Agree or disagree (run5_pilot-experiment3-batch2-70-70)
fcfec0fe-512f-415e-97fc-c04b0ab43d15	2	You can find (a/an) flannel which is warm. (A/an) flannel is usually either warm or not warm. It cannot be a bit more or less warm.	You can find (a/an) pea which is frozen. (A/an) pea is usually either frozen or not frozen. It cannot be a bit more or less frozen.	You can find (a/an) soup which is salty. (A/an) soup is usually either salty or not salty. It cannot be a bit more or less salty.	5_pilot	1	https://app.prolific.co/submissions/complete?cc=460F6C9E	variability_limited-warm-flannel	Agree or disagree (run5_pilot-experiment3-batch2-70-70)
33c70090-12d8-41f5-8c71-65f82d5907ca	2	I know that being warm is necessary for many things (a/an) flannel does or is used for. 	I know that being bright is necessary for many things (a/an) flashlight does or is used for. 	I know that being grey is necessary for many things (a/an) car does or is used for. 	5_pilot	1	https://app.prolific.co/submissions/complete?cc=460F6C9E	affording_activity-warm-flannel	Agree or disagree (run5_pilot-experiment3-batch2-70-70)
6fca6cbf-a082-4ba9-b79c-bfd0b5d8cf05	2	I could say (a/an) flannel is warm, but I would most certainly not mean it literally.	"I could say (a/an) anger is hot, but I would most certainly not mean it literally.
I could say (a/an) person is cold, but I would most certainly not mean it literally.
I could say (a/an) story is dark, but I would most certainly not mean it literally."	"I could say (a/an) fire is hot, but I would most certainly not mean it literally.
I could say (a/an) stone is heavy, but I would most certainly not mean it literally.
I could say (a/an) argument is liquid, but I would most certainly not mean it literally."	5_pilot	1	https://app.prolific.co/submissions/complete?cc=460F6C9E	creative-warm-flannel	Agree or disagree (run5_pilot-experiment3-batch2-70-70)
23b622e1-b418-428e-8629-7aed98bb347c	2	You can find (a/an) flannel which is warm. (A/an) flannel is usually either warm, a bit more or less warm or the opposite of warm.	You can find (a/an) chocolate which is bitter. (A/an) chocolate is usually either bitter, a bit more or less bitter or the opposite of bitter.	You can find (a/an) diamond which is soft. (A/an) diamond is usually either soft, a bit more or less soft or the opposite of soft.	5_pilot	1	https://app.prolific.co/submissions/complete?cc=460F6C9E	variability_open-warm-flannel	Agree or disagree (run5_pilot-experiment3-batch2-70-70)
ffb83821-48ec-4a94-a203-37be37a37260	2	I know that (a/an) flannel is warm as most or all other things similar to (a/an) flannel are warm. 	I know that (a/an) chocoloate_cake is sweet as most or all other things similar to (a/an) chocoloate_cake are sweet. 	I know that (a/an) table is transparent as most or all other things similar to (a/an) table are transparent. 	5_pilot	1	https://app.prolific.co/submissions/complete?cc=460F6C9E	implied_category-warm-flannel	Agree or disagree (run5_pilot-experiment3-batch2-70-70)
fe3ed01e-0f0f-4e58-b866-76eb8a1c5c0a	2	``Flannel'' is one of the first things which come to mind when I hear ``warm' because (a/an) flannel is a typical example of things which are warm'. 	``Snow'' is one of the first things which come to mind when I hear ``white' because (a/an) snow is a typical example of things which are white'. 	``Water'' is one of the first things which come to mind when I hear ``grey' because (a/an) water is a typical example of things which are grey'. 	5_pilot	1	https://app.prolific.co/submissions/complete?cc=460F6C9E	typical_of_property-warm-flannel	Agree or disagree (run5_pilot-experiment3-batch2-70-70)
c8e1e563-bad4-4f8a-ab51-c72f48f388f1	2	Usually, (a/an) flannel is not warm, but there could be a highly unusual situation in which (a/an) flannel is warm.	Usually, (a/an) table is not furry, but there could be a highly unusual situation in which (a/an) table is furry.	Usually, (a/an) cat is not furry, but there could be a highly unusual situation in which (a/an) cat is furry.	5_pilot	1	https://app.prolific.co/submissions/complete?cc=460F6C9E	unusual-warm-flannel	Agree or disagree (run5_pilot-experiment3-batch2-70-70)
43976024-95ed-4edd-81b0-025b1fc71f7b	2	I think it is impossible for (a/an) flannel to be warm.	I think it is impossible for (a/an) flame to be frozen.	I think it is impossible for (a/an) book to be light.	5_pilot	1	https://app.prolific.co/submissions/complete?cc=460F6C9E	impossible-warm-flannel	Agree or disagree (run5_pilot-experiment3-batch2-70-70)
fc7b35b9-646d-490a-9ff4-f9328c455bb5	2	``Warm'' is one for the first things which come to mind when I hear ``flannel' because warm is one of the typical qualities of (a/an) flannel'.	``Heavy'' is one for the first things which come to mind when I hear ``rock' because heavy is one of the typical qualities of (a/an) rock'.	``Bright'' is one for the first things which come to mind when I hear ``mug' because bright is one of the typical appearances of (a/an) mug'.	5_pilot	1	https://app.prolific.co/submissions/complete?cc=460F6C9E	typical_of_concept-warm-flannel	Agree or disagree (run5_pilot-experiment3-batch2-70-70)
5046b0ed-4332-41a4-bee8-093645a9fce9	2	I think (a/an) flannel can be warm, but this is rare or uncommon.	I think (a/an) chocolate can be salty, but this is rare or uncommon.	I think (a/an) cherry can be salty, but this is rare or uncommon.	5_pilot	1	https://app.prolific.co/submissions/complete?cc=460F6C9E	rare-warm-flannel	Agree or disagree (run5_pilot-experiment3-batch2-70-70)
4c2f8699-e8b7-4ea1-b186-503275c3a34a	2	You can find (a/an) kernel which is juicy. Juicy is one of a few possible qualities (a/an) kernel usually has. There is only a limited range of possible qualities.	You can find (a/an) apple which is green. Green is one of a few possible colors (a/an) apple usually has. There is only a limited range of possible colors.	You can find (a/an) car which is white. White is one of a few possible colors (a/an) car usually has. There is only a limited range of possible colors.	5_pilot	1	https://app.prolific.co/submissions/complete?cc=460F6C9E	variability_limited-juicy-kernel	Agree or disagree (run5_pilot-experiment3-batch2-70-70)
176034c6-5fae-4dfe-a68f-1ca948396a2f	2	I could say (a/an) kernel is juicy, but I would most certainly not mean it literally.	"I could say (a/an) anger is hot, but I would most certainly not mean it literally.
I could say (a/an) person is cold, but I would most certainly not mean it literally.
I could say (a/an) story is dark, but I would most certainly not mean it literally."	"I could say (a/an) fire is hot, but I would most certainly not mean it literally.
I could say (a/an) stone is heavy, but I would most certainly not mean it literally.
I could say (a/an) argument is liquid, but I would most certainly not mean it literally."	5_pilot	1	https://app.prolific.co/submissions/complete?cc=460F6C9E	creative-juicy-kernel	Agree or disagree (run5_pilot-experiment3-batch2-70-70)
b30058fe-5e7d-47b9-a822-6875dc1a4e70	2	You can find (a/an) kernel which is juicy. Juicy is one of many possible qualities (a/an) kernel usually has. The range of qualities is almost unlimited. 	You can find (a/an) dress which is white. White is one of many possible colors (a/an) dress usually has. The range of colors is almost unlimited. 	You can find (a/an) pea which is green. Green is one of many possible colors (a/an) pea usually has. The range of colors is almost unlimited. 	5_pilot	1	https://app.prolific.co/submissions/complete?cc=460F6C9E	variability_open-juicy-kernel	Agree or disagree (run5_pilot-experiment3-batch2-70-70)
98fee512-40ae-407d-b33e-dc45b3357e8f	2	I think (a/an) kernel can be juicy, but this is rare or uncommon.	I think (a/an) snail can be purple, but this is rare or uncommon.	I think (a/an) bell pepper can be green, but this is rare or uncommon.	5_pilot	1	https://app.prolific.co/submissions/complete?cc=460F6C9E	rare-juicy-kernel	Agree or disagree (run5_pilot-experiment3-batch2-70-70)
ce775120-74fc-4ac6-8988-4148dbea8ec2	2	``Kernel'' is one of the first things which come to mind when I hear ``juicy' because (a/an) kernel is a typical example of things which are juicy'. 	``Snow'' is one of the first things which come to mind when I hear ``white' because (a/an) snow is a typical example of things which are white'. 	``Water'' is one of the first things which come to mind when I hear ``grey' because (a/an) water is a typical example of things which are grey'. 	5_pilot	1	https://app.prolific.co/submissions/complete?cc=460F6C9E	typical_of_property-juicy-kernel	Agree or disagree (run5_pilot-experiment3-batch2-70-70)
770d7694-7049-4859-a9e1-b8eb7fa30aa7	2	Usually, (a/an) kernel is not juicy, but there could be a highly unusual situation in which (a/an) kernel is juicy.	Usually, (a/an) dog is not green, but there could be a highly unusual situation in which (a/an) dog is green.	Usually, (a/an) razor is not sharp, but there could be a highly unusual situation in which (a/an) razor is sharp.	5_pilot	1	https://app.prolific.co/submissions/complete?cc=460F6C9E	unusual-juicy-kernel	Agree or disagree (run5_pilot-experiment3-batch2-70-70)
8b549816-5e44-4026-b3b0-e038701b0443	2	``Juicy'' is one for the first things which come to mind when I hear ``kernel' because juicy is one of the typical qualities of (a/an) kernel'.	``Spicy'' is one for the first things which come to mind when I hear ``chili_pepper' because spicy is one of the typical tastes of (a/an) chili_pepper'.	``Sweet'' is one for the first things which come to mind when I hear ``spinach' because sweet is one of the typical tastes of (a/an) spinach'.	5_pilot	1	https://app.prolific.co/submissions/complete?cc=460F6C9E	typical_of_concept-juicy-kernel	Agree or disagree (run5_pilot-experiment3-batch2-70-70)
4973adc7-2447-4a4a-8dc1-a6be9f4841be	2	I think it is impossible for (a/an) kernel to be juicy.	I think it is impossible for (a/an) steam to be solid.	I think it is impossible for (a/an) flame to be orange.	5_pilot	1	https://app.prolific.co/submissions/complete?cc=460F6C9E	impossible-juicy-kernel	Agree or disagree (run5_pilot-experiment3-batch2-70-70)
c08a1045-6a0b-49e4-acb0-592c8a256a88	2	I know that being juicy is necessary for many things (a/an) kernel does or is used for. 	I know that being pointy is necessary for many things (a/an) needle does or is used for. 	I know that being white is necessary for many things (a/an) t-shirt does or is used for. 	5_pilot	1	https://app.prolific.co/submissions/complete?cc=460F6C9E	affording_activity-juicy-kernel	Agree or disagree (run5_pilot-experiment3-batch2-70-70)
882fc487-9a7e-4011-8a4a-bf42f34352fc	2	I know that (a/an) kernel is juicy as most or all other things similar to (a/an) kernel are juicy. 	I know that (a/an) wine is liquid as most or all other things similar to (a/an) wine are liquid. 	I know that (a/an) bread is liquid as most or all other things similar to (a/an) bread are liquid. 	5_pilot	1	https://app.prolific.co/submissions/complete?cc=460F6C9E	implied_category-juicy-kernel	Agree or disagree (run5_pilot-experiment3-batch2-70-70)
69f8bb21-09f8-476d-a2ea-cac7dc94bf9c	2	You can find (a/an) ham which is juicy. Juicy is one of a few possible qualities (a/an) ham usually has. There is only a limited range of possible qualities.	You can find (a/an) apple which is green. Green is one of a few possible colors (a/an) apple usually has. There is only a limited range of possible colors.	You can find (a/an) car which is white. White is one of a few possible colors (a/an) car usually has. There is only a limited range of possible colors.	5_pilot	1	https://app.prolific.co/submissions/complete?cc=460F6C9E	variability_limited-juicy-ham	Agree or disagree (run5_pilot-experiment3-batch2-70-70)
3049f819-20b9-42ce-91cc-409ecfd2e1a7	2	I think it is impossible for (a/an) ham to be juicy.	I think it is impossible for (a/an) steam to be solid.	I think it is impossible for (a/an) flame to be orange.	5_pilot	1	https://app.prolific.co/submissions/complete?cc=460F6C9E	impossible-juicy-ham	Agree or disagree (run5_pilot-experiment3-batch2-70-70)
16ffacbc-4c0d-45c0-801f-0fc517faf08b	2	``Ham'' is one of the first things which come to mind when I hear ``juicy' because (a/an) ham is a typical example of things which are juicy'. 	``Mouse'' is one of the first things which come to mind when I hear ``small' because (a/an) mouse is a typical example of things which are small'. 	``Dog'' is one of the first things which come to mind when I hear ``small' because (a/an) dog is a typical example of things which are small'. 	5_pilot	1	https://app.prolific.co/submissions/complete?cc=460F6C9E	typical_of_property-juicy-ham	Agree or disagree (run5_pilot-experiment3-batch2-70-70)
47f1bfa0-397b-4db0-8adf-965177409b24	2	Usually, (a/an) ham is not juicy, but there could be a highly unusual situation in which (a/an) ham is juicy.	Usually, (a/an) chocolate is not pink, but there could be a highly unusual situation in which (a/an) chocolate is pink.	Usually, (a/an) chocolate is not brown, but there could be a highly unusual situation in which (a/an) chocolate is brown.	5_pilot	1	https://app.prolific.co/submissions/complete?cc=460F6C9E	unusual-juicy-ham	Agree or disagree (run5_pilot-experiment3-batch2-70-70)
8bafe246-3754-4550-a370-1997e377df17	2	I think (a/an) ham can be juicy, but this is rare or uncommon.	I think (a/an) snail can be purple, but this is rare or uncommon.	I think (a/an) bell pepper can be green, but this is rare or uncommon.	5_pilot	1	https://app.prolific.co/submissions/complete?cc=460F6C9E	rare-juicy-ham	Agree or disagree (run5_pilot-experiment3-batch2-70-70)
6fd79457-53dc-4de8-9ba4-48b0cc506a46	2	I could say (a/an) ham is juicy, but I would most certainly not mean it literally.	"I could say (a/an) anger is hot, but I would most certainly not mean it literally.
I could say (a/an) person is cold, but I would most certainly not mean it literally.
I could say (a/an) story is dark, but I would most certainly not mean it literally."	"I could say (a/an) fire is hot, but I would most certainly not mean it literally.
I could say (a/an) stone is heavy, but I would most certainly not mean it literally.
I could say (a/an) argument is liquid, but I would most certainly not mean it literally."	5_pilot	1	https://app.prolific.co/submissions/complete?cc=460F6C9E	creative-juicy-ham	Agree or disagree (run5_pilot-experiment3-batch2-70-70)
98677118-0d48-4619-a0cf-d87777ca7c51	2	I know that (a/an) ham is juicy as most or all other things similar to (a/an) ham are juicy. 	I know that (a/an) chocoloate_cake is sweet as most or all other things similar to (a/an) chocoloate_cake are sweet. 	I know that (a/an) table is transparent as most or all other things similar to (a/an) table are transparent. 	5_pilot	1	https://app.prolific.co/submissions/complete?cc=460F6C9E	implied_category-juicy-ham	Agree or disagree (run5_pilot-experiment3-batch2-70-70)
4f7bd47e-7c16-4405-aac4-11aaf4c25064	2	You can find (a/an) ham which is juicy. Juicy is one of many possible qualities (a/an) ham usually has. The range of qualities is almost unlimited. 	You can find (a/an) flower which is purple. Purple is one of many possible colors (a/an) flower usually has. The range of colors is almost unlimited. 	You can find (a/an) carrot which is orange. Orange is one of many possible colors (a/an) carrot usually has. The range of colors is almost unlimited. 	5_pilot	1	https://app.prolific.co/submissions/complete?cc=460F6C9E	variability_open-juicy-ham	Agree or disagree (run5_pilot-experiment3-batch2-70-70)
a692d3ff-e756-41bd-9b39-953795bb57ec	2	I know that being juicy is necessary for many things (a/an) ham does or is used for. 	I know that being bright is necessary for many things (a/an) flashlight does or is used for. 	I know that being grey is necessary for many things (a/an) car does or is used for. 	5_pilot	1	https://app.prolific.co/submissions/complete?cc=460F6C9E	affording_activity-juicy-ham	Agree or disagree (run5_pilot-experiment3-batch2-70-70)
6af89507-69c2-4644-986d-a72909a15cac	2	``Juicy'' is one for the first things which come to mind when I hear ``ham' because juicy is one of the typical qualities of (a/an) ham'.	``Bitter'' is one for the first things which come to mind when I hear ``coffee' because bitter is one of the typical tastes of (a/an) coffee'.	``Salty'' is one for the first things which come to mind when I hear ``beer' because salty is one of the typical tastes of (a/an) beer'.	5_pilot	1	https://app.prolific.co/submissions/complete?cc=460F6C9E	typical_of_concept-juicy-ham	Agree or disagree (run5_pilot-experiment3-batch2-70-70)
3208bce2-1b14-4bb4-bb6b-761fcede5550	2	I know that (a/an) gravy is used_in_cooking as most or all other things similar to (a/an) gravy are used_in_cooking. 	I know that (a/an) orange is healthy as most or all other things similar to (a/an) orange are healthy. 	I know that (a/an) strawberry is heavy as most or all other things similar to (a/an) strawberry are heavy. 	5_pilot	1	https://app.prolific.co/submissions/complete?cc=460F6C9E	implied_category-used_in_cooking-gravy	Agree or disagree (run5_pilot-experiment3-batch2-70-70)
ac40d463-b525-42f1-bacd-cf4f84b85204	2	``Gravy'' is one of the first things which come to mind when I hear ``used_in_cooking' because (a/an) gravy is a typical example of things which are used_in_cooking'. 	``Movie_star'' is one of the first things which come to mind when I hear ``famous' because (a/an) movie_star is a typical example of things which are famous'. 	``Mug'' is one of the first things which come to mind when I hear ``expensive' because (a/an) mug is a typical example of things which are expensive'. 	5_pilot	1	https://app.prolific.co/submissions/complete?cc=460F6C9E	typical_of_property-used_in_cooking-gravy	Agree or disagree (run5_pilot-experiment3-batch2-70-70)
64c48c52-3287-4c4e-9256-1fe08f52550d	2	I think it is impossible for (a/an) gravy to be used_in_cooking.	I think it is impossible for (a/an) stone to be intelligent.	I think it is impossible for (a/an) doctor to be sick.	5_pilot	1	https://app.prolific.co/submissions/complete?cc=460F6C9E	impossible-used_in_cooking-gravy	Agree or disagree (run5_pilot-experiment3-batch2-70-70)
49a704a7-3cb4-41f6-8aaf-de1ef68d1197	2	You can find (a/an) gravy which is used_in_cooking. Used_in_cooking is one of many possible uses (a/an) gravy usually has. The range of uses is almost unlimited. 	You can find (a/an) flower which is purple. Purple is one of many possible colors (a/an) flower usually has. The range of colors is almost unlimited. 	You can find (a/an) carrot which is orange. Orange is one of many possible colors (a/an) carrot usually has. The range of colors is almost unlimited. 	5_pilot	1	https://app.prolific.co/submissions/complete?cc=460F6C9E	variability_open-used_in_cooking-gravy	Agree or disagree (run5_pilot-experiment3-batch2-70-70)
eb76ff54-444d-4678-9258-5cf2fcbd9e26	2	Usually, (a/an) gravy is not used_in_cooking, but there could be a highly unusual situation in which (a/an) gravy is used_in_cooking.	Usually, (a/an) beer is not green, but there could be a highly unusual situation in which (a/an) beer is green.	Usually, (a/an) beer is not brown, but there could be a highly unusual situation in which (a/an) beer is brown.	5_pilot	1	https://app.prolific.co/submissions/complete?cc=460F6C9E	unusual-used_in_cooking-gravy	Agree or disagree (run5_pilot-experiment3-batch2-70-70)
