quid	listNr	description	exampleTrue	exampleFalse	run	subList	completionUrl	triple	name
9465aa89-d7b9-41c4-92d3-ef0ed21e92b6	2	I know that being used_in_cooking is necessary for many things (a/an) gravy does or is used for. 	I know that being pointy is necessary for many things (a/an) needle does or is used for. 	I know that being white is necessary for many things (a/an) t-shirt does or is used for. 	5_pilot	1	https://app.prolific.co/submissions/complete?cc=460F6C9E	affording_activity-used_in_cooking-gravy	Agree or disagree (run5_pilot-experiment3-batch2-70-70)
70672d5b-d5d5-4dcc-a98d-6260805341d4	2	``Used_in_cooking'' is one for the first things which come to mind when I hear ``gravy' because used_in_cooking is one of the typical uses of (a/an) gravy'.	``Heavy'' is one for the first things which come to mind when I hear ``rock' because heavy is one of the typical qualities of (a/an) rock'.	``Green'' is one for the first things which come to mind when I hear ``raspberry' because green is one of the typical colors of (a/an) raspberry'.	5_pilot	1	https://app.prolific.co/submissions/complete?cc=460F6C9E	typical_of_concept-used_in_cooking-gravy	Agree or disagree (run5_pilot-experiment3-batch2-70-70)
686e20a7-e25c-4195-b44e-3fb1f5e36093	2	You can find (a/an) gravy which is used_in_cooking. Used_in_cooking is one of a few possible uses (a/an) gravy usually has. There is only a limited range of possible uses.	You can find (a/an) apple which is green. Green is one of a few possible colors (a/an) apple usually has. There is only a limited range of possible colors.	You can find (a/an) car which is white. White is one of a few possible colors (a/an) car usually has. There is only a limited range of possible colors.	5_pilot	1	https://app.prolific.co/submissions/complete?cc=460F6C9E	variability_limited-used_in_cooking-gravy	Agree or disagree (run5_pilot-experiment3-batch2-70-70)
8004e78a-23eb-4c42-9b5e-9ac168d8cecc	2	I think (a/an) gravy can be used_in_cooking, but this is rare or uncommon.	I think (a/an) snail can be purple, but this is rare or uncommon.	I think (a/an) bell_pepper can be green, but this is rare or uncommon.	5_pilot	1	https://app.prolific.co/submissions/complete?cc=460F6C9E	rare-used_in_cooking-gravy	Agree or disagree (run5_pilot-experiment3-batch2-70-70)
03c162d8-1871-4bb9-8323-5e201ebec6da	2	I could say (a/an) gravy is used_in_cooking, but I would most certainly not mean it literally.	"I could say (a/an) computer is dying, but I would most certainly not mean it literally.
I could say (a/an) idea is alive, but I would most certainly not mean it literally.
I could say (a/an) thought is toxic, but I would most certainly not mean it literally."	"I could say (a/an) pet is dying, but I would most certainly not mean it literally.
I could say (a/an) dog is alive, but I would most certainly not mean it literally.
I could say (a/an) substance is toxic, but I would most certainly not mean it literally."	5_pilot	1	https://app.prolific.co/submissions/complete?cc=460F6C9E	creative-used_in_cooking-gravy	Agree or disagree (run5_pilot-experiment3-batch2-70-70)
test3_true	2	You can find (a/an) t-shirt which is grey. Grey is one of many possible colors (a/an) t-shirt usually has. The range of colors is almost unlimited. 	You can find (a/an) flower which is purple. Purple is one of many possible colors (a/an) flower usually has. The range of colors is almost unlimited. 	You can find (a/an) carrot which is orange. Orange is one of many possible colors (a/an) carrot usually has. The range of colors is almost unlimited. 	5_pilot	1	https://app.prolific.co/submissions/complete?cc=460F6C9E	variability_open-grey-t-shirt	Agree or disagree (run5_pilot-experiment3-batch2-70-70)
test1_false	2	``Pink'' is one for the first things which come to mind when I hear ``grass' because pink is one of the typical colors of (a/an) grass'.	``Spicy'' is one for the first things which come to mind when I hear ``chili_pepper' because spicy is one of the typical tastes of (a/an) chili_pepper'.	``Sweet'' is one for the first things which come to mind when I hear ``spinach' because sweet is one of the typical tastes of (a/an) spinach'.	5_pilot	1	https://app.prolific.co/submissions/complete?cc=460F6C9E	typical_of_concept-pink-grass	Agree or disagree (run5_pilot-experiment3-batch2-70-70)
