quid	description	exampleTrue	exampleFalse	run	subList	completionUrl	triple	name
aecdbb82-8ea7-4587-9a79-50707ed9d7b4	I know that being hot is necessary for many things (a/an) pie does or is used for. 	I know that being sharp is necessary for many things (a/an) razor does or is used for. 	I know that being colorful is necessary for many things (a/an) dress does or is used for. 	4	1	https://app.prolific.co/submissions/complete?cc=483CB423	affording_activity-hot-pie	Agree or disagree (run4-experiment2-batch133-70-70)
487a1c13-a68d-491a-9c5d-043515d94293	I could say (a/an) pie is hot, but I would most certainly not mean it literally.	"I could say (a/an) anger is hot, but I would most certainly not mean it literally.
I could say (a/an) person is cold, but I would most certainly not mean it literally.
I could say (a/an) story is dark, but I would most certainly not mean it literally."	"I could say (a/an) fire is hot, but I would most certainly not mean it literally.
I could say (a/an) stone is heavy, but I would most certainly not mean it literally.
I could say (a/an) argument is liquid, but I would most certainly not mean it literally."	4	1	https://app.prolific.co/submissions/complete?cc=483CB423	creative-hot-pie	Agree or disagree (run4-experiment2-batch133-70-70)
e874c10c-c74e-4258-9640-942ab305e7bb	Usually, (a/an) pie is not hot, but there could be a highly unusual situation in which (a/an) pie is hot.	Usually, (a/an) pony is not blue, but there could be a highly unusual situation in which (a/an) pony is blue.	Usually, (a/an) razor is not sharp, but there could be a highly unusual situation in which (a/an) razor is sharp.	4	1	https://app.prolific.co/submissions/complete?cc=483CB423	unusual-hot-pie	Agree or disagree (run4-experiment2-batch133-70-70)
5b707ae2-3788-42a0-9e9f-7375a916b2b5	``Pie'' is one of the first things which come to mind when I hear ``hot' because (a/an) pie is a typical example of things which are hot'. 	``Snow'' is one of the first things which come to mind when I hear ``white' because (a/an) snow is a typical example of things which are white'. 	``Water'' is one of the first things which come to mind when I hear ``grey' because (a/an) water is a typical example of things which are grey'. 	4	1	https://app.prolific.co/submissions/complete?cc=483CB423	typical_of_property-hot-pie	Agree or disagree (run4-experiment2-batch133-70-70)
3a6f3d96-b893-4d14-b5f3-0e9a596268f4	You can find (a/an) pie which is hot. (A/an) pie is usually either hot or not hot. It cannot be a bit more or less hot.	You can find (a/an) substance which is liquid. (A/an) substance is usually either liquid or not liquid. It cannot be a bit more or less liquid.	You can find (a/an) knife which is sharp. (A/an) knife is usually either sharp or not sharp. It cannot be a bit more or less sharp.	4	1	https://app.prolific.co/submissions/complete?cc=483CB423	variability_limited-hot-pie	Agree or disagree (run4-experiment2-batch133-70-70)
0ff4fc4f-b6f9-4503-8224-4de29b74dfaa	I think (a/an) pie can be hot, but this is rare or uncommon.	I think (a/an) chocolate can be salty, but this is rare or uncommon.	I think (a/an) cherry can be salty, but this is rare or uncommon.	4	1	https://app.prolific.co/submissions/complete?cc=483CB423	rare-hot-pie	Agree or disagree (run4-experiment2-batch133-70-70)
47c9af64-7356-44b5-a612-3c555178b4de	I think it is impossible for (a/an) pie to be hot.	I think it is impossible for (a/an) flame to be frozen.	I think it is impossible for (a/an) book to be light.	4	1	https://app.prolific.co/submissions/complete?cc=483CB423	impossible-hot-pie	Agree or disagree (run4-experiment2-batch133-70-70)
6b1ba46e-6243-4eb6-bbff-098da856541f	I know that (a/an) pie is hot as most or all other things similar to (a/an) pie are hot. 	I know that (a/an) chocoloate_bar is sweet as most or all other things similar to (a/an) chocoloate_bar are sweet. 	I know that (a/an) dress is white as most or all other things similar to (a/an) dress are white. 	4	1	https://app.prolific.co/submissions/complete?cc=483CB423	implied_category-hot-pie	Agree or disagree (run4-experiment2-batch133-70-70)
0ddf0d5c-c98c-413e-840b-ac1206b6d34e	``Hot'' is one for the first things which come to mind when I hear ``pie' because hot is one of the typical temperatures of (a/an) pie'.	``Bitter'' is one for the first things which come to mind when I hear ``coffee' because bitter is one of the typical tastes of (a/an) coffee'.	``Salty'' is one for the first things which come to mind when I hear ``beer' because salty is one of the typical tastes of (a/an) beer'.	4	1	https://app.prolific.co/submissions/complete?cc=483CB423	typical_of_concept-hot-pie	Agree or disagree (run4-experiment2-batch133-70-70)
d320b5d0-b3d6-4306-813e-cfab1a9d1a74	You can find (a/an) pie which is hot. (A/an) pie is usually either hot, a bit more or less hot or the opposite of hot.	You can find (a/an) knife which is sharp. (A/an) knife is usually either sharp, a bit more or less sharp or the opposite of sharp.	You can find (a/an) substance which is solid. (A/an) substance is usually either solid, a bit more or less solid or the opposite of solid.	4	1	https://app.prolific.co/submissions/complete?cc=483CB423	variability_open-hot-pie	Agree or disagree (run4-experiment2-batch133-70-70)
1a1d3568-c1a1-40ba-99eb-5ce0ab7426e5	I know that (a/an) hornet is yellow as most or all other things similar to (a/an) hornet are yellow. 	I know that (a/an) chocoloate_cake is sweet as most or all other things similar to (a/an) chocoloate_cake are sweet. 	I know that (a/an) table is transparent as most or all other things similar to (a/an) table are transparent. 	4	1	https://app.prolific.co/submissions/complete?cc=483CB423	implied_category-yellow-hornet	Agree or disagree (run4-experiment2-batch133-70-70)
82837950-534a-4db2-ad28-35c4731d660c	I know that being yellow is necessary for many things (a/an) hornet does or is used for. 	I know that being pointy is necessary for many things (a/an) needle does or is used for. 	I know that being white is necessary for many things (a/an) t-shirt does or is used for. 	4	1	https://app.prolific.co/submissions/complete?cc=483CB423	affording_activity-yellow-hornet	Agree or disagree (run4-experiment2-batch133-70-70)
86695a48-b320-4b9c-a117-150aaf715e1d	``Hornet'' is one of the first things which come to mind when I hear ``yellow' because (a/an) hornet is a typical example of things which are yellow'. 	``Snow'' is one of the first things which come to mind when I hear ``white' because (a/an) snow is a typical example of things which are white'. 	``Water'' is one of the first things which come to mind when I hear ``grey' because (a/an) water is a typical example of things which are grey'. 	4	1	https://app.prolific.co/submissions/complete?cc=483CB423	typical_of_property-yellow-hornet	Agree or disagree (run4-experiment2-batch133-70-70)
2873df69-f1c9-43ba-a7d0-69733c90fe82	You can find (a/an) hornet which is yellow. Yellow is one of a few possible colors (a/an) hornet usually has. There is only a limited range of possible colors.	You can find (a/an) apple which is green. Green is one of a few possible colors (a/an) apple usually has. There is only a limited range of possible colors.	You can find (a/an) car which is white. White is one of a few possible colors (a/an) car usually has. There is only a limited range of possible colors.	4	1	https://app.prolific.co/submissions/complete?cc=483CB423	variability_limited-yellow-hornet	Agree or disagree (run4-experiment2-batch133-70-70)
35b6f69a-5309-4170-bfa5-d66f8d626976	You can find (a/an) hornet which is yellow. Yellow is one of many possible colors (a/an) hornet usually has. The range of colors is almost unlimited. 	You can find (a/an) flower which is purple. Purple is one of many possible colors (a/an) flower usually has. The range of colors is almost unlimited. 	You can find (a/an) carrot which is orange. Orange is one of many possible colors (a/an) carrot usually has. The range of colors is almost unlimited. 	4	1	https://app.prolific.co/submissions/complete?cc=483CB423	variability_open-yellow-hornet	Agree or disagree (run4-experiment2-batch133-70-70)
ee7c609a-3ead-46ca-bd7c-563befed0441	``Yellow'' is one for the first things which come to mind when I hear ``hornet' because yellow is one of the typical colors of (a/an) hornet'.	``Spicy'' is one for the first things which come to mind when I hear ``chili_pepper' because spicy is one of the typical tastes of (a/an) chili_pepper'.	``Sweet'' is one for the first things which come to mind when I hear ``spinach' because sweet is one of the typical tastes of (a/an) spinach'.	4	1	https://app.prolific.co/submissions/complete?cc=483CB423	typical_of_concept-yellow-hornet	Agree or disagree (run4-experiment2-batch133-70-70)
0972cfe9-0641-4a4f-86f5-57ae33b6a088	``Black'' is one for the first things which come to mind when I hear ``umbrella' because black is one of the typical colors of (a/an) umbrella'.	``Spicy'' is one for the first things which come to mind when I hear ``chili_pepper' because spicy is one of the typical tastes of (a/an) chili_pepper'.	``Sweet'' is one for the first things which come to mind when I hear ``spinach' because sweet is one of the typical tastes of (a/an) spinach'.	4	1	https://app.prolific.co/submissions/complete?cc=483CB423	typical_of_concept-black-umbrella	Agree or disagree (run4-experiment2-batch133-70-70)
b47d3759-05f6-472a-99b3-1e9597eb351a	You can find (a/an) umbrella which is black. Black is one of many possible colors (a/an) umbrella usually has. The range of colors is almost unlimited. 	You can find (a/an) t-shirt which is white. White is one of many possible colors (a/an) t-shirt usually has. The range of colors is almost unlimited. 	You can find (a/an) pepper which is green. Green is one of many possible colors (a/an) pepper usually has. The range of colors is almost unlimited. 	4	1	https://app.prolific.co/submissions/complete?cc=483CB423	variability_open-black-umbrella	Agree or disagree (run4-experiment2-batch133-70-70)
7e70f50e-39d8-415e-b485-d0a29bf0a7b0	You can find (a/an) umbrella which is black. Black is one of a few possible colors (a/an) umbrella usually has. There is only a limited range of possible colors.	You can find (a/an) pepper which is red. Red is one of a few possible colors (a/an) pepper usually has. There is only a limited range of possible colors.	You can find (a/an) t-shirt which is red. Red is one of a few possible colors (a/an) t-shirt usually has. There is only a limited range of possible colors.	4	1	https://app.prolific.co/submissions/complete?cc=483CB423	variability_limited-black-umbrella	Agree or disagree (run4-experiment2-batch133-70-70)
50f0fede-4ef4-458e-93df-2cde869ca686	I think it is impossible for (a/an) umbrella to be black.	I think it is impossible for (a/an) flame to be frozen.	I think it is impossible for (a/an) book to be light.	4	1	https://app.prolific.co/submissions/complete?cc=483CB423	impossible-black-umbrella	Agree or disagree (run4-experiment2-batch133-70-70)
393fe38d-ff46-4259-acc2-8c1b40f7ca03	``Umbrella'' is one of the first things which come to mind when I hear ``black' because (a/an) umbrella is a typical example of things which are black'. 	``Rainbow'' is one of the first things which come to mind when I hear ``colorful' because (a/an) rainbow is a typical example of things which are colorful'. 	``Table'' is one of the first things which come to mind when I hear ``white' because (a/an) table is a typical example of things which are white'. 	4	1	https://app.prolific.co/submissions/complete?cc=483CB423	typical_of_property-black-umbrella	Agree or disagree (run4-experiment2-batch133-70-70)
caad47b6-a1a1-4281-be55-accefc9aef76	I could say (a/an) umbrella is black, but I would most certainly not mean it literally.	"I could say (a/an) anger is hot, but I would most certainly not mean it literally.
I could say (a/an) person is cold, but I would most certainly not mean it literally.
I could say (a/an) story is dark, but I would most certainly not mean it literally."	"I could say (a/an) fire is hot, but I would most certainly not mean it literally.
I could say (a/an) stone is heavy, but I would most certainly not mean it literally.
I could say (a/an) argument is liquid, but I would most certainly not mean it literally."	4	1	https://app.prolific.co/submissions/complete?cc=483CB423	creative-black-umbrella	Agree or disagree (run4-experiment2-batch133-70-70)
0c331eaa-64ab-4f0d-9e9f-0d06e9dc4f94	I know that being black is necessary for many things (a/an) umbrella does or is used for. 	I know that being bright is necessary for many things (a/an) flashlight does or is used for. 	I know that being grey is necessary for many things (a/an) car does or is used for. 	4	1	https://app.prolific.co/submissions/complete?cc=483CB423	affording_activity-black-umbrella	Agree or disagree (run4-experiment2-batch133-70-70)
4383864c-39f7-4a5e-9c71-c7bf43b0b1f4	Usually, (a/an) umbrella is not black, but there could be a highly unusual situation in which (a/an) umbrella is black.	Usually, (a/an) chocolate is not pink, but there could be a highly unusual situation in which (a/an) chocolate is pink.	Usually, (a/an) chocolate is not brown, but there could be a highly unusual situation in which (a/an) chocolate is brown.	4	1	https://app.prolific.co/submissions/complete?cc=483CB423	unusual-black-umbrella	Agree or disagree (run4-experiment2-batch133-70-70)
be8f98cc-f7da-4b64-b1db-6687b38641b2	I think (a/an) umbrella can be black, but this is rare or uncommon.	I think (a/an) snail can be purple, but this is rare or uncommon.	I think (a/an) bell pepper can be green, but this is rare or uncommon.	4	1	https://app.prolific.co/submissions/complete?cc=483CB423	rare-black-umbrella	Agree or disagree (run4-experiment2-batch133-70-70)
861af176-527f-4de4-8096-147280fbc1a9	I know that (a/an) umbrella is black as most or all other things similar to (a/an) umbrella are black. 	I know that (a/an) cotten_candy is sweet as most or all other things similar to (a/an) cotten_candy are sweet. 	I know that (a/an) dress is white as most or all other things similar to (a/an) dress are white. 	4	1	https://app.prolific.co/submissions/complete?cc=483CB423	implied_category-black-umbrella	Agree or disagree (run4-experiment2-batch133-70-70)
895a672e-f8d8-475d-9a6a-459b1785cfd9	I know that all or most lynx(s) lay_eggs regularly or are used for laying eggs regularly. 	I know that all or most candle(s) burn regularly or are used for burning regularly. 	I know that all or most T-shirt(s) wrap regularly or are used for wraping regularly. 	4	1	https://app.prolific.co/submissions/complete?cc=483CB423	afforded_usual-lay_eggs-lynx	Agree or disagree (run4-experiment2-batch133-70-70)
1a35f30c-b3e0-4a7d-89da-2dc2000e8aa7	``Lynx'' is one of the first things which come to mind when I hear ``lay_eggs' because (a/an) lynx is a typical example of things which lay_eggs/are used for laying eggs'. 	``Cat'' is one of the first things which come to mind when I hear ``purr' because (a/an) cat is a typical example of things which purr/are used for purring'. 	``Dog'' is one of the first things which come to mind when I hear ``run' because (a/an) dog is a typical example of things which run/are used for runing'. 	4	1	https://app.prolific.co/submissions/complete?cc=483CB423	typical_of_property-lay_eggs-lynx	Agree or disagree (run4-experiment2-batch133-70-70)
6671c87f-0ed5-4d06-b033-b4568799fc81	I think there is a lynx  which can lay_eggs/be used for laying eggs, but this is rare or uncommon.	I think there is a student  which can teach/be used for teaching, but this is rare or uncommon.	I think there is a teacher  which can teach/be used for teaching, but this is rare or uncommon.	4	1	https://app.prolific.co/submissions/complete?cc=483CB423	rare-lay_eggs-lynx	Agree or disagree (run4-experiment2-batch133-70-70)
d2ab15dd-ae7b-45c1-b0ca-ff8ef2073734	You can find (a/an) lynx which can lay_eggs/be used for laying eggs. This distinguishes a certain type of lynx from others. 	You can find (a/an) dog which can hunt/be used for hunting. This distinguishes a certain type of dog from others. 	You can find (a/an) dog which can breathe/be used for breathing. This distinguishes a certain type of dog from others. 	4	1	https://app.prolific.co/submissions/complete?cc=483CB423	variability_limited-lay_eggs-lynx	Agree or disagree (run4-experiment2-batch133-70-70)
2bf8ae5e-36e0-4968-9a49-c8fe3da85072	I know that (a/an) lynx can lay_eggs/be used for laying eggs as most or all other things similar to (a/an) lynx lay_eggs. 	I know that (a/an) dog can breathe/be used for breathing as most or all other things similar to (a/an) dog breathe. 	I know that (a/an) cat can meow/be used for meowing as most or all other things similar to (a/an) cat meow. 	4	1	https://app.prolific.co/submissions/complete?cc=483CB423	implied_category-lay_eggs-lynx	Agree or disagree (run4-experiment2-batch133-70-70)
3d34c3fb-b28b-4802-a5d1-562f72fb1394	I think it is impossible for (a/an) lynx to lay_eggs/be used for laying eggs.	I think it is impossible for (a/an) rock to float/be used for floating.	I think it is impossible for (a/an) metal to melt/be used for melting.	4	1	https://app.prolific.co/submissions/complete?cc=483CB423	impossible-lay_eggs-lynx	Agree or disagree (run4-experiment2-batch133-70-70)
b9a5415e-9c0c-4740-aaa6-68e41d53bbf7	Usually, (a/an) lynx cannot lay_eggs/be used for laying eggs, but there could be a highly unusual situation in which (a/an) lynx can lay_eggs.	Usually, (a/an) rat cannot cook/be used for cooking, but there could be a highly unusual situation in which (a/an) rat can cook.	Usually, (a/an) teacher cannot teach/be used for teaching, but there could be a highly unusual situation in which (a/an) teacher can teach.	4	1	https://app.prolific.co/submissions/complete?cc=483CB423	unusual-lay_eggs-lynx	Agree or disagree (run4-experiment2-batch133-70-70)
78d9827d-fd01-4208-86dc-ea36280c35fd	All or most  lynx(s) can lay_eggs/be used for laying eggs. This is not what they normally do or are used for. 	All or most  fork(s) can fight/be used for fighting. This is not what they normally do or are used for. 	All or most  brush(s) can fly/be used for flying. This is not what they normally do or are used for. 	4	1	https://app.prolific.co/submissions/complete?cc=483CB423	afforded_unusual-lay_eggs-lynx	Agree or disagree (run4-experiment2-batch133-70-70)
eb1951b0-5452-4ce4-ac74-8f73517c8147	I could say (a/an) lynx lays eggs/is used for laying eggs, but I would most certainly not mean it literally.	"I could say (a/an) idea grows/is used for growing, but I would most certainly not mean it literally.
I could say (a/an) person glows/is used for glowing, but I would most certainly not mean it literally.
I could say (a/an) thought burns/is used for burning, but I would most certainly not mean it literally."	"I could say (a/an) plant grows/is used for growing, but I would most certainly not mean it literally.
I could say (a/an) situation smiles/is used for smileing, but I would most certainly not mean it literally.
I could say (a/an) candle burns/is used for burning, but I would most certainly not mean it literally."	4	1	https://app.prolific.co/submissions/complete?cc=483CB423	creative-lay_eggs-lynx	Agree or disagree (run4-experiment2-batch133-70-70)
b14b59cb-953c-497c-8af0-4729f8175d68	``Lay_eggs'' is one for the first things which come to mind when I hear ``lynx' because laying eggs is one of the typical activities of (a/an) lynx'.	``Poke'' is one for the first things which come to mind when I hear ``needle' because pokeing is one of the typical activities of (a/an) needle'.	``Cut'' is one for the first things which come to mind when I hear ``brush' because cuting is one of the typical activities of (a/an) brush'.	4	1	https://app.prolific.co/submissions/complete?cc=483CB423	typical_of_concept-lay_eggs-lynx	Agree or disagree (run4-experiment2-batch133-70-70)
c9432a37-eb38-4776-8046-4f6291a35d1a	``Centerboard'' is one of the first things which come to mind when I hear ``made_of_wood' because (a/an) centerboard is a typical example of things which are (a/an) made_of_wood'. 	``Bread'' is one of the first things which come to mind when I hear ``made_of_grain' because (a/an) bread is a typical example of things which are (a/an) made_of_grain'. 	``Cake'' is one of the first things which come to mind when I hear ``made_of_grain' because (a/an) cake is a typical example of things which are (a/an) made_of_grain'. 	4	1	https://app.prolific.co/submissions/complete?cc=483CB423	typical_of_property-made_of_wood-centerboard	Agree or disagree (run4-experiment2-batch133-70-70)
9f8b87cb-f995-46ea-a609-ac10bc511a9a	I think (a/an) centerboard can is made_of_wood, but this is rare or uncommon.	I think (a/an) wine_glass can is made_of_plastic, but this is rare or uncommon.	I think (a/an) wine_glass can is made_of_glass, but this is rare or uncommon.	4	1	https://app.prolific.co/submissions/complete?cc=483CB423	rare-made_of_wood-centerboard	Agree or disagree (run4-experiment2-batch133-70-70)
bdf71243-b023-442f-887c-3d28af5693a4	``Made_of_wood'' is one for the first things which come to mind when I hear ``centerboard' because made_of_wood is one of the typical materials of (a/an) centerboard'.	``Made_of_china'' is one for the first things which come to mind when I hear ``plate' because made_of_china is one of the typical materials of (a/an) plate'.	``Made_of_wood'' is one for the first things which come to mind when I hear ``wine_glass' because made_of_wood is one of the typical materials of (a/an) wine_glass'.	4	1	https://app.prolific.co/submissions/complete?cc=483CB423	typical_of_concept-made_of_wood-centerboard	Agree or disagree (run4-experiment2-batch133-70-70)
ba64018c-c3a2-44c4-95d3-d39421fa58df	Usually, (a/an) centerboard is not made_of_wood, but there could be a highly unusual situation in which (a/an) centerboard are made_of_wood.	Usually, (a/an) skirt is not made_of_paper, but there could be a highly unusual situation in which (a/an) skirt are made_of_paper.	Usually, (a/an) cup is not made_of_paper, but there could be a highly unusual situation in which (a/an) cup are made_of_paper.	4	1	https://app.prolific.co/submissions/complete?cc=483CB423	unusual-made_of_wood-centerboard	Agree or disagree (run4-experiment2-batch133-70-70)
5aa96d2b-5daf-41e8-b8cd-48bf9dea5e93	I think it is impossible for (a/an) centerboard to be made_of_wood.	I think it is impossible for (a/an) mirror to be made_of_cotton.	I think it is impossible for (a/an) dress to be made_of_plastic.	4	1	https://app.prolific.co/submissions/complete?cc=483CB423	impossible-made_of_wood-centerboard	Agree or disagree (run4-experiment2-batch133-70-70)
1802bb54-a8a5-409b-bcaa-15a3715911d1	I know that (a/an) centerboard is made_of_wood as most or all other things similar to (a/an) centerboard are made_of_wood. 	I know that (a/an) sock is made_of_fabric as most or all other things similar to (a/an) sock are made_of_fabric. 	I know that (a/an) fork is made_of_gold as most or all other things similar to (a/an) fork are made_of_gold. 	4	1	https://app.prolific.co/submissions/complete?cc=483CB423	implied_category-made_of_wood-centerboard	Agree or disagree (run4-experiment2-batch133-70-70)
faef3418-9718-4d4b-8603-0413a970b95e	You can find (a/an) centerboard which is made_of_wood. Made_of_wood is one of a few possible materials (a/an) centerboard is usually made of. There is only a limited range of possible materials.	You can find (a/an) knife which is made_of_metal. Made_of_metal is one of a few possible materials (a/an) knife is usually made of. There is only a limited range of possible materials.	You can find (a/an) car which is made_of_cotton. Made_of_cotton is one of a few possible fibers (a/an) car is usually made of. There is only a limited range of possible fibers.	4	1	https://app.prolific.co/submissions/complete?cc=483CB423	variability_limited-made_of_wood-centerboard	Agree or disagree (run4-experiment2-batch133-70-70)
b0252584-d669-4b56-a1e8-fa5dd62fa844	I know that being made_of_wood is necessary for many things (a/an) centerboard does or is used for. 	I know that having (a/an) bright is necessary for many things (a/an) flashlight does or is used for. 	I know that having (a/an) grey is necessary for many things (a/an) car does or is used for. 	4	1	https://app.prolific.co/submissions/complete?cc=483CB423	affording_activity-made_of_wood-centerboard	Agree or disagree (run4-experiment2-batch133-70-70)
85222aff-0894-45b0-a1f4-7c316c017ec0	You can find (a/an) centerboard which is made_of_wood. Made_of_wood is one of many possible materials (a/an) centerboard is usually made of. The range of materials is almost unlimited. 	You can find (a/an) bouquet which is made_of_roses. Made_of_roses is one of many possible flowers (a/an) bouquet is usually made of. The range of flowers is almost unlimited. 	You can find (a/an) knife which is made_of_metal. Made_of_metal is one of many possible materials (a/an) knife is usually made of. The range of materials is almost unlimited. 	4	1	https://app.prolific.co/submissions/complete?cc=483CB423	variability_open-made_of_wood-centerboard	Agree or disagree (run4-experiment2-batch133-70-70)
