quid	description	exampleTrue	exampleFalse	run	subList	completionUrl	triple	name
ff885881-7aa2-4736-9c0f-7ef5cc040f23	I think (a/an) mussel can be black, but this is rare or uncommon.	I think (a/an) rose can be black, but this is rare or uncommon.	I think (a/an) rose can be yellow, but this is rare or uncommon.	4	1	https://app.prolific.co/submissions/complete?cc=5D88FF27	rare-black-mussel	Agree or disagree (run4-experiment2-batch15-70-70)
95628469-5983-4b1a-a2c6-43968e2f2029	You can find (a/an) mussel which is black. Black is one of many possible colors (a/an) mussel usually has. The range of colors is almost unlimited. 	You can find (a/an) dress which is white. White is one of many possible colors (a/an) dress usually has. The range of colors is almost unlimited. 	You can find (a/an) pea which is green. Green is one of many possible colors (a/an) pea usually has. The range of colors is almost unlimited. 	4	1	https://app.prolific.co/submissions/complete?cc=5D88FF27	variability_open-black-mussel	Agree or disagree (run4-experiment2-batch15-70-70)
0aecc98f-b3f3-4120-9d82-af3c4b78c7ee	``Mussel'' is one of the first things which come to mind when I hear ``black' because (a/an) mussel is a typical example of things which are black'. 	``Snow'' is one of the first things which come to mind when I hear ``white' because (a/an) snow is a typical example of things which are white'. 	``Water'' is one of the first things which come to mind when I hear ``grey' because (a/an) water is a typical example of things which are grey'. 	4	1	https://app.prolific.co/submissions/complete?cc=5D88FF27	typical_of_property-black-mussel	Agree or disagree (run4-experiment2-batch15-70-70)
144d40a0-78e7-40b8-86e2-2ae5d04af5fc	I know that being black is necessary for many things (a/an) mussel does or is used for. 	I know that being bright is necessary for many things (a/an) flashlight does or is used for. 	I know that being grey is necessary for many things (a/an) car does or is used for. 	4	1	https://app.prolific.co/submissions/complete?cc=5D88FF27	affording_activity-black-mussel	Agree or disagree (run4-experiment2-batch15-70-70)
a24765b2-e71b-40d9-918f-fb400f4937fd	I could say (a/an) mussel is black, but I would most certainly not mean it literally.	"I could say (a/an) anger is hot, but I would most certainly not mean it literally.
I could say (a/an) person is cold, but I would most certainly not mean it literally.
I could say (a/an) story is dark, but I would most certainly not mean it literally."	"I could say (a/an) fire is hot, but I would most certainly not mean it literally.
I could say (a/an) stone is heavy, but I would most certainly not mean it literally.
I could say (a/an) argument is liquid, but I would most certainly not mean it literally."	4	1	https://app.prolific.co/submissions/complete?cc=5D88FF27	creative-black-mussel	Agree or disagree (run4-experiment2-batch15-70-70)
b24dfdbb-b90c-469b-883e-d868dbda0b50	You can find (a/an) mussel which is black. Black is one of a few possible colors (a/an) mussel usually has. There is only a limited range of possible colors.	You can find (a/an) apple which is green. Green is one of a few possible colors (a/an) apple usually has. There is only a limited range of possible colors.	You can find (a/an) car which is white. White is one of a few possible colors (a/an) car usually has. There is only a limited range of possible colors.	4	1	https://app.prolific.co/submissions/complete?cc=5D88FF27	variability_limited-black-mussel	Agree or disagree (run4-experiment2-batch15-70-70)
ef92dac3-d462-4f86-abc2-cfb1c70f2144	Usually, (a/an) mussel is not black, but there could be a highly unusual situation in which (a/an) mussel is black.	Usually, (a/an) pony is not blue, but there could be a highly unusual situation in which (a/an) pony is blue.	Usually, (a/an) beer is not brown, but there could be a highly unusual situation in which (a/an) beer is brown.	4	1	https://app.prolific.co/submissions/complete?cc=5D88FF27	unusual-black-mussel	Agree or disagree (run4-experiment2-batch15-70-70)
e966af1c-6267-4a45-95a4-6219ea8137e5	I know that (a/an) mussel is black as most or all other things similar to (a/an) mussel are black. 	I know that (a/an) cotten_candy is sweet as most or all other things similar to (a/an) cotten_candy are sweet. 	I know that (a/an) dress is white as most or all other things similar to (a/an) dress are white. 	4	1	https://app.prolific.co/submissions/complete?cc=5D88FF27	implied_category-black-mussel	Agree or disagree (run4-experiment2-batch15-70-70)
09f651c8-6cdf-4974-bca0-ac121dbc226c	I know that (a/an) humankind can lay_eggs/be used for laying eggs as most or all other things similar to (a/an) humankind lay_eggs. 	I know that (a/an) apple_tree can grow/be used for growing as most or all other things similar to (a/an) apple_tree grow. 	I know that (a/an) worm can run/be used for runing as most or all other things similar to (a/an) worm run. 	4	1	https://app.prolific.co/submissions/complete?cc=5D88FF27	implied_category-lay_eggs-humankind	Agree or disagree (run4-experiment2-batch15-70-70)
05959a98-34a3-470f-bf92-253a0148ccd1	Usually, (a/an) humankind cannot lay_eggs/be used for laying eggs, but there could be a highly unusual situation in which (a/an) humankind can lay_eggs.	Usually, (a/an) dog cannot speak/be used for speaking, but there could be a highly unusual situation in which (a/an) dog can speak.	Usually, (a/an) dog cannot bark/be used for barking, but there could be a highly unusual situation in which (a/an) dog can bark.	4	1	https://app.prolific.co/submissions/complete?cc=5D88FF27	unusual-lay_eggs-humankind	Agree or disagree (run4-experiment2-batch15-70-70)
a79378e5-6f2d-45b9-be96-8bc2d0a4f182	``Humankind'' is one of the first things which come to mind when I hear ``lay_eggs' because (a/an) humankind is a typical example of things which lay_eggs/are used for laying eggs'. 	``Cat'' is one of the first things which come to mind when I hear ``purr' because (a/an) cat is a typical example of things which purr/are used for purring'. 	``Dog'' is one of the first things which come to mind when I hear ``run' because (a/an) dog is a typical example of things which run/are used for runing'. 	4	1	https://app.prolific.co/submissions/complete?cc=5D88FF27	typical_of_property-lay_eggs-humankind	Agree or disagree (run4-experiment2-batch15-70-70)
30202c71-31ed-4802-8044-6d614b2a8284	``Lay_eggs'' is one for the first things which come to mind when I hear ``humankind' because laying eggs is one of the typical activities of (a/an) humankind'.	``Paint'' is one for the first things which come to mind when I hear ``brush' because painting is one of the typical activities of (a/an) brush'.	``Throw'' is one for the first things which come to mind when I hear ``apple' because throwing is one of the typical activites of (a/an) apple'.	4	1	https://app.prolific.co/submissions/complete?cc=5D88FF27	typical_of_concept-lay_eggs-humankind	Agree or disagree (run4-experiment2-batch15-70-70)
1f867bd6-6fb7-41e3-85fa-26445db0c203	I think there is a humankind  which can lay_eggs/be used for laying eggs, but this is rare or uncommon.	I think there is a car  which can swim/be used for swimming, but this is rare or uncommon.	I think there is a rock  which can swim/be used for swimming, but this is rare or uncommon.	4	1	https://app.prolific.co/submissions/complete?cc=5D88FF27	rare-lay_eggs-humankind	Agree or disagree (run4-experiment2-batch15-70-70)
33c8e994-64b4-4ed0-b655-5124ddc5c5dc	I know that all or most humankind(s) lay_eggs regularly or are used for laying eggs regularly. 	I know that all or most bug(s) crawl regularly or are used for crawling regularly. 	I know that all or most toothbrush(s) paint regularly or are used for painting regularly. 	4	1	https://app.prolific.co/submissions/complete?cc=5D88FF27	afforded_usual-lay_eggs-humankind	Agree or disagree (run4-experiment2-batch15-70-70)
33306b6f-4811-4757-81e3-d7d096d50d67	You can find (a/an) humankind which can lay_eggs/be used for laying eggs. This distinguishes a certain type of humankind from others. 	You can find (a/an) lamp which can read/be used for reading. This distinguishes a certain type of lamp from others. 	You can find (a/an) coat which can cook/be used for cooking. This distinguishes a certain type of coat from others. 	4	1	https://app.prolific.co/submissions/complete?cc=5D88FF27	variability_limited-lay_eggs-humankind	Agree or disagree (run4-experiment2-batch15-70-70)
eb03d00c-66f5-4d00-9ba1-a7162724d19e	I think it is impossible for (a/an) humankind to lay_eggs/be used for laying eggs.	I think it is impossible for (a/an) hammer to float/be used for floating.	I think it is impossible for (a/an) apple to rot/be used for roting.	4	1	https://app.prolific.co/submissions/complete?cc=5D88FF27	impossible-lay_eggs-humankind	Agree or disagree (run4-experiment2-batch15-70-70)
10314a38-2359-4b44-a934-ca8b5e7a70f0	All or most  humankind(s) can lay_eggs/be used for laying eggs. This is not what they normally do or are used for. 	All or most  toothbrush(s) can paint/be used for painting. This is not what they normally do or are used for. 	All or most  brush(s) can paint/be used for painting. This is not what they normally do or are used for. 	4	1	https://app.prolific.co/submissions/complete?cc=5D88FF27	afforded_unusual-lay_eggs-humankind	Agree or disagree (run4-experiment2-batch15-70-70)
c258e0c5-af20-4171-91e6-32f2920762aa	I could say (a/an) humankind lays eggs/is used for laying eggs, but I would most certainly not mean it literally.	"I could say (a/an) idea grows/is used for growing, but I would most certainly not mean it literally.
I could say (a/an) person glows/is used for glowing, but I would most certainly not mean it literally.
I could say (a/an) thought burns/is used for burning, but I would most certainly not mean it literally."	"I could say (a/an) plant grows/is used for growing, but I would most certainly not mean it literally.
I could say (a/an) situation smiles/is used for smileing, but I would most certainly not mean it literally.
I could say (a/an) candle burns/is used for burning, but I would most certainly not mean it literally."	4	1	https://app.prolific.co/submissions/complete?cc=5D88FF27	creative-lay_eggs-humankind	Agree or disagree (run4-experiment2-batch15-70-70)
f1a7b19f-72bb-44cf-9bd2-ebd24e741853	I think (a/an) coffee can be sweet, but this is rare or uncommon.	I think (a/an) tomato can be yellow, but this is rare or uncommon.	I think (a/an) grizzly bear can be grey, but this is rare or uncommon.	4	1	https://app.prolific.co/submissions/complete?cc=5D88FF27	rare-sweet-coffee	Agree or disagree (run4-experiment2-batch15-70-70)
0ced9447-2073-4bce-a95b-a7f827036364	I know that being sweet is necessary for many things (a/an) coffee does or is used for. 	I know that being bright is necessary for many things (a/an) flashlight does or is used for. 	I know that being grey is necessary for many things (a/an) car does or is used for. 	4	1	https://app.prolific.co/submissions/complete?cc=5D88FF27	affording_activity-sweet-coffee	Agree or disagree (run4-experiment2-batch15-70-70)
b13029eb-a8f0-44eb-97a5-147ed4eaebb5	Usually, (a/an) coffee is not sweet, but there could be a highly unusual situation in which (a/an) coffee is sweet.	Usually, (a/an) dog is not green, but there could be a highly unusual situation in which (a/an) dog is green.	Usually, (a/an) razor is not sharp, but there could be a highly unusual situation in which (a/an) razor is sharp.	4	1	https://app.prolific.co/submissions/complete?cc=5D88FF27	unusual-sweet-coffee	Agree or disagree (run4-experiment2-batch15-70-70)
13ed306b-c53d-4939-a8c1-ce6905235e2c	I could say (a/an) coffee is sweet, but I would most certainly not mean it literally.	"I could say (a/an) anger is hot, but I would most certainly not mean it literally.
I could say (a/an) person is cold, but I would most certainly not mean it literally.
I could say (a/an) story is dark, but I would most certainly not mean it literally."	"I could say (a/an) fire is hot, but I would most certainly not mean it literally.
I could say (a/an) stone is heavy, but I would most certainly not mean it literally.
I could say (a/an) argument is liquid, but I would most certainly not mean it literally."	4	1	https://app.prolific.co/submissions/complete?cc=5D88FF27	creative-sweet-coffee	Agree or disagree (run4-experiment2-batch15-70-70)
edd09017-a9b5-4cd8-803a-78666ee5425d	``Coffee'' is one of the first things which come to mind when I hear ``sweet' because (a/an) coffee is a typical example of things which are sweet'. 	``Rainbow'' is one of the first things which come to mind when I hear ``colorful' because (a/an) rainbow is a typical example of things which are colorful'. 	``Table'' is one of the first things which come to mind when I hear ``white' because (a/an) table is a typical example of things which are white'. 	4	1	https://app.prolific.co/submissions/complete?cc=5D88FF27	typical_of_property-sweet-coffee	Agree or disagree (run4-experiment2-batch15-70-70)
3a3b877f-6e2d-427a-8120-548e9c1cce81	You can find (a/an) coffee which is sweet. Sweet is one of many possible tastes (a/an) coffee usually has. The range of tastes is almost unlimited. 	You can find (a/an) t-shirt which is white. White is one of many possible colors (a/an) t-shirt usually has. The range of colors is almost unlimited. 	You can find (a/an) pepper which is green. Green is one of many possible colors (a/an) pepper usually has. The range of colors is almost unlimited. 	4	1	https://app.prolific.co/submissions/complete?cc=5D88FF27	variability_open-sweet-coffee	Agree or disagree (run4-experiment2-batch15-70-70)
1f2b32ce-8b4d-4592-b006-4a1d8ba4ec86	``Sweet'' is one for the first things which come to mind when I hear ``coffee' because sweet is one of the typical tastes of (a/an) coffee'.	``Spicy'' is one for the first things which come to mind when I hear ``chili_pepper' because spicy is one of the typical tastes of (a/an) chili_pepper'.	``Sweet'' is one for the first things which come to mind when I hear ``spinach' because sweet is one of the typical tastes of (a/an) spinach'.	4	1	https://app.prolific.co/submissions/complete?cc=5D88FF27	typical_of_concept-sweet-coffee	Agree or disagree (run4-experiment2-batch15-70-70)
a50fbdb0-9ec7-4dc6-958e-405edcdec2fd	I think it is impossible for (a/an) coffee to be sweet.	I think it is impossible for (a/an) steam to be solid.	I think it is impossible for (a/an) flame to be orange.	4	1	https://app.prolific.co/submissions/complete?cc=5D88FF27	impossible-sweet-coffee	Agree or disagree (run4-experiment2-batch15-70-70)
af7deec9-5580-4759-b328-557a635e599c	I know that (a/an) coffee is sweet as most or all other things similar to (a/an) coffee are sweet. 	I know that (a/an) cotten_candy is sweet as most or all other things similar to (a/an) cotten_candy are sweet. 	I know that (a/an) dress is white as most or all other things similar to (a/an) dress are white. 	4	1	https://app.prolific.co/submissions/complete?cc=5D88FF27	implied_category-sweet-coffee	Agree or disagree (run4-experiment2-batch15-70-70)
e00d6fd6-c83c-42a5-9077-bd38d49b587f	You can find (a/an) coffee which is sweet. Sweet is one of a few possible tastes (a/an) coffee usually has. There is only a limited range of possible tastes.	You can find (a/an) rose which is white. White is one of a few possible colors (a/an) rose usually has. There is only a limited range of possible colors.	You can find (a/an) mug which is blue. Blue is one of a few possible colors (a/an) mug usually has. There is only a limited range of possible colors.	4	1	https://app.prolific.co/submissions/complete?cc=5D88FF27	variability_limited-sweet-coffee	Agree or disagree (run4-experiment2-batch15-70-70)
check1	I am still paying attention to this task.	The earth is round. 	The earth is flat.	4	1	https://app.prolific.co/submissions/complete?cc=5D88FF27	_check-_check1-_check1	Agree or disagree (run4-experiment2-batch15-70-70)
test2	``Blue'' is one for the first things which come to mind when I hear ``beer' because beer is one of the typical colors of (a/an) beer'.	``Red'' is one for the first things which come to mind when I hear ``blood' because red is one of the typical colors of (a/an) blood'.	``Grey'' is one for the first things which come to mind when I hear ``apple'' because grey is one of the typical colors of (a/an) apple'.	4	1	https://app.prolific.co/submissions/complete?cc=5D88FF27	test_false-_test2-_test2	Agree or disagree (run4-experiment2-batch15-70-70)
