quid	description	exampleTrue	exampleFalse	run	subList	completionUrl	triple	name
b1ce8cfa-8c28-49c0-9193-8a6fc66211a2	I think it is impossible for (a/an) houseboat to be made_of_wood.	I think it is impossible for (a/an) mirror to be made_of_cotton.	I think it is impossible for (a/an) dress to be made_of_plastic.	4	1	https://app.prolific.co/submissions/complete?cc=30724E91	impossible-made_of_wood-houseboat	Agree or disagree (run4-experiment2-batch65-70-70)
32cf1378-851d-4fef-ad60-8afe81ed36df	I know that (a/an) houseboat is made_of_wood as most or all other things similar to (a/an) houseboat are made_of_wood. 	I know that (a/an) plate is made_of_china as most or all other things similar to (a/an) plate are made_of_china. 	I know that (a/an) pen is made_of_paper as most or all other things similar to (a/an) pen are made_of_paper. 	4	1	https://app.prolific.co/submissions/complete?cc=30724E91	implied_category-made_of_wood-houseboat	Agree or disagree (run4-experiment2-batch65-70-70)
e439ea0f-b817-40d0-b83a-458eec7a9dfe	Usually, (a/an) houseboat is not made_of_wood, but there could be a highly unusual situation in which (a/an) houseboat are made_of_wood.	Usually, (a/an) dress is not made_of_metal, but there could be a highly unusual situation in which (a/an) dress are made_of_metal.	Usually, (a/an) nail is not made_of_metal, but there could be a highly unusual situation in which (a/an) nail are made_of_metal.	4	1	https://app.prolific.co/submissions/complete?cc=30724E91	unusual-made_of_wood-houseboat	Agree or disagree (run4-experiment2-batch65-70-70)
5141325c-c975-4d97-861b-d4aabda96553	You can find (a/an) houseboat which is made_of_wood. Made_of_wood is one of a few possible materials (a/an) houseboat is usually made of. There is only a limited range of possible materials.	You can find (a/an) knife which is made_of_metal. Made_of_metal is one of a few possible materials (a/an) knife is usually made of. There is only a limited range of possible materials.	You can find (a/an) car which is made_of_cotton. Made_of_cotton is one of a few possible fibers (a/an) car is usually made of. There is only a limited range of possible fibers.	4	1	https://app.prolific.co/submissions/complete?cc=30724E91	variability_limited-made_of_wood-houseboat	Agree or disagree (run4-experiment2-batch65-70-70)
ef4299b5-e284-4512-a021-269069eedb14	``Made_of_wood'' is one for the first things which come to mind when I hear ``houseboat' because made_of_wood is one of the typical materials of (a/an) houseboat'.	``Made_of_china'' is one for the first things which come to mind when I hear ``mug' because made_of_china is one of the typical materials of (a/an) mug'.	``Made_of_metal'' is one for the first things which come to mind when I hear ``plate' because made_of_metal is one of the typical materials of (a/an) plate'.	4	1	https://app.prolific.co/submissions/complete?cc=30724E91	typical_of_concept-made_of_wood-houseboat	Agree or disagree (run4-experiment2-batch65-70-70)
42df3cae-469f-4edd-9834-a0ab49a0e2b9	You can find (a/an) houseboat which is made_of_wood. Made_of_wood is one of many possible materials (a/an) houseboat is usually made of. The range of materials is almost unlimited. 	You can find (a/an) bouquet which is made_of_roses. Made_of_roses is one of many possible flowers (a/an) bouquet is usually made of. The range of flowers is almost unlimited. 	You can find (a/an) knife which is made_of_metal. Made_of_metal is one of many possible materials (a/an) knife is usually made of. The range of materials is almost unlimited. 	4	1	https://app.prolific.co/submissions/complete?cc=30724E91	variability_open-made_of_wood-houseboat	Agree or disagree (run4-experiment2-batch65-70-70)
b3ce9713-3fe1-45ee-9dd3-3a9231e268ae	``Houseboat'' is one of the first things which come to mind when I hear ``made_of_wood' because (a/an) houseboat is a typical example of things which are (a/an) made_of_wood'. 	``Sweater'' is one of the first things which come to mind when I hear ``made_of_wool' because (a/an) sweater is a typical example of things which are (a/an) made_of_wool'. 	``T-shirt'' is one of the first things which come to mind when I hear ``made_of_wool' because (a/an) T-shirt is a typical example of things which are (a/an) made_of_wool'. 	4	1	https://app.prolific.co/submissions/complete?cc=30724E91	typical_of_property-made_of_wood-houseboat	Agree or disagree (run4-experiment2-batch65-70-70)
5f73ace1-99a8-4a93-9806-8a9b9bd963e9	I know that being made_of_wood is necessary for many things (a/an) houseboat does or is used for. 	I know that having (a/an) pointy is necessary for many things (a/an) needle does or is used for. 	I know that having (a/an) white is necessary for many things (a/an) t-shirt does or is used for. 	4	1	https://app.prolific.co/submissions/complete?cc=30724E91	affording_activity-made_of_wood-houseboat	Agree or disagree (run4-experiment2-batch65-70-70)
9925fc8a-db04-4849-87aa-59a274d0e871	I could say (a/an) houseboat is made_of_wood, but I would most certainly not mean it literally.	"I could say (a/an) anger has hot, but I would most certainly not mean it literally.
I could say (a/an) person has cold, but I would most certainly not mean it literally.
I could say (a/an) story has dark, but I would most certainly not mean it literally."	"I could say (a/an) fire has hot, but I would most certainly not mean it literally.
I could say (a/an) stone has heavy, but I would most certainly not mean it literally.
I could say (a/an) argument has liquid, but I would most certainly not mean it literally."	4	1	https://app.prolific.co/submissions/complete?cc=30724E91	creative-made_of_wood-houseboat	Agree or disagree (run4-experiment2-batch65-70-70)
578eff48-c395-492d-8b42-0c88e320e66d	I think (a/an) houseboat can is made_of_wood, but this is rare or uncommon.	I think (a/an) dress can is made_of_plastic, but this is rare or uncommon.	I think (a/an) cup can is made_of_plastic, but this is rare or uncommon.	4	1	https://app.prolific.co/submissions/complete?cc=30724E91	rare-made_of_wood-houseboat	Agree or disagree (run4-experiment2-batch65-70-70)
960fa3ac-6832-4a21-ab76-c8ed78c1d33e	I think (a/an) mangosteen can be sweet, but this is rare or uncommon.	I think (a/an) tomato can be yellow, but this is rare or uncommon.	I think (a/an) grizzly bear can be grey, but this is rare or uncommon.	4	1	https://app.prolific.co/submissions/complete?cc=30724E91	rare-sweet-mangosteen	Agree or disagree (run4-experiment2-batch65-70-70)
d17937ba-af18-4ab9-8569-76902f5dee21	Usually, (a/an) mangosteen is not sweet, but there could be a highly unusual situation in which (a/an) mangosteen is sweet.	Usually, (a/an) pony is not blue, but there could be a highly unusual situation in which (a/an) pony is blue.	Usually, (a/an) beer is not brown, but there could be a highly unusual situation in which (a/an) beer is brown.	4	1	https://app.prolific.co/submissions/complete?cc=30724E91	unusual-sweet-mangosteen	Agree or disagree (run4-experiment2-batch65-70-70)
b131467a-2e2a-46e0-83e6-e1f748b9b47c	I know that being sweet is necessary for many things (a/an) mangosteen does or is used for. 	I know that being sharp is necessary for many things (a/an) razor does or is used for. 	I know that being colorful is necessary for many things (a/an) dress does or is used for. 	4	1	https://app.prolific.co/submissions/complete?cc=30724E91	affording_activity-sweet-mangosteen	Agree or disagree (run4-experiment2-batch65-70-70)
b97233b1-42ab-4fc3-8dcc-6e355f9da929	I think it is impossible for (a/an) mangosteen to be sweet.	I think it is impossible for (a/an) water to be dry.	I think it is impossible for (a/an) rose to be white.	4	1	https://app.prolific.co/submissions/complete?cc=30724E91	impossible-sweet-mangosteen	Agree or disagree (run4-experiment2-batch65-70-70)
f4776892-1274-449a-93f4-32fa913efba7	You can find (a/an) mangosteen which is sweet. Sweet is one of many possible tastes (a/an) mangosteen usually has. The range of tastes is almost unlimited. 	You can find (a/an) flower which is purple. Purple is one of many possible colors (a/an) flower usually has. The range of colors is almost unlimited. 	You can find (a/an) carrot which is orange. Orange is one of many possible colors (a/an) carrot usually has. The range of colors is almost unlimited. 	4	1	https://app.prolific.co/submissions/complete?cc=30724E91	variability_open-sweet-mangosteen	Agree or disagree (run4-experiment2-batch65-70-70)
79875131-977b-4927-9491-8e1be8ccbd11	``Sweet'' is one for the first things which come to mind when I hear ``mangosteen' because sweet is one of the typical tastes of (a/an) mangosteen'.	``Bitter'' is one for the first things which come to mind when I hear ``coffee' because bitter is one of the typical tastes of (a/an) coffee'.	``Salty'' is one for the first things which come to mind when I hear ``beer' because salty is one of the typical tastes of (a/an) beer'.	4	1	https://app.prolific.co/submissions/complete?cc=30724E91	typical_of_concept-sweet-mangosteen	Agree or disagree (run4-experiment2-batch65-70-70)
832a59bc-3dd9-44a7-83db-2a618698d80b	I know that (a/an) mangosteen is sweet as most or all other things similar to (a/an) mangosteen are sweet. 	I know that (a/an) chocoloate_cake is sweet as most or all other things similar to (a/an) chocoloate_cake are sweet. 	I know that (a/an) table is transparent as most or all other things similar to (a/an) table are transparent. 	4	1	https://app.prolific.co/submissions/complete?cc=30724E91	implied_category-sweet-mangosteen	Agree or disagree (run4-experiment2-batch65-70-70)
e8d9a021-f048-4c07-ad6f-1a841df99e77	``Mangosteen'' is one of the first things which come to mind when I hear ``sweet' because (a/an) mangosteen is a typical example of things which are sweet'. 	``Mouse'' is one of the first things which come to mind when I hear ``small' because (a/an) mouse is a typical example of things which are small'. 	``Dog'' is one of the first things which come to mind when I hear ``small' because (a/an) dog is a typical example of things which are small'. 	4	1	https://app.prolific.co/submissions/complete?cc=30724E91	typical_of_property-sweet-mangosteen	Agree or disagree (run4-experiment2-batch65-70-70)
f6ac051e-16ed-4ffc-8044-cdc795fdc2ed	I could say (a/an) mangosteen is sweet, but I would most certainly not mean it literally.	"I could say (a/an) anger is hot, but I would most certainly not mean it literally.
I could say (a/an) person is cold, but I would most certainly not mean it literally.
I could say (a/an) story is dark, but I would most certainly not mean it literally."	"I could say (a/an) fire is hot, but I would most certainly not mean it literally.
I could say (a/an) stone is heavy, but I would most certainly not mean it literally.
I could say (a/an) argument is liquid, but I would most certainly not mean it literally."	4	1	https://app.prolific.co/submissions/complete?cc=30724E91	creative-sweet-mangosteen	Agree or disagree (run4-experiment2-batch65-70-70)
435ce339-ffd6-4139-a8b0-86c0ccc6abd7	You can find (a/an) mangosteen which is sweet. Sweet is one of a few possible tastes (a/an) mangosteen usually has. There is only a limited range of possible tastes.	You can find (a/an) pepper which is red. Red is one of a few possible colors (a/an) pepper usually has. There is only a limited range of possible colors.	You can find (a/an) t-shirt which is red. Red is one of a few possible colors (a/an) t-shirt usually has. There is only a limited range of possible colors.	4	1	https://app.prolific.co/submissions/complete?cc=30724E91	variability_limited-sweet-mangosteen	Agree or disagree (run4-experiment2-batch65-70-70)
2de3849d-0fc8-45ff-94ad-8ed02c42e986	You can find (a/an) raisin which is black. Black is one of a few possible colors (a/an) raisin usually has. There is only a limited range of possible colors.	You can find (a/an) rose which is white. White is one of a few possible colors (a/an) rose usually has. There is only a limited range of possible colors.	You can find (a/an) mug which is blue. Blue is one of a few possible colors (a/an) mug usually has. There is only a limited range of possible colors.	4	1	https://app.prolific.co/submissions/complete?cc=30724E91	variability_limited-black-raisin	Agree or disagree (run4-experiment2-batch65-70-70)
a2d9c663-b0fd-4d9a-81b8-11abf77ac5e9	I know that being black is necessary for many things (a/an) raisin does or is used for. 	I know that being pointy is necessary for many things (a/an) needle does or is used for. 	I know that being white is necessary for many things (a/an) t-shirt does or is used for. 	4	1	https://app.prolific.co/submissions/complete?cc=30724E91	affording_activity-black-raisin	Agree or disagree (run4-experiment2-batch65-70-70)
7d5cbaeb-4d5f-4422-bf6e-b810c7d70c70	You can find (a/an) raisin which is black. Black is one of many possible colors (a/an) raisin usually has. The range of colors is almost unlimited. 	You can find (a/an) dress which is white. White is one of many possible colors (a/an) dress usually has. The range of colors is almost unlimited. 	You can find (a/an) pea which is green. Green is one of many possible colors (a/an) pea usually has. The range of colors is almost unlimited. 	4	1	https://app.prolific.co/submissions/complete?cc=30724E91	variability_open-black-raisin	Agree or disagree (run4-experiment2-batch65-70-70)
ba87325d-71a1-471d-b37a-18ca670585c7	I could say (a/an) raisin is black, but I would most certainly not mean it literally.	"I could say (a/an) anger is hot, but I would most certainly not mean it literally.
I could say (a/an) person is cold, but I would most certainly not mean it literally.
I could say (a/an) story is dark, but I would most certainly not mean it literally."	"I could say (a/an) fire is hot, but I would most certainly not mean it literally.
I could say (a/an) stone is heavy, but I would most certainly not mean it literally.
I could say (a/an) argument is liquid, but I would most certainly not mean it literally."	4	1	https://app.prolific.co/submissions/complete?cc=30724E91	creative-black-raisin	Agree or disagree (run4-experiment2-batch65-70-70)
50db3ae5-9103-4bd3-b02a-dd06a17fc5ca	``Black'' is one for the first things which come to mind when I hear ``raisin' because black is one of the typical colors of (a/an) raisin'.	``Spicy'' is one for the first things which come to mind when I hear ``chili_pepper' because spicy is one of the typical tastes of (a/an) chili_pepper'.	``Sweet'' is one for the first things which come to mind when I hear ``spinach' because sweet is one of the typical tastes of (a/an) spinach'.	4	1	https://app.prolific.co/submissions/complete?cc=30724E91	typical_of_concept-black-raisin	Agree or disagree (run4-experiment2-batch65-70-70)
bd34780e-f2da-45b5-9a62-2f60eef307ac	``Raisin'' is one of the first things which come to mind when I hear ``black' because (a/an) raisin is a typical example of things which are black'. 	``Rainbow'' is one of the first things which come to mind when I hear ``colorful' because (a/an) rainbow is a typical example of things which are colorful'. 	``Table'' is one of the first things which come to mind when I hear ``white' because (a/an) table is a typical example of things which are white'. 	4	1	https://app.prolific.co/submissions/complete?cc=30724E91	typical_of_property-black-raisin	Agree or disagree (run4-experiment2-batch65-70-70)
8cb9271d-e5d9-4405-ae16-81ba8e6cb4ad	I know that (a/an) raisin is black as most or all other things similar to (a/an) raisin are black. 	I know that (a/an) wine is liquid as most or all other things similar to (a/an) wine are liquid. 	I know that (a/an) bread is liquid as most or all other things similar to (a/an) bread are liquid. 	4	1	https://app.prolific.co/submissions/complete?cc=30724E91	implied_category-black-raisin	Agree or disagree (run4-experiment2-batch65-70-70)
6d5e1004-b48c-487d-8cf0-aa074af12b1d	Usually, (a/an) raisin is not black, but there could be a highly unusual situation in which (a/an) raisin is black.	Usually, (a/an) dog is not green, but there could be a highly unusual situation in which (a/an) dog is green.	Usually, (a/an) razor is not sharp, but there could be a highly unusual situation in which (a/an) razor is sharp.	4	1	https://app.prolific.co/submissions/complete?cc=30724E91	unusual-black-raisin	Agree or disagree (run4-experiment2-batch65-70-70)
b8967027-c8ed-4228-9d5b-ad2eb3f0b9c7	I think it is impossible for (a/an) raisin to be black.	I think it is impossible for (a/an) water to be dry.	I think it is impossible for (a/an) rose to be white.	4	1	https://app.prolific.co/submissions/complete?cc=30724E91	impossible-black-raisin	Agree or disagree (run4-experiment2-batch65-70-70)
2a29e02a-a175-40e9-9a99-8129c9bb1ce5	I think (a/an) raisin can be black, but this is rare or uncommon.	I think (a/an) rose can be black, but this is rare or uncommon.	I think (a/an) rose can be yellow, but this is rare or uncommon.	4	1	https://app.prolific.co/submissions/complete?cc=30724E91	rare-black-raisin	Agree or disagree (run4-experiment2-batch65-70-70)
fc00ca31-d7a0-4875-b9d9-e65d146600d9	All or most  strigidae(s) can lay_eggs/be used for laying eggs. This is not what they normally do or are used for. 	All or most  toothbrush(s) can paint/be used for painting. This is not what they normally do or are used for. 	All or most  brush(s) can paint/be used for painting. This is not what they normally do or are used for. 	4	1	https://app.prolific.co/submissions/complete?cc=30724E91	afforded_unusual-lay_eggs-strigidae	Agree or disagree (run4-experiment2-batch65-70-70)
8b250888-3e60-4b1d-a3dd-adf051898719	I think it is impossible for (a/an) strigidae to lay_eggs/be used for laying eggs.	I think it is impossible for (a/an) rock to float/be used for floating.	I think it is impossible for (a/an) metal to melt/be used for melting.	4	1	https://app.prolific.co/submissions/complete?cc=30724E91	impossible-lay_eggs-strigidae	Agree or disagree (run4-experiment2-batch65-70-70)
f3b4a9b6-4f89-4a19-ad31-ff4cb19714b6	``Lay_eggs'' is one for the first things which come to mind when I hear ``strigidae' because laying eggs is one of the typical activities of (a/an) strigidae'.	``Paint'' is one for the first things which come to mind when I hear ``brush' because painting is one of the typical activities of (a/an) brush'.	``Throw'' is one for the first things which come to mind when I hear ``apple' because throwing is one of the typical activites of (a/an) apple'.	4	1	https://app.prolific.co/submissions/complete?cc=30724E91	typical_of_concept-lay_eggs-strigidae	Agree or disagree (run4-experiment2-batch65-70-70)
6e04bbc8-2383-4d81-8175-ee605d309307	I know that all or most strigidae(s) lay_eggs regularly or are used for laying eggs regularly. 	I know that all or most candle(s) burn regularly or are used for burning regularly. 	I know that all or most T-shirt(s) wrap regularly or are used for wraping regularly. 	4	1	https://app.prolific.co/submissions/complete?cc=30724E91	afforded_usual-lay_eggs-strigidae	Agree or disagree (run4-experiment2-batch65-70-70)
5bd0f284-03f5-4b52-86c1-fc1220bae5ba	I think there is a strigidae  which can lay_eggs/be used for laying eggs, but this is rare or uncommon.	I think there is a student  which can teach/be used for teaching, but this is rare or uncommon.	I think there is a teacher  which can teach/be used for teaching, but this is rare or uncommon.	4	1	https://app.prolific.co/submissions/complete?cc=30724E91	rare-lay_eggs-strigidae	Agree or disagree (run4-experiment2-batch65-70-70)
15244e3d-5348-47c3-b63f-dc9344410e73	Usually, (a/an) strigidae cannot lay_eggs/be used for laying eggs, but there could be a highly unusual situation in which (a/an) strigidae can lay_eggs.	Usually, (a/an) dog cannot speak/be used for speaking, but there could be a highly unusual situation in which (a/an) dog can speak.	Usually, (a/an) dog cannot bark/be used for barking, but there could be a highly unusual situation in which (a/an) dog can bark.	4	1	https://app.prolific.co/submissions/complete?cc=30724E91	unusual-lay_eggs-strigidae	Agree or disagree (run4-experiment2-batch65-70-70)
1c022c89-7bfc-44bb-8ad3-871e87d4e2d5	I know that (a/an) strigidae can lay_eggs/be used for laying eggs as most or all other things similar to (a/an) strigidae lay_eggs. 	I know that (a/an) apple_tree can grow/be used for growing as most or all other things similar to (a/an) apple_tree grow. 	I know that (a/an) worm can run/be used for runing as most or all other things similar to (a/an) worm run. 	4	1	https://app.prolific.co/submissions/complete?cc=30724E91	implied_category-lay_eggs-strigidae	Agree or disagree (run4-experiment2-batch65-70-70)
fa3dd699-3339-4688-bb8b-8baeb481609f	You can find (a/an) strigidae which can lay_eggs/be used for laying eggs. This distinguishes a certain type of strigidae from others. 	You can find (a/an) knife which can cook/be used for cooking. This distinguishes a certain type of knife from others. 	You can find (a/an) book which can read/be used for reading. This distinguishes a certain type of book from others. 	4	1	https://app.prolific.co/submissions/complete?cc=30724E91	variability_limited-lay_eggs-strigidae	Agree or disagree (run4-experiment2-batch65-70-70)
a82d68e3-b327-477f-a65d-562655f3f95e	``Strigidae'' is one of the first things which come to mind when I hear ``lay_eggs' because (a/an) strigidae is a typical example of things which lay_eggs/are used for laying eggs'. 	``Knife'' is one of the first things which come to mind when I hear ``cut' because (a/an) knife is a typical example of things which cut/are used for cuting'. 	``Hamster'' is one of the first things which come to mind when I hear ``kill' because (a/an) hamster is a typical example of things which kill/are used for killing'. 	4	1	https://app.prolific.co/submissions/complete?cc=30724E91	typical_of_property-lay_eggs-strigidae	Agree or disagree (run4-experiment2-batch65-70-70)
e7f40a00-54d4-46dc-a7f4-ab2b87735801	I could say (a/an) strigidae lays eggs/is used for laying eggs, but I would most certainly not mean it literally.	"I could say (a/an) idea grows/is used for growing, but I would most certainly not mean it literally.
I could say (a/an) person glows/is used for glowing, but I would most certainly not mean it literally.
I could say (a/an) thought burns/is used for burning, but I would most certainly not mean it literally."	"I could say (a/an) plant grows/is used for growing, but I would most certainly not mean it literally.
I could say (a/an) situation smiles/is used for smileing, but I would most certainly not mean it literally.
I could say (a/an) candle burns/is used for burning, but I would most certainly not mean it literally."	4	1	https://app.prolific.co/submissions/complete?cc=30724E91	creative-lay_eggs-strigidae	Agree or disagree (run4-experiment2-batch65-70-70)
5e03de9e-04ad-4a27-8240-45f087f378af	Usually, (a/an) bread is not hot, but there could be a highly unusual situation in which (a/an) bread is hot.	Usually, (a/an) clock is not melting, but there could be a highly unusual situation in which (a/an) clock is melting.	Usually, (a/an) ice cream is not melting, but there could be a highly unusual situation in which (a/an) ice cream is melting.	4	1	https://app.prolific.co/submissions/complete?cc=30724E91	unusual-hot-bread	Agree or disagree (run4-experiment2-batch65-70-70)
27076ab7-35b5-4baf-aba6-dbd116cefd90	``Hot'' is one for the first things which come to mind when I hear ``bread' because hot is one of the typical temperatures of (a/an) bread'.	``Bitter'' is one for the first things which come to mind when I hear ``coffee' because bitter is one of the typical tastes of (a/an) coffee'.	``Salty'' is one for the first things which come to mind when I hear ``beer' because salty is one of the typical tastes of (a/an) beer'.	4	1	https://app.prolific.co/submissions/complete?cc=30724E91	typical_of_concept-hot-bread	Agree or disagree (run4-experiment2-batch65-70-70)
8c2745f9-2b60-4c5a-b533-a20c65a7be3c	You can find (a/an) bread which is hot. (A/an) bread is usually either hot or not hot. It cannot be a bit more or less hot.	You can find (a/an) substance which is solid. (A/an) substance is usually either solid or not solid. It cannot be a bit more or less solid.	You can find (a/an) cushion which is soft. (A/an) cushion is usually either soft or not soft. It cannot be a bit more or less soft.	4	1	https://app.prolific.co/submissions/complete?cc=30724E91	variability_limited-hot-bread	Agree or disagree (run4-experiment2-batch65-70-70)
227eb2dd-972f-4110-a9ff-d8731e40ba6e	I know that being hot is necessary for many things (a/an) bread does or is used for. 	I know that being pointy is necessary for many things (a/an) needle does or is used for. 	I know that being white is necessary for many things (a/an) t-shirt does or is used for. 	4	1	https://app.prolific.co/submissions/complete?cc=30724E91	affording_activity-hot-bread	Agree or disagree (run4-experiment2-batch65-70-70)
2c5d9c3a-59d3-4def-b69e-2937dd28da20	I could say (a/an) bread is hot, but I would most certainly not mean it literally.	"I could say (a/an) anger is hot, but I would most certainly not mean it literally.
I could say (a/an) person is cold, but I would most certainly not mean it literally.
I could say (a/an) story is dark, but I would most certainly not mean it literally."	"I could say (a/an) fire is hot, but I would most certainly not mean it literally.
I could say (a/an) stone is heavy, but I would most certainly not mean it literally.
I could say (a/an) argument is liquid, but I would most certainly not mean it literally."	4	1	https://app.prolific.co/submissions/complete?cc=30724E91	creative-hot-bread	Agree or disagree (run4-experiment2-batch65-70-70)
