quid	description	exampleTrue	exampleFalse	run	subList	completionUrl	triple	name
e6d0bc4a-843a-4baf-8955-423412b07b62	You can find (a/an) schooner which can fly/be used for flying. This distinguishes a certain type of schooner from others. 	You can find (a/an) knife which can cook/be used for cooking. This distinguishes a certain type of knife from others. 	You can find (a/an) book which can read/be used for reading. This distinguishes a certain type of book from others. 	4	1	https://app.prolific.co/submissions/complete?cc=610BF475	variability_limited-fly-schooner	Agree or disagree (run4-experiment2-batch178-70-70)
b3d1b064-0266-418d-8027-d70e10c51979	I could say (a/an) schooner flies/is used for flying, but I would most certainly not mean it literally.	"I could say (a/an) idea grows/is used for growing, but I would most certainly not mean it literally.
I could say (a/an) person glows/is used for glowing, but I would most certainly not mean it literally.
I could say (a/an) thought burns/is used for burning, but I would most certainly not mean it literally."	"I could say (a/an) plant grows/is used for growing, but I would most certainly not mean it literally.
I could say (a/an) situation smiles/is used for smileing, but I would most certainly not mean it literally.
I could say (a/an) candle burns/is used for burning, but I would most certainly not mean it literally."	4	1	https://app.prolific.co/submissions/complete?cc=610BF475	creative-fly-schooner	Agree or disagree (run4-experiment2-batch178-70-70)
394e3b36-f0b5-4d86-be45-9b2c8394335f	All or most  schooner(s) can fly/be used for flying. This is not what they normally do or are used for. 	All or most  toothbrush(s) can paint/be used for painting. This is not what they normally do or are used for. 	All or most  brush(s) can paint/be used for painting. This is not what they normally do or are used for. 	4	1	https://app.prolific.co/submissions/complete?cc=610BF475	afforded_unusual-fly-schooner	Agree or disagree (run4-experiment2-batch178-70-70)
5f9be83a-35b5-45dc-a8f0-fbfb082a7d83	You can find (a/an) gesture which is sweet. Sweet is one of a few possible tastes (a/an) gesture usually has. There is only a limited range of possible tastes.	You can find (a/an) pepper which is red. Red is one of a few possible colors (a/an) pepper usually has. There is only a limited range of possible colors.	You can find (a/an) t-shirt which is red. Red is one of a few possible colors (a/an) t-shirt usually has. There is only a limited range of possible colors.	4	1	https://app.prolific.co/submissions/complete?cc=610BF475	variability_limited-sweet-gesture	Agree or disagree (run4-experiment2-batch178-70-70)
8abaafad-6684-471e-8530-416fe4825e9a	I know that being sweet is necessary for many things (a/an) gesture does or is used for. 	I know that being pointy is necessary for many things (a/an) needle does or is used for. 	I know that being white is necessary for many things (a/an) t-shirt does or is used for. 	4	1	https://app.prolific.co/submissions/complete?cc=610BF475	affording_activity-sweet-gesture	Agree or disagree (run4-experiment2-batch178-70-70)
23055716-5ccf-4da7-86ab-1aa89d704311	``Sweet'' is one for the first things which come to mind when I hear ``gesture' because sweet is one of the typical tastes of (a/an) gesture'.	``Spicy'' is one for the first things which come to mind when I hear ``chili_pepper' because spicy is one of the typical tastes of (a/an) chili_pepper'.	``Sweet'' is one for the first things which come to mind when I hear ``spinach' because sweet is one of the typical tastes of (a/an) spinach'.	4	1	https://app.prolific.co/submissions/complete?cc=610BF475	typical_of_concept-sweet-gesture	Agree or disagree (run4-experiment2-batch178-70-70)
1ad9ab23-1a51-49a6-8260-1faac9d2785f	I know that (a/an) gesture is sweet as most or all other things similar to (a/an) gesture are sweet. 	I know that (a/an) chocoloate_cake is sweet as most or all other things similar to (a/an) chocoloate_cake are sweet. 	I know that (a/an) table is transparent as most or all other things similar to (a/an) table are transparent. 	4	1	https://app.prolific.co/submissions/complete?cc=610BF475	implied_category-sweet-gesture	Agree or disagree (run4-experiment2-batch178-70-70)
34400811-79bf-4d7c-9971-acca58ed28d6	You can find (a/an) gesture which is sweet. Sweet is one of many possible tastes (a/an) gesture usually has. The range of tastes is almost unlimited. 	You can find (a/an) dress which is white. White is one of many possible colors (a/an) dress usually has. The range of colors is almost unlimited. 	You can find (a/an) pea which is green. Green is one of many possible colors (a/an) pea usually has. The range of colors is almost unlimited. 	4	1	https://app.prolific.co/submissions/complete?cc=610BF475	variability_open-sweet-gesture	Agree or disagree (run4-experiment2-batch178-70-70)
df74dd23-805f-42a9-931f-cad4d1e9eeb1	``Gesture'' is one of the first things which come to mind when I hear ``sweet' because (a/an) gesture is a typical example of things which are sweet'. 	``Rainbow'' is one of the first things which come to mind when I hear ``colorful' because (a/an) rainbow is a typical example of things which are colorful'. 	``Table'' is one of the first things which come to mind when I hear ``white' because (a/an) table is a typical example of things which are white'. 	4	1	https://app.prolific.co/submissions/complete?cc=610BF475	typical_of_property-sweet-gesture	Agree or disagree (run4-experiment2-batch178-70-70)
138e0d00-eb90-49df-b8d4-7b518eb9221b	I could say (a/an) palaquium is yellow, but I would most certainly not mean it literally.	"I could say (a/an) anger is hot, but I would most certainly not mean it literally.
I could say (a/an) person is cold, but I would most certainly not mean it literally.
I could say (a/an) story is dark, but I would most certainly not mean it literally."	"I could say (a/an) fire is hot, but I would most certainly not mean it literally.
I could say (a/an) stone is heavy, but I would most certainly not mean it literally.
I could say (a/an) argument is liquid, but I would most certainly not mean it literally."	4	1	https://app.prolific.co/submissions/complete?cc=610BF475	creative-yellow-palaquium	Agree or disagree (run4-experiment2-batch178-70-70)
f59f8f97-d243-45e2-81a5-dfd7a558171d	Usually, (a/an) palaquium is not yellow, but there could be a highly unusual situation in which (a/an) palaquium is yellow.	Usually, (a/an) dog is not green, but there could be a highly unusual situation in which (a/an) dog is green.	Usually, (a/an) razor is not sharp, but there could be a highly unusual situation in which (a/an) razor is sharp.	4	1	https://app.prolific.co/submissions/complete?cc=610BF475	unusual-yellow-palaquium	Agree or disagree (run4-experiment2-batch178-70-70)
decafd95-7670-4560-94ff-50624f980ba6	I think it is impossible for (a/an) palaquium to be yellow.	I think it is impossible for (a/an) steam to be solid.	I think it is impossible for (a/an) flame to be orange.	4	1	https://app.prolific.co/submissions/complete?cc=610BF475	impossible-yellow-palaquium	Agree or disagree (run4-experiment2-batch178-70-70)
b86e7962-b5af-409c-9b3f-baa570b4eb62	I think (a/an) palaquium can be yellow, but this is rare or uncommon.	I think (a/an) tomato can be yellow, but this is rare or uncommon.	I think (a/an) grizzly bear can be grey, but this is rare or uncommon.	4	1	https://app.prolific.co/submissions/complete?cc=610BF475	rare-yellow-palaquium	Agree or disagree (run4-experiment2-batch178-70-70)
bd72b507-fdfc-4e78-9181-587770866f31	``Fly'' is one for the first things which come to mind when I hear ``yellowhammer' because flying is one of the typical movements of (a/an) yellowhammer'.	``Poke'' is one for the first things which come to mind when I hear ``needle' because pokeing is one of the typical activities of (a/an) needle'.	``Cut'' is one for the first things which come to mind when I hear ``brush' because cuting is one of the typical activities of (a/an) brush'.	4	1	https://app.prolific.co/submissions/complete?cc=610BF475	typical_of_concept-fly-yellowhammer	Agree or disagree (run4-experiment2-batch178-70-70)
83bfe4e7-020b-45ed-af8d-0d8049d7d72b	I think there is a yellowhammer  which can fly/be used for flying, but this is rare or uncommon.	I think there is a toddler  which can read/be used for reading, but this is rare or uncommon.	I think there is a teenager  which can read/be used for reading, but this is rare or uncommon.	4	1	https://app.prolific.co/submissions/complete?cc=610BF475	rare-fly-yellowhammer	Agree or disagree (run4-experiment2-batch178-70-70)
f3bcb63d-1e6b-4f5e-a1a4-8e35761ec0eb	Usually, (a/an) yellowhammer cannot fly/be used for flying, but there could be a highly unusual situation in which (a/an) yellowhammer can fly.	Usually, (a/an) rat cannot cook/be used for cooking, but there could be a highly unusual situation in which (a/an) rat can cook.	Usually, (a/an) teacher cannot teach/be used for teaching, but there could be a highly unusual situation in which (a/an) teacher can teach.	4	1	https://app.prolific.co/submissions/complete?cc=610BF475	unusual-fly-yellowhammer	Agree or disagree (run4-experiment2-batch178-70-70)
bd5bd2b2-8a94-47d4-87f5-cc66fc0ff8f6	You can find (a/an) yellowhammer which can fly/be used for flying. This distinguishes a certain type of yellowhammer from others. 	You can find (a/an) dog which can hunt/be used for hunting. This distinguishes a certain type of dog from others. 	You can find (a/an) dog which can breathe/be used for breathing. This distinguishes a certain type of dog from others. 	4	1	https://app.prolific.co/submissions/complete?cc=610BF475	variability_limited-fly-yellowhammer	Agree or disagree (run4-experiment2-batch178-70-70)
c5aa7192-c33e-4b11-a5c9-6fec88d31772	I could say (a/an) yellowhammer flies/is used for flying, but I would most certainly not mean it literally.	"I could say (a/an) idea grows/is used for growing, but I would most certainly not mean it literally.
I could say (a/an) person glows/is used for glowing, but I would most certainly not mean it literally.
I could say (a/an) thought burns/is used for burning, but I would most certainly not mean it literally."	"I could say (a/an) plant grows/is used for growing, but I would most certainly not mean it literally.
I could say (a/an) situation smiles/is used for smileing, but I would most certainly not mean it literally.
I could say (a/an) candle burns/is used for burning, but I would most certainly not mean it literally."	4	1	https://app.prolific.co/submissions/complete?cc=610BF475	creative-fly-yellowhammer	Agree or disagree (run4-experiment2-batch178-70-70)
9ca050ce-ffe5-4cea-91bb-31263c9f8c9f	``Yellowhammer'' is one of the first things which come to mind when I hear ``fly' because (a/an) yellowhammer is a typical example of things which fly/are used for flying'. 	``Knife'' is one of the first things which come to mind when I hear ``cut' because (a/an) knife is a typical example of things which cut/are used for cuting'. 	``Hamster'' is one of the first things which come to mind when I hear ``kill' because (a/an) hamster is a typical example of things which kill/are used for killing'. 	4	1	https://app.prolific.co/submissions/complete?cc=610BF475	typical_of_property-fly-yellowhammer	Agree or disagree (run4-experiment2-batch178-70-70)
c8bb9493-4bfd-4d51-b6e3-4aabc8087166	I think it is impossible for (a/an) yellowhammer to fly/be used for flying.	I think it is impossible for (a/an) worm to walk/be used for walking.	I think it is impossible for (a/an) worm to move/be used for moveing.	4	1	https://app.prolific.co/submissions/complete?cc=610BF475	impossible-fly-yellowhammer	Agree or disagree (run4-experiment2-batch178-70-70)
9de606a6-34b1-40f2-b514-3601a1836340	I know that (a/an) yellowhammer can fly/be used for flying as most or all other things similar to (a/an) yellowhammer fly. 	I know that (a/an) poodle can bark/be used for barking as most or all other things similar to (a/an) poodle bark. 	I know that (a/an) dog can bark/be used for barking as most or all other things similar to (a/an) dog bark. 	4	1	https://app.prolific.co/submissions/complete?cc=610BF475	implied_category-fly-yellowhammer	Agree or disagree (run4-experiment2-batch178-70-70)
73f1ac99-70fc-46cd-9d20-c0e494bd048c	I know that all or most yellowhammer(s) fly regularly or are used for flying regularly. 	I know that all or most candle(s) burn regularly or are used for burning regularly. 	I know that all or most T-shirt(s) wrap regularly or are used for wraping regularly. 	4	1	https://app.prolific.co/submissions/complete?cc=610BF475	afforded_usual-fly-yellowhammer	Agree or disagree (run4-experiment2-batch178-70-70)
4a00d6c3-8b09-462e-9890-dfff8e0109ce	All or most  yellowhammer(s) can fly/be used for flying. This is not what they normally do or are used for. 	All or most  T-shirt(s) can clean/be used for cleaning. This is not what they normally do or are used for. 	All or most  sponge(s) can clean/be used for cleaning. This is not what they normally do or are used for. 	4	1	https://app.prolific.co/submissions/complete?cc=610BF475	afforded_unusual-fly-yellowhammer	Agree or disagree (run4-experiment2-batch178-70-70)
check3	I am still focused on this task.	France is a country.	Amsterdam is a country.	4	1	https://app.prolific.co/submissions/complete?cc=610BF475	_check-_check3-_check3	Agree or disagree (run4-experiment2-batch178-70-70)
test1	``Yellow'' is one for the first things which come to mind when I hear ``canary' because yellow is one of the typical colors of (a/an) canary'.	``Blue'' is one for the first things which come to mind when I hear ``sky' because blue is one of the typical colors of (a/an) sky'.	``Orange'' is one for the first things which come to mind when I hear ``milk'' because orange is one of the typical colors of (a/an) milk'.	4	1	https://app.prolific.co/submissions/complete?cc=610BF475	test_true-_test1-_test1	Agree or disagree (run4-experiment2-batch178-70-70)
