quid	description	exampleTrue	exampleFalse	run	subList	completionUrl	triple	name
307f92f2-9427-4500-a4c7-a8b20cacdc76	I could say (a/an) avocado is black, but I would most certainly not mean it literally.	"I could say (a/an) anger is hot, but I would most certainly not mean it literally.
I could say (a/an) person is cold, but I would most certainly not mean it literally.
I could say (a/an) story is dark, but I would most certainly not mean it literally."	"I could say (a/an) fire is hot, but I would most certainly not mean it literally.
I could say (a/an) stone is heavy, but I would most certainly not mean it literally.
I could say (a/an) argument is liquid, but I would most certainly not mean it literally."	4	1	https://app.prolific.co/submissions/complete?cc=3FE4CBF4	creative-black-avocado	Agree or disagree (run4-experiment2-batch79-70-70)
397564e0-ea2f-44ca-9ddb-ff70c3202ecf	I think (a/an) avocado can be black, but this is rare or uncommon.	I think (a/an) tomato can be yellow, but this is rare or uncommon.	I think (a/an) grizzly bear can be grey, but this is rare or uncommon.	4	1	https://app.prolific.co/submissions/complete?cc=3FE4CBF4	rare-black-avocado	Agree or disagree (run4-experiment2-batch79-70-70)
2addbefc-1fa2-42d1-94c0-b8cd8082887e	Usually, (a/an) avocado is not black, but there could be a highly unusual situation in which (a/an) avocado is black.	Usually, (a/an) chocolate is not pink, but there could be a highly unusual situation in which (a/an) chocolate is pink.	Usually, (a/an) chocolate is not brown, but there could be a highly unusual situation in which (a/an) chocolate is brown.	4	1	https://app.prolific.co/submissions/complete?cc=3FE4CBF4	unusual-black-avocado	Agree or disagree (run4-experiment2-batch79-70-70)
0fdd734b-3632-4172-b9fe-6c5957d3ad32	I think it is impossible for (a/an) avocado to be black.	I think it is impossible for (a/an) water to be dry.	I think it is impossible for (a/an) rose to be white.	4	1	https://app.prolific.co/submissions/complete?cc=3FE4CBF4	impossible-black-avocado	Agree or disagree (run4-experiment2-batch79-70-70)
b0b366e0-cb79-4039-ba59-689923529e27	I know that being sweet is necessary for many things (a/an) edda does or is used for. 	I know that being bright is necessary for many things (a/an) flashlight does or is used for. 	I know that being grey is necessary for many things (a/an) car does or is used for. 	4	1	https://app.prolific.co/submissions/complete?cc=3FE4CBF4	affording_activity-sweet-edda	Agree or disagree (run4-experiment2-batch79-70-70)
83caffcb-972d-492f-a32c-4bd10be26545	You can find (a/an) edda which is sweet. Sweet is one of a few possible tastes (a/an) edda usually has. There is only a limited range of possible tastes.	You can find (a/an) apple which is green. Green is one of a few possible colors (a/an) apple usually has. There is only a limited range of possible colors.	You can find (a/an) car which is white. White is one of a few possible colors (a/an) car usually has. There is only a limited range of possible colors.	4	1	https://app.prolific.co/submissions/complete?cc=3FE4CBF4	variability_limited-sweet-edda	Agree or disagree (run4-experiment2-batch79-70-70)
2e89e65a-6da2-4490-9ead-046767fe0b0f	Usually, (a/an) edda is not sweet, but there could be a highly unusual situation in which (a/an) edda is sweet.	Usually, (a/an) chocolate is not pink, but there could be a highly unusual situation in which (a/an) chocolate is pink.	Usually, (a/an) chocolate is not brown, but there could be a highly unusual situation in which (a/an) chocolate is brown.	4	1	https://app.prolific.co/submissions/complete?cc=3FE4CBF4	unusual-sweet-edda	Agree or disagree (run4-experiment2-batch79-70-70)
ccbdff23-7152-4b0b-9643-41896b926f08	``Sweet'' is one for the first things which come to mind when I hear ``edda' because sweet is one of the typical tastes of (a/an) edda'.	``Heavy'' is one for the first things which come to mind when I hear ``rock' because heavy is one of the typical weights of (a/an) rock'.	``Green'' is one for the first things which come to mind when I hear ``raspberry' because green is one of the typical colors of (a/an) raspberry'.	4	1	https://app.prolific.co/submissions/complete?cc=3FE4CBF4	typical_of_concept-sweet-edda	Agree or disagree (run4-experiment2-batch79-70-70)
122962f3-fdb2-4132-8e2a-5561dbca4901	``Edda'' is one of the first things which come to mind when I hear ``sweet' because (a/an) edda is a typical example of things which are sweet'. 	``Rainbow'' is one of the first things which come to mind when I hear ``colorful' because (a/an) rainbow is a typical example of things which are colorful'. 	``Table'' is one of the first things which come to mind when I hear ``white' because (a/an) table is a typical example of things which are white'. 	4	1	https://app.prolific.co/submissions/complete?cc=3FE4CBF4	typical_of_property-sweet-edda	Agree or disagree (run4-experiment2-batch79-70-70)
2ffccbb4-ccb7-4d72-add6-e0cf31f802bc	I could say (a/an) edda is sweet, but I would most certainly not mean it literally.	"I could say (a/an) anger is hot, but I would most certainly not mean it literally.
I could say (a/an) person is cold, but I would most certainly not mean it literally.
I could say (a/an) story is dark, but I would most certainly not mean it literally."	"I could say (a/an) fire is hot, but I would most certainly not mean it literally.
I could say (a/an) stone is heavy, but I would most certainly not mean it literally.
I could say (a/an) argument is liquid, but I would most certainly not mean it literally."	4	1	https://app.prolific.co/submissions/complete?cc=3FE4CBF4	creative-sweet-edda	Agree or disagree (run4-experiment2-batch79-70-70)
77b997b7-b959-4e30-a935-e92ae0574c11	I think it is impossible for (a/an) edda to be sweet.	I think it is impossible for (a/an) water to be dry.	I think it is impossible for (a/an) rose to be white.	4	1	https://app.prolific.co/submissions/complete?cc=3FE4CBF4	impossible-sweet-edda	Agree or disagree (run4-experiment2-batch79-70-70)
6131c5b2-28bb-4519-a0dc-a291b1302c75	You can find (a/an) edda which is sweet. Sweet is one of many possible tastes (a/an) edda usually has. The range of tastes is almost unlimited. 	You can find (a/an) t-shirt which is white. White is one of many possible colors (a/an) t-shirt usually has. The range of colors is almost unlimited. 	You can find (a/an) pepper which is green. Green is one of many possible colors (a/an) pepper usually has. The range of colors is almost unlimited. 	4	1	https://app.prolific.co/submissions/complete?cc=3FE4CBF4	variability_open-sweet-edda	Agree or disagree (run4-experiment2-batch79-70-70)
f3f5258a-ad06-4e8b-819b-f4f127b08640	I think (a/an) edda can be sweet, but this is rare or uncommon.	I think (a/an) rose can be black, but this is rare or uncommon.	I think (a/an) rose can be yellow, but this is rare or uncommon.	4	1	https://app.prolific.co/submissions/complete?cc=3FE4CBF4	rare-sweet-edda	Agree or disagree (run4-experiment2-batch79-70-70)
4089afd1-c777-4786-995a-6efe793f2c63	I know that (a/an) edda is sweet as most or all other things similar to (a/an) edda are sweet. 	I know that (a/an) cotten_candy is sweet as most or all other things similar to (a/an) cotten_candy are sweet. 	I know that (a/an) dress is white as most or all other things similar to (a/an) dress are white. 	4	1	https://app.prolific.co/submissions/complete?cc=3FE4CBF4	implied_category-sweet-edda	Agree or disagree (run4-experiment2-batch79-70-70)
3fe0f7e0-c57d-459c-bfd4-029182107a73	I know that (a/an) butterfly can fly/be used for flying as most or all other things similar to (a/an) butterfly fly. 	I know that (a/an) apple_tree can grow/be used for growing as most or all other things similar to (a/an) apple_tree grow. 	I know that (a/an) worm can run/be used for runing as most or all other things similar to (a/an) worm run. 	4	1	https://app.prolific.co/submissions/complete?cc=3FE4CBF4	implied_category-fly-butterfly	Agree or disagree (run4-experiment2-batch79-70-70)
cdfd8843-84c1-4ab1-b73a-aecff6dddef4	``Fly'' is one for the first things which come to mind when I hear ``butterfly' because flying is one of the typical movements of (a/an) butterfly'.	``Paint'' is one for the first things which come to mind when I hear ``brush' because painting is one of the typical activities of (a/an) brush'.	``Throw'' is one for the first things which come to mind when I hear ``apple' because throwing is one of the typical activites of (a/an) apple'.	4	1	https://app.prolific.co/submissions/complete?cc=3FE4CBF4	typical_of_concept-fly-butterfly	Agree or disagree (run4-experiment2-batch79-70-70)
23fd9002-ea6c-457b-86d7-4a92abc025a8	I think there is a butterfly  which can fly/be used for flying, but this is rare or uncommon.	I think there is a toddler  which can read/be used for reading, but this is rare or uncommon.	I think there is a teenager  which can read/be used for reading, but this is rare or uncommon.	4	1	https://app.prolific.co/submissions/complete?cc=3FE4CBF4	rare-fly-butterfly	Agree or disagree (run4-experiment2-batch79-70-70)
1f4c5af6-2192-45de-9047-c69037e166bd	I think it is impossible for (a/an) butterfly to fly/be used for flying.	I think it is impossible for (a/an) worm to walk/be used for walking.	I think it is impossible for (a/an) worm to move/be used for moveing.	4	1	https://app.prolific.co/submissions/complete?cc=3FE4CBF4	impossible-fly-butterfly	Agree or disagree (run4-experiment2-batch79-70-70)
ae717a05-ffce-42c3-84da-1edfda97137f	I could say (a/an) butterfly flies/is used for flying, but I would most certainly not mean it literally.	"I could say (a/an) idea grows/is used for growing, but I would most certainly not mean it literally.
I could say (a/an) person glows/is used for glowing, but I would most certainly not mean it literally.
I could say (a/an) thought burns/is used for burning, but I would most certainly not mean it literally."	"I could say (a/an) plant grows/is used for growing, but I would most certainly not mean it literally.
I could say (a/an) situation smiles/is used for smileing, but I would most certainly not mean it literally.
I could say (a/an) candle burns/is used for burning, but I would most certainly not mean it literally."	4	1	https://app.prolific.co/submissions/complete?cc=3FE4CBF4	creative-fly-butterfly	Agree or disagree (run4-experiment2-batch79-70-70)
760b3a7b-9ff8-40a6-b27e-7cdad9ff0611	All or most  butterfly(s) can fly/be used for flying. This is not what they normally do or are used for. 	All or most  fork(s) can fight/be used for fighting. This is not what they normally do or are used for. 	All or most  brush(s) can fly/be used for flying. This is not what they normally do or are used for. 	4	1	https://app.prolific.co/submissions/complete?cc=3FE4CBF4	afforded_unusual-fly-butterfly	Agree or disagree (run4-experiment2-batch79-70-70)
7e433eac-b5ed-45c0-a773-7c7c596c4c42	I know that all or most butterfly(s) fly regularly or are used for flying regularly. 	I know that all or most bug(s) crawl regularly or are used for crawling regularly. 	I know that all or most toothbrush(s) paint regularly or are used for painting regularly. 	4	1	https://app.prolific.co/submissions/complete?cc=3FE4CBF4	afforded_usual-fly-butterfly	Agree or disagree (run4-experiment2-batch79-70-70)
9ea1ea79-9e22-4e2b-9144-dbee630d5ecf	Usually, (a/an) butterfly cannot fly/be used for flying, but there could be a highly unusual situation in which (a/an) butterfly can fly.	Usually, (a/an) dog cannot speak/be used for speaking, but there could be a highly unusual situation in which (a/an) dog can speak.	Usually, (a/an) dog cannot bark/be used for barking, but there could be a highly unusual situation in which (a/an) dog can bark.	4	1	https://app.prolific.co/submissions/complete?cc=3FE4CBF4	unusual-fly-butterfly	Agree or disagree (run4-experiment2-batch79-70-70)
25c1546a-1b14-449b-a0aa-edc8f5227171	``Butterfly'' is one of the first things which come to mind when I hear ``fly' because (a/an) butterfly is a typical example of things which fly/are used for flying'. 	``Baby'' is one of the first things which come to mind when I hear ``cry' because (a/an) baby is a typical example of things which cry/are used for crying'. 	``Teacher'' is one of the first things which come to mind when I hear ``walk' because (a/an) teacher is a typical example of things which walk/are used for walking'. 	4	1	https://app.prolific.co/submissions/complete?cc=3FE4CBF4	typical_of_property-fly-butterfly	Agree or disagree (run4-experiment2-batch79-70-70)
bd485c02-f82b-400e-bfc9-8a168e5601a8	You can find (a/an) butterfly which can fly/be used for flying. This distinguishes a certain type of butterfly from others. 	You can find (a/an) lamp which can read/be used for reading. This distinguishes a certain type of lamp from others. 	You can find (a/an) coat which can cook/be used for cooking. This distinguishes a certain type of coat from others. 	4	1	https://app.prolific.co/submissions/complete?cc=3FE4CBF4	variability_limited-fly-butterfly	Agree or disagree (run4-experiment2-batch79-70-70)
4aea3d2b-64d2-4396-b16f-86443e2e68f5	I know that being square is necessary for many things (a/an) screen does or is used for. 	I know that being bright is necessary for many things (a/an) flashlight does or is used for. 	I know that being grey is necessary for many things (a/an) car does or is used for. 	4	1	https://app.prolific.co/submissions/complete?cc=3FE4CBF4	affording_activity-square-screen	Agree or disagree (run4-experiment2-batch79-70-70)
f5680553-7433-48de-954c-1e2d42226b52	I think (a/an) screen can be square, but this is rare or uncommon.	I think (a/an) rose can be black, but this is rare or uncommon.	I think (a/an) rose can be yellow, but this is rare or uncommon.	4	1	https://app.prolific.co/submissions/complete?cc=3FE4CBF4	rare-square-screen	Agree or disagree (run4-experiment2-batch79-70-70)
81a1b9e1-d420-4594-9f3e-1444cc0ea4a3	I know that (a/an) screen is square as most or all other things similar to (a/an) screen are square. 	I know that (a/an) chocoloate_cake is sweet as most or all other things similar to (a/an) chocoloate_cake are sweet. 	I know that (a/an) table is transparent as most or all other things similar to (a/an) table are transparent. 	4	1	https://app.prolific.co/submissions/complete?cc=3FE4CBF4	implied_category-square-screen	Agree or disagree (run4-experiment2-batch79-70-70)
e7994432-8a8a-446b-b964-f1561c1d728a	Usually, (a/an) screen is not square, but there could be a highly unusual situation in which (a/an) screen is square.	Usually, (a/an) pony is not blue, but there could be a highly unusual situation in which (a/an) pony is blue.	Usually, (a/an) beer is not brown, but there could be a highly unusual situation in which (a/an) beer is brown.	4	1	https://app.prolific.co/submissions/complete?cc=3FE4CBF4	unusual-square-screen	Agree or disagree (run4-experiment2-batch79-70-70)
c002623d-55b6-443d-9c13-a41966c280ea	You can find (a/an) screen which is square. Square is one of many possible shapes (a/an) screen usually has. The range of shapes is almost unlimited. 	You can find (a/an) t-shirt which is white. White is one of many possible colors (a/an) t-shirt usually has. The range of colors is almost unlimited. 	You can find (a/an) pepper which is green. Green is one of many possible colors (a/an) pepper usually has. The range of colors is almost unlimited. 	4	1	https://app.prolific.co/submissions/complete?cc=3FE4CBF4	variability_open-square-screen	Agree or disagree (run4-experiment2-batch79-70-70)
85386b50-ee83-43cb-9cd6-99b35b6a7fd7	I could say (a/an) screen is square, but I would most certainly not mean it literally.	"I could say (a/an) anger is hot, but I would most certainly not mean it literally.
I could say (a/an) person is cold, but I would most certainly not mean it literally.
I could say (a/an) story is dark, but I would most certainly not mean it literally."	"I could say (a/an) fire is hot, but I would most certainly not mean it literally.
I could say (a/an) stone is heavy, but I would most certainly not mean it literally.
I could say (a/an) argument is liquid, but I would most certainly not mean it literally."	4	1	https://app.prolific.co/submissions/complete?cc=3FE4CBF4	creative-square-screen	Agree or disagree (run4-experiment2-batch79-70-70)
929c202a-3220-4c39-84b0-9ee77f359beb	``Screen'' is one of the first things which come to mind when I hear ``square' because (a/an) screen is a typical example of things which are square'. 	``Rainbow'' is one of the first things which come to mind when I hear ``colorful' because (a/an) rainbow is a typical example of things which are colorful'. 	``Table'' is one of the first things which come to mind when I hear ``white' because (a/an) table is a typical example of things which are white'. 	4	1	https://app.prolific.co/submissions/complete?cc=3FE4CBF4	typical_of_property-square-screen	Agree or disagree (run4-experiment2-batch79-70-70)
6199d896-46b6-4378-916d-a9936df12767	You can find (a/an) screen which is square. Square is one of a few possible shapes (a/an) screen usually has. There is only a limited range of possible shapes.	You can find (a/an) apple which is green. Green is one of a few possible colors (a/an) apple usually has. There is only a limited range of possible colors.	You can find (a/an) car which is white. White is one of a few possible colors (a/an) car usually has. There is only a limited range of possible colors.	4	1	https://app.prolific.co/submissions/complete?cc=3FE4CBF4	variability_limited-square-screen	Agree or disagree (run4-experiment2-batch79-70-70)
3de8071e-838e-4b52-b813-87d19493193f	I think it is impossible for (a/an) screen to be square.	I think it is impossible for (a/an) steam to be solid.	I think it is impossible for (a/an) flame to be orange.	4	1	https://app.prolific.co/submissions/complete?cc=3FE4CBF4	impossible-square-screen	Agree or disagree (run4-experiment2-batch79-70-70)
b98287ec-9e55-4c2b-a7d1-21eba7ecdba6	``Square'' is one for the first things which come to mind when I hear ``screen' because square is one of the typical shapes of (a/an) screen'.	``Spicy'' is one for the first things which come to mind when I hear ``chili_pepper' because spicy is one of the typical tastes of (a/an) chili_pepper'.	``Sweet'' is one for the first things which come to mind when I hear ``spinach' because sweet is one of the typical tastes of (a/an) spinach'.	4	1	https://app.prolific.co/submissions/complete?cc=3FE4CBF4	typical_of_concept-square-screen	Agree or disagree (run4-experiment2-batch79-70-70)
157cfee0-c421-4b72-835b-909866df5849	I think (a/an) eucalyptus can be yellow, but this is rare or uncommon.	I think (a/an) rose can be black, but this is rare or uncommon.	I think (a/an) rose can be yellow, but this is rare or uncommon.	4	1	https://app.prolific.co/submissions/complete?cc=3FE4CBF4	rare-yellow-eucalyptus	Agree or disagree (run4-experiment2-batch79-70-70)
91713929-184d-4453-838c-45431ad7a121	I think it is impossible for (a/an) eucalyptus to be yellow.	I think it is impossible for (a/an) water to be dry.	I think it is impossible for (a/an) rose to be white.	4	1	https://app.prolific.co/submissions/complete?cc=3FE4CBF4	impossible-yellow-eucalyptus	Agree or disagree (run4-experiment2-batch79-70-70)
b441477e-6668-469a-8959-6bb9c69d9a3d	Usually, (a/an) eucalyptus is not yellow, but there could be a highly unusual situation in which (a/an) eucalyptus is yellow.	Usually, (a/an) dog is not green, but there could be a highly unusual situation in which (a/an) dog is green.	Usually, (a/an) razor is not sharp, but there could be a highly unusual situation in which (a/an) razor is sharp.	4	1	https://app.prolific.co/submissions/complete?cc=3FE4CBF4	unusual-yellow-eucalyptus	Agree or disagree (run4-experiment2-batch79-70-70)
14f04146-4b06-48e1-94f3-9d5102339e03	I could say (a/an) eucalyptus is yellow, but I would most certainly not mean it literally.	"I could say (a/an) anger is hot, but I would most certainly not mean it literally.
I could say (a/an) person is cold, but I would most certainly not mean it literally.
I could say (a/an) story is dark, but I would most certainly not mean it literally."	"I could say (a/an) fire is hot, but I would most certainly not mean it literally.
I could say (a/an) stone is heavy, but I would most certainly not mean it literally.
I could say (a/an) argument is liquid, but I would most certainly not mean it literally."	4	1	https://app.prolific.co/submissions/complete?cc=3FE4CBF4	creative-yellow-eucalyptus	Agree or disagree (run4-experiment2-batch79-70-70)
ee89cdb3-2fbe-47f8-b8d6-576ed3e45bd9	I think it is impossible for (a/an) beaver to lay_eggs/be used for laying eggs.	I think it is impossible for (a/an) hammer to float/be used for floating.	I think it is impossible for (a/an) apple to rot/be used for roting.	4	1	https://app.prolific.co/submissions/complete?cc=3FE4CBF4	impossible-lay_eggs-beaver	Agree or disagree (run4-experiment2-batch79-70-70)
fb4db5cd-6923-4aad-951e-d099e04fd806	``Lay_eggs'' is one for the first things which come to mind when I hear ``beaver' because laying eggs is one of the typical activities of (a/an) beaver'.	``Poke'' is one for the first things which come to mind when I hear ``needle' because pokeing is one of the typical activities of (a/an) needle'.	``Cut'' is one for the first things which come to mind when I hear ``brush' because cuting is one of the typical activities of (a/an) brush'.	4	1	https://app.prolific.co/submissions/complete?cc=3FE4CBF4	typical_of_concept-lay_eggs-beaver	Agree or disagree (run4-experiment2-batch79-70-70)
80a37d42-b689-451d-adf3-d7a6e18c9766	``Beaver'' is one of the first things which come to mind when I hear ``lay_eggs' because (a/an) beaver is a typical example of things which lay_eggs/are used for laying eggs'. 	``Cat'' is one of the first things which come to mind when I hear ``purr' because (a/an) cat is a typical example of things which purr/are used for purring'. 	``Dog'' is one of the first things which come to mind when I hear ``run' because (a/an) dog is a typical example of things which run/are used for runing'. 	4	1	https://app.prolific.co/submissions/complete?cc=3FE4CBF4	typical_of_property-lay_eggs-beaver	Agree or disagree (run4-experiment2-batch79-70-70)
b8646a5a-860a-4246-825c-dc5e57cf4a7f	I think there is a beaver  which can lay_eggs/be used for laying eggs, but this is rare or uncommon.	I think there is a car  which can swim/be used for swimming, but this is rare or uncommon.	I think there is a rock  which can swim/be used for swimming, but this is rare or uncommon.	4	1	https://app.prolific.co/submissions/complete?cc=3FE4CBF4	rare-lay_eggs-beaver	Agree or disagree (run4-experiment2-batch79-70-70)
7dd36183-18a9-44ab-96f4-3eed13c18152	Usually, (a/an) beaver cannot lay_eggs/be used for laying eggs, but there could be a highly unusual situation in which (a/an) beaver can lay_eggs.	Usually, (a/an) rat cannot cook/be used for cooking, but there could be a highly unusual situation in which (a/an) rat can cook.	Usually, (a/an) teacher cannot teach/be used for teaching, but there could be a highly unusual situation in which (a/an) teacher can teach.	4	1	https://app.prolific.co/submissions/complete?cc=3FE4CBF4	unusual-lay_eggs-beaver	Agree or disagree (run4-experiment2-batch79-70-70)
d87dba48-835d-4434-95f7-13633260c9b0	I could say (a/an) beaver lays eggs/is used for laying eggs, but I would most certainly not mean it literally.	"I could say (a/an) idea grows/is used for growing, but I would most certainly not mean it literally.
I could say (a/an) person glows/is used for glowing, but I would most certainly not mean it literally.
I could say (a/an) thought burns/is used for burning, but I would most certainly not mean it literally."	"I could say (a/an) plant grows/is used for growing, but I would most certainly not mean it literally.
I could say (a/an) situation smiles/is used for smileing, but I would most certainly not mean it literally.
I could say (a/an) candle burns/is used for burning, but I would most certainly not mean it literally."	4	1	https://app.prolific.co/submissions/complete?cc=3FE4CBF4	creative-lay_eggs-beaver	Agree or disagree (run4-experiment2-batch79-70-70)
f235d79c-c396-4737-8409-de85fefd9ebc	I know that (a/an) beaver can lay_eggs/be used for laying eggs as most or all other things similar to (a/an) beaver lay_eggs. 	I know that (a/an) apple_tree can grow/be used for growing as most or all other things similar to (a/an) apple_tree grow. 	I know that (a/an) worm can run/be used for runing as most or all other things similar to (a/an) worm run. 	4	1	https://app.prolific.co/submissions/complete?cc=3FE4CBF4	implied_category-lay_eggs-beaver	Agree or disagree (run4-experiment2-batch79-70-70)
e3b2f394-b730-4c3e-b954-ba914c8fbdb4	All or most  beaver(s) can lay_eggs/be used for laying eggs. This is not what they normally do or are used for. 	All or most  T-shirt(s) can clean/be used for cleaning. This is not what they normally do or are used for. 	All or most  sponge(s) can clean/be used for cleaning. This is not what they normally do or are used for. 	4	1	https://app.prolific.co/submissions/complete?cc=3FE4CBF4	afforded_unusual-lay_eggs-beaver	Agree or disagree (run4-experiment2-batch79-70-70)
f1d78056-b62b-454b-8f55-d6cf3fed3a50	You can find (a/an) beaver which can lay_eggs/be used for laying eggs. This distinguishes a certain type of beaver from others. 	You can find (a/an) lamp which can read/be used for reading. This distinguishes a certain type of lamp from others. 	You can find (a/an) coat which can cook/be used for cooking. This distinguishes a certain type of coat from others. 	4	1	https://app.prolific.co/submissions/complete?cc=3FE4CBF4	variability_limited-lay_eggs-beaver	Agree or disagree (run4-experiment2-batch79-70-70)
