quid	description	exampleTrue	exampleFalse	run	subList	completionUrl	triple	name
d24c51d3-f081-4893-aec0-37f059960951	Usually, (a/an) starter is not dangerous, but there could be a highly unusual situation in which (a/an) starter is dangerous.	Usually, (a/an) pony is not blue, but there could be a highly unusual situation in which (a/an) pony is blue.	Usually, (a/an) beer is not brown, but there could be a highly unusual situation in which (a/an) beer is brown.	4	1	https://app.prolific.co/submissions/complete?cc=616B1FA4	unusual-dangerous-starter	Agree or disagree (run4-experiment2-batch162-70-70)
569ae673-468a-4d53-a985-691fb9fa5ad8	I could say (a/an) starter is dangerous, but I would most certainly not mean it literally.	"I could say (a/an) anger is hot, but I would most certainly not mean it literally.
I could say (a/an) person is cold, but I would most certainly not mean it literally.
I could say (a/an) story is dark, but I would most certainly not mean it literally."	"I could say (a/an) fire is hot, but I would most certainly not mean it literally.
I could say (a/an) stone is heavy, but I would most certainly not mean it literally.
I could say (a/an) argument is liquid, but I would most certainly not mean it literally."	4	1	https://app.prolific.co/submissions/complete?cc=616B1FA4	creative-dangerous-starter	Agree or disagree (run4-experiment2-batch162-70-70)
8cef2304-52f2-4c11-9073-0ea79a546348	``Starter'' is one of the first things which come to mind when I hear ``dangerous' because (a/an) starter is a typical example of things which are dangerous'. 	``Pasta'' is one of the first things which come to mind when I hear ``Italian' because (a/an) pasta is a typical example of things which are Italian'. 	``Sweater'' is one of the first things which come to mind when I hear ``beautiful' because (a/an) sweater is a typical example of things which are beautiful'. 	4	1	https://app.prolific.co/submissions/complete?cc=616B1FA4	typical_of_property-dangerous-starter	Agree or disagree (run4-experiment2-batch162-70-70)
8952e227-e953-4fdb-96e4-b97cd1dfc7ab	I know that being square is necessary for many things (a/an) dongle does or is used for. 	I know that being sharp is necessary for many things (a/an) razor does or is used for. 	I know that being colorful is necessary for many things (a/an) dress does or is used for. 	4	1	https://app.prolific.co/submissions/complete?cc=616B1FA4	affording_activity-square-dongle	Agree or disagree (run4-experiment2-batch162-70-70)
a8ff15d1-f5c3-41ca-9ba9-38bb9ca4727a	I could say (a/an) dongle is square, but I would most certainly not mean it literally.	"I could say (a/an) anger is hot, but I would most certainly not mean it literally.
I could say (a/an) person is cold, but I would most certainly not mean it literally.
I could say (a/an) story is dark, but I would most certainly not mean it literally."	"I could say (a/an) fire is hot, but I would most certainly not mean it literally.
I could say (a/an) stone is heavy, but I would most certainly not mean it literally.
I could say (a/an) argument is liquid, but I would most certainly not mean it literally."	4	1	https://app.prolific.co/submissions/complete?cc=616B1FA4	creative-square-dongle	Agree or disagree (run4-experiment2-batch162-70-70)
da6e8a4f-759e-4c4c-a4b9-c204d5a38940	You can find (a/an) dongle which is square. Square is one of many possible shapes (a/an) dongle usually has. The range of shapes is almost unlimited. 	You can find (a/an) dress which is white. White is one of many possible colors (a/an) dress usually has. The range of colors is almost unlimited. 	You can find (a/an) pea which is green. Green is one of many possible colors (a/an) pea usually has. The range of colors is almost unlimited. 	4	1	https://app.prolific.co/submissions/complete?cc=616B1FA4	variability_open-square-dongle	Agree or disagree (run4-experiment2-batch162-70-70)
9431f365-f3b2-4436-af44-34f6e23e55bf	You can find (a/an) dongle which is square. Square is one of a few possible shapes (a/an) dongle usually has. There is only a limited range of possible shapes.	You can find (a/an) pepper which is red. Red is one of a few possible colors (a/an) pepper usually has. There is only a limited range of possible colors.	You can find (a/an) t-shirt which is red. Red is one of a few possible colors (a/an) t-shirt usually has. There is only a limited range of possible colors.	4	1	https://app.prolific.co/submissions/complete?cc=616B1FA4	variability_limited-square-dongle	Agree or disagree (run4-experiment2-batch162-70-70)
4f555435-49ed-44b4-8dc7-735132adaa96	Usually, (a/an) dongle is not square, but there could be a highly unusual situation in which (a/an) dongle is square.	Usually, (a/an) pony is not blue, but there could be a highly unusual situation in which (a/an) pony is blue.	Usually, (a/an) beer is not brown, but there could be a highly unusual situation in which (a/an) beer is brown.	4	1	https://app.prolific.co/submissions/complete?cc=616B1FA4	unusual-square-dongle	Agree or disagree (run4-experiment2-batch162-70-70)
6bd358be-c625-4c84-abb7-81b9b653d082	``Dongle'' is one of the first things which come to mind when I hear ``square' because (a/an) dongle is a typical example of things which are square'. 	``Snow'' is one of the first things which come to mind when I hear ``white' because (a/an) snow is a typical example of things which are white'. 	``Water'' is one of the first things which come to mind when I hear ``grey' because (a/an) water is a typical example of things which are grey'. 	4	1	https://app.prolific.co/submissions/complete?cc=616B1FA4	typical_of_property-square-dongle	Agree or disagree (run4-experiment2-batch162-70-70)
7f274cb4-1e48-4326-9bde-5bf0ed613fca	I know that (a/an) dongle is square as most or all other things similar to (a/an) dongle are square. 	I know that (a/an) chocoloate_cake is sweet as most or all other things similar to (a/an) chocoloate_cake are sweet. 	I know that (a/an) table is transparent as most or all other things similar to (a/an) table are transparent. 	4	1	https://app.prolific.co/submissions/complete?cc=616B1FA4	implied_category-square-dongle	Agree or disagree (run4-experiment2-batch162-70-70)
4d0c04b5-7dc9-49ba-a6cd-30caa1bbec04	``Square'' is one for the first things which come to mind when I hear ``dongle' because square is one of the typical shapes of (a/an) dongle'.	``Heavy'' is one for the first things which come to mind when I hear ``rock' because heavy is one of the typical weights of (a/an) rock'.	``Green'' is one for the first things which come to mind when I hear ``raspberry' because green is one of the typical colors of (a/an) raspberry'.	4	1	https://app.prolific.co/submissions/complete?cc=616B1FA4	typical_of_concept-square-dongle	Agree or disagree (run4-experiment2-batch162-70-70)
b4fdabfb-d9df-4a51-90f9-29f5934f4277	I think it is impossible for (a/an) dongle to be square.	I think it is impossible for (a/an) water to be dry.	I think it is impossible for (a/an) rose to be white.	4	1	https://app.prolific.co/submissions/complete?cc=616B1FA4	impossible-square-dongle	Agree or disagree (run4-experiment2-batch162-70-70)
69a89652-682d-428c-b488-af5f4bacfc4a	I think (a/an) dongle can be square, but this is rare or uncommon.	I think (a/an) rose can be black, but this is rare or uncommon.	I think (a/an) rose can be yellow, but this is rare or uncommon.	4	1	https://app.prolific.co/submissions/complete?cc=616B1FA4	rare-square-dongle	Agree or disagree (run4-experiment2-batch162-70-70)
4ea83a73-27fc-4ab9-a8f9-08df8da93142	You can find (a/an) footrest which is made_of_wood. Made_of_wood is one of a few possible materials (a/an) footrest is usually made of. There is only a limited range of possible materials.	You can find (a/an) table which is made_of_glass. Made_of_glass is one of a few possible materials (a/an) table is usually made of. There is only a limited range of possible materials.	You can find (a/an) plate which is made_of_sugar. Made_of_sugar is one of a few possible materials (a/an) plate is usually made of. There is only a limited range of possible materials.	4	1	https://app.prolific.co/submissions/complete?cc=616B1FA4	variability_limited-made_of_wood-footrest	Agree or disagree (run4-experiment2-batch162-70-70)
0908f690-419b-4212-9db4-445e38f05120	I know that (a/an) footrest is made_of_wood as most or all other things similar to (a/an) footrest are made_of_wood. 	I know that (a/an) sock is made_of_fabric as most or all other things similar to (a/an) sock are made_of_fabric. 	I know that (a/an) fork is made_of_gold as most or all other things similar to (a/an) fork are made_of_gold. 	4	1	https://app.prolific.co/submissions/complete?cc=616B1FA4	implied_category-made_of_wood-footrest	Agree or disagree (run4-experiment2-batch162-70-70)
f015f815-80b2-4448-beee-7d4dd74f2a80	I think it is impossible for (a/an) footrest to be made_of_wood.	I think it is impossible for (a/an) magnet to be made_of_plastic.	I think it is impossible for (a/an) paper clip to be made_of_metal.	4	1	https://app.prolific.co/submissions/complete?cc=616B1FA4	impossible-made_of_wood-footrest	Agree or disagree (run4-experiment2-batch162-70-70)
b3d7441d-8f06-493d-93e4-34a03a5c4529	``Made_of_wood'' is one for the first things which come to mind when I hear ``footrest' because made_of_wood is one of the typical materials of (a/an) footrest'.	``Made_of_china'' is one for the first things which come to mind when I hear ``mug' because made_of_china is one of the typical materials of (a/an) mug'.	``Made_of_metal'' is one for the first things which come to mind when I hear ``plate' because made_of_metal is one of the typical materials of (a/an) plate'.	4	1	https://app.prolific.co/submissions/complete?cc=616B1FA4	typical_of_concept-made_of_wood-footrest	Agree or disagree (run4-experiment2-batch162-70-70)
a4c1cbff-13df-4880-b642-e8a39309b3f1	Usually, (a/an) footrest is not made_of_wood, but there could be a highly unusual situation in which (a/an) footrest are made_of_wood.	Usually, (a/an) dress is not made_of_metal, but there could be a highly unusual situation in which (a/an) dress are made_of_metal.	Usually, (a/an) nail is not made_of_metal, but there could be a highly unusual situation in which (a/an) nail are made_of_metal.	4	1	https://app.prolific.co/submissions/complete?cc=616B1FA4	unusual-made_of_wood-footrest	Agree or disagree (run4-experiment2-batch162-70-70)
ff232590-20d0-49bd-9e9c-90e8d41907d5	I know that being made_of_wood is necessary for many things (a/an) footrest does or is used for. 	I know that having (a/an) bright is necessary for many things (a/an) flashlight does or is used for. 	I know that having (a/an) grey is necessary for many things (a/an) car does or is used for. 	4	1	https://app.prolific.co/submissions/complete?cc=616B1FA4	affording_activity-made_of_wood-footrest	Agree or disagree (run4-experiment2-batch162-70-70)
5d258f93-eccc-4968-9e1a-c99e8c6402de	I think (a/an) footrest can is made_of_wood, but this is rare or uncommon.	I think (a/an) wine_glass can is made_of_plastic, but this is rare or uncommon.	I think (a/an) wine_glass can is made_of_glass, but this is rare or uncommon.	4	1	https://app.prolific.co/submissions/complete?cc=616B1FA4	rare-made_of_wood-footrest	Agree or disagree (run4-experiment2-batch162-70-70)
93939948-8e75-4444-a010-c5d2df00a4ae	I could say (a/an) footrest is made_of_wood, but I would most certainly not mean it literally.	"I could say (a/an) anger has hot, but I would most certainly not mean it literally.
I could say (a/an) person has cold, but I would most certainly not mean it literally.
I could say (a/an) story has dark, but I would most certainly not mean it literally."	"I could say (a/an) fire has hot, but I would most certainly not mean it literally.
I could say (a/an) stone has heavy, but I would most certainly not mean it literally.
I could say (a/an) argument has liquid, but I would most certainly not mean it literally."	4	1	https://app.prolific.co/submissions/complete?cc=616B1FA4	creative-made_of_wood-footrest	Agree or disagree (run4-experiment2-batch162-70-70)
67dad5c8-2b43-4646-b95e-bc0b0a3d5c57	You can find (a/an) footrest which is made_of_wood. Made_of_wood is one of many possible materials (a/an) footrest is usually made of. The range of materials is almost unlimited. 	You can find (a/an) bouquet which is made_of_daysies. Made_of_daysies is one of many possible flowers (a/an) bouquet is usually made of. The range of flowers is almost unlimited. 	You can find (a/an) book which is made_of_paper. Made_of_paper is one of many possible materials (a/an) book is usually made of. The range of materials is almost unlimited. 	4	1	https://app.prolific.co/submissions/complete?cc=616B1FA4	variability_open-made_of_wood-footrest	Agree or disagree (run4-experiment2-batch162-70-70)
cd0be1e4-4372-4224-b293-af6d100a2c35	``Footrest'' is one of the first things which come to mind when I hear ``made_of_wood' because (a/an) footrest is a typical example of things which are (a/an) made_of_wood'. 	``Sweater'' is one of the first things which come to mind when I hear ``made_of_wool' because (a/an) sweater is a typical example of things which are (a/an) made_of_wool'. 	``T-shirt'' is one of the first things which come to mind when I hear ``made_of_wool' because (a/an) T-shirt is a typical example of things which are (a/an) made_of_wool'. 	4	1	https://app.prolific.co/submissions/complete?cc=616B1FA4	typical_of_property-made_of_wood-footrest	Agree or disagree (run4-experiment2-batch162-70-70)
check3	I am still focused on this task.	France is a country.	Amsterdam is a country.	4	1	https://app.prolific.co/submissions/complete?cc=616B1FA4	_check-_check3-_check3	Agree or disagree (run4-experiment2-batch162-70-70)
test1	``Yellow'' is one for the first things which come to mind when I hear ``canary' because yellow is one of the typical colors of (a/an) canary'.	``Blue'' is one for the first things which come to mind when I hear ``sky' because blue is one of the typical colors of (a/an) sky'.	``Orange'' is one for the first things which come to mind when I hear ``milk'' because orange is one of the typical colors of (a/an) milk'.	4	1	https://app.prolific.co/submissions/complete?cc=616B1FA4	test_true-_test1-_test1	Agree or disagree (run4-experiment2-batch162-70-70)
