quid	description	exampleTrue	exampleFalse	run	subList	completionUrl	triple	name
61c99cdf-a23b-4338-999f-d875f376e6d8	I think there is a capsule  which can fly/be used for flying, but this is rare or uncommon.	I think there is a toddler  which can read/be used for reading, but this is rare or uncommon.	I think there is a teenager  which can read/be used for reading, but this is rare or uncommon.	4	1	https://app.prolific.co/submissions/complete?cc=4C7ED9C9	rare-fly-capsule	Agree or disagree (run4-experiment2-batch14-70-70)
ce78987b-0792-4a60-aea7-20af6fe043bb	I could say (a/an) capsule flies/is used for flying, but I would most certainly not mean it literally.	"I could say (a/an) idea grows/is used for growing, but I would most certainly not mean it literally.
I could say (a/an) person glows/is used for glowing, but I would most certainly not mean it literally.
I could say (a/an) thought burns/is used for burning, but I would most certainly not mean it literally."	"I could say (a/an) plant grows/is used for growing, but I would most certainly not mean it literally.
I could say (a/an) situation smiles/is used for smileing, but I would most certainly not mean it literally.
I could say (a/an) candle burns/is used for burning, but I would most certainly not mean it literally."	4	1	https://app.prolific.co/submissions/complete?cc=4C7ED9C9	creative-fly-capsule	Agree or disagree (run4-experiment2-batch14-70-70)
562c7e3c-d6a1-4fc7-a0e8-c5577396a8db	You can find (a/an) capsule which can fly/be used for flying. This distinguishes a certain type of capsule from others. 	You can find (a/an) knife which can cook/be used for cooking. This distinguishes a certain type of knife from others. 	You can find (a/an) book which can read/be used for reading. This distinguishes a certain type of book from others. 	4	1	https://app.prolific.co/submissions/complete?cc=4C7ED9C9	variability_limited-fly-capsule	Agree or disagree (run4-experiment2-batch14-70-70)
cc597fa7-7c76-4c05-b909-1153ec3b0d86	``Fly'' is one for the first things which come to mind when I hear ``capsule' because flying is one of the typical movements of (a/an) capsule'.	``Cut'' is one for the first things which come to mind when I hear ``knife' because cuting is one of the typical activities of (a/an) knife'.	``Float'' is one for the first things which come to mind when I hear ``needle' because floating is one of the typical activities of (a/an) needle'.	4	1	https://app.prolific.co/submissions/complete?cc=4C7ED9C9	typical_of_concept-fly-capsule	Agree or disagree (run4-experiment2-batch14-70-70)
f703340b-016d-41a9-8586-207990b75c84	``Flageolet'' is one of the first things which come to mind when I hear ``sweet' because (a/an) flageolet is a typical example of things which are sweet'. 	``Mouse'' is one of the first things which come to mind when I hear ``small' because (a/an) mouse is a typical example of things which are small'. 	``Dog'' is one of the first things which come to mind when I hear ``small' because (a/an) dog is a typical example of things which are small'. 	4	1	https://app.prolific.co/submissions/complete?cc=4C7ED9C9	typical_of_property-sweet-flageolet	Agree or disagree (run4-experiment2-batch14-70-70)
93862da7-6352-48ae-880e-6f42835c1a59	You can find (a/an) flageolet which is sweet. Sweet is one of many possible tastes (a/an) flageolet usually has. The range of tastes is almost unlimited. 	You can find (a/an) dress which is white. White is one of many possible colors (a/an) dress usually has. The range of colors is almost unlimited. 	You can find (a/an) pea which is green. Green is one of many possible colors (a/an) pea usually has. The range of colors is almost unlimited. 	4	1	https://app.prolific.co/submissions/complete?cc=4C7ED9C9	variability_open-sweet-flageolet	Agree or disagree (run4-experiment2-batch14-70-70)
0f95f860-cd35-4652-b03d-ce2676a71644	I know that being sweet is necessary for many things (a/an) flageolet does or is used for. 	I know that being bright is necessary for many things (a/an) flashlight does or is used for. 	I know that being grey is necessary for many things (a/an) car does or is used for. 	4	1	https://app.prolific.co/submissions/complete?cc=4C7ED9C9	affording_activity-sweet-flageolet	Agree or disagree (run4-experiment2-batch14-70-70)
f1ff4c5f-f73e-4f1d-b183-17c8efee837c	``Sweet'' is one for the first things which come to mind when I hear ``flageolet' because sweet is one of the typical tastes of (a/an) flageolet'.	``Spicy'' is one for the first things which come to mind when I hear ``chili_pepper' because spicy is one of the typical tastes of (a/an) chili_pepper'.	``Sweet'' is one for the first things which come to mind when I hear ``spinach' because sweet is one of the typical tastes of (a/an) spinach'.	4	1	https://app.prolific.co/submissions/complete?cc=4C7ED9C9	typical_of_concept-sweet-flageolet	Agree or disagree (run4-experiment2-batch14-70-70)
de11b939-182c-454f-87b0-0fbb339cb37a	I think (a/an) flageolet can be sweet, but this is rare or uncommon.	I think (a/an) snail can be purple, but this is rare or uncommon.	I think (a/an) bell pepper can be green, but this is rare or uncommon.	4	1	https://app.prolific.co/submissions/complete?cc=4C7ED9C9	rare-sweet-flageolet	Agree or disagree (run4-experiment2-batch14-70-70)
76d15e4e-9557-4eba-b994-a42128c4ab9a	Usually, (a/an) flageolet is not sweet, but there could be a highly unusual situation in which (a/an) flageolet is sweet.	Usually, (a/an) dog is not green, but there could be a highly unusual situation in which (a/an) dog is green.	Usually, (a/an) razor is not sharp, but there could be a highly unusual situation in which (a/an) razor is sharp.	4	1	https://app.prolific.co/submissions/complete?cc=4C7ED9C9	unusual-sweet-flageolet	Agree or disagree (run4-experiment2-batch14-70-70)
bd830e80-2177-4cf9-9922-e8f6c8b1d61d	You can find (a/an) flageolet which is sweet. Sweet is one of a few possible tastes (a/an) flageolet usually has. There is only a limited range of possible tastes.	You can find (a/an) apple which is green. Green is one of a few possible colors (a/an) apple usually has. There is only a limited range of possible colors.	You can find (a/an) car which is white. White is one of a few possible colors (a/an) car usually has. There is only a limited range of possible colors.	4	1	https://app.prolific.co/submissions/complete?cc=4C7ED9C9	variability_limited-sweet-flageolet	Agree or disagree (run4-experiment2-batch14-70-70)
4698190e-e374-43f3-b099-e1543b223a5e	I could say (a/an) flageolet is sweet, but I would most certainly not mean it literally.	"I could say (a/an) anger is hot, but I would most certainly not mean it literally.
I could say (a/an) person is cold, but I would most certainly not mean it literally.
I could say (a/an) story is dark, but I would most certainly not mean it literally."	"I could say (a/an) fire is hot, but I would most certainly not mean it literally.
I could say (a/an) stone is heavy, but I would most certainly not mean it literally.
I could say (a/an) argument is liquid, but I would most certainly not mean it literally."	4	1	https://app.prolific.co/submissions/complete?cc=4C7ED9C9	creative-sweet-flageolet	Agree or disagree (run4-experiment2-batch14-70-70)
deb2d6b5-3f44-49fd-97b3-c974c3c82968	I know that (a/an) flageolet is sweet as most or all other things similar to (a/an) flageolet are sweet. 	I know that (a/an) cotten_candy is sweet as most or all other things similar to (a/an) cotten_candy are sweet. 	I know that (a/an) dress is white as most or all other things similar to (a/an) dress are white. 	4	1	https://app.prolific.co/submissions/complete?cc=4C7ED9C9	implied_category-sweet-flageolet	Agree or disagree (run4-experiment2-batch14-70-70)
4f3dd386-3875-429d-b7f9-03e477cce863	I think it is impossible for (a/an) flageolet to be sweet.	I think it is impossible for (a/an) flame to be frozen.	I think it is impossible for (a/an) book to be light.	4	1	https://app.prolific.co/submissions/complete?cc=4C7ED9C9	impossible-sweet-flageolet	Agree or disagree (run4-experiment2-batch14-70-70)
1a671c6b-c5d8-492a-aae8-0f2631a30409	I could say (a/an) diner has wheels, but I would most certainly not mean it literally.	"I could say (a/an) book has voice, but I would most certainly not mean it literally.
I could say (a/an) idea has gold, but I would most certainly not mean it literally.
I could say (a/an) situation has exit, but I would most certainly not mean it literally."	"I could say (a/an) person has head, but I would most certainly not mean it literally.
I could say (a/an) bike has saddle, but I would most certainly not mean it literally.
I could say (a/an) argument has nose, but I would most certainly not mean it literally."	4	1	https://app.prolific.co/submissions/complete?cc=4C7ED9C9	creative-wheels-diner	Agree or disagree (run4-experiment2-batch14-70-70)
33a39ddb-edca-4ad8-9cd5-ae3d01828312	You can find (a/an) diner which has (a/an) wheels.  (A/an) diner usually either have an wheels or no wheels but this does not distinguish a certain type of diner from others. 	You can find (a/an) dress which has (a/an) bow.  (A/an) dress usually either have an bow or no bow but this does not distinguish a certain type of dress from others. 	You can find (a/an) car which has (a/an) emergency lights.  (A/an) car usually either have an emergency lights or no emergency lights but this does not distinguish a certain type of car from others. 	4	1	https://app.prolific.co/submissions/complete?cc=4C7ED9C9	variability_open-wheels-diner	Agree or disagree (run4-experiment2-batch14-70-70)
5b3d37d4-4d3f-48f2-968b-0fc1e32e93c6	``Wheels'' is one for the first things which come to mind when I hear ``diner' because wheels is one of the typical parts of (a/an) diner'.	``Engine'' is one for the first things which come to mind when I hear ``car' because engine is one of the typical parts of (a/an) car'.	``Roof'' is one for the first things which come to mind when I hear ``car' because roof is one of the typical parts of (a/an) car'.	4	1	https://app.prolific.co/submissions/complete?cc=4C7ED9C9	typical_of_concept-wheels-diner	Agree or disagree (run4-experiment2-batch14-70-70)
c3ab9712-f4e8-4dd0-85ef-b6255cc79268	I know that (a/an) diner has (a/an) wheels as most or all other things similar to (a/an) diner have (a/an) wheels. 	I know that (a/an) pony has (a/an) mane as most or all other things similar to (a/an) pony have (a/an) mane. 	I know that (a/an) pen has (a/an) ink as most or all other things similar to (a/an) pen have (a/an) ink. 	4	1	https://app.prolific.co/submissions/complete?cc=4C7ED9C9	implied_category-wheels-diner	Agree or disagree (run4-experiment2-batch14-70-70)
31eadee8-7684-4100-b9c7-9f614c68d8db	``Diner'' is one of the first things which come to mind when I hear ``wheels' because (a/an) diner is a typical example of things which have (a/an) wheels'. 	``Lion'' is one of the first things which come to mind when I hear ``mane' because (a/an) lion is a typical example of things which have (a/an) mane'. 	``Unicycle'' is one of the first things which come to mind when I hear ``saddle' because (a/an) unicycle is a typical example of things which have (a/an) saddle'. 	4	1	https://app.prolific.co/submissions/complete?cc=4C7ED9C9	typical_of_property-wheels-diner	Agree or disagree (run4-experiment2-batch14-70-70)
0f4e7d19-f3f2-4543-a20d-7729789a70dc	I think (a/an) diner can has wheels, but this is rare or uncommon.	I think (a/an) mug can has batteries, but this is rare or uncommon.	I think (a/an) mug can has handle, but this is rare or uncommon.	4	1	https://app.prolific.co/submissions/complete?cc=4C7ED9C9	rare-wheels-diner	Agree or disagree (run4-experiment2-batch14-70-70)
08e756cf-b36b-48a4-b4e3-b5c11f437177	I think it is impossible for (a/an) diner to have wheels.	I think it is impossible for (a/an) cow to have fin.	I think it is impossible for (a/an) dolphin to have fin.	4	1	https://app.prolific.co/submissions/complete?cc=4C7ED9C9	impossible-wheels-diner	Agree or disagree (run4-experiment2-batch14-70-70)
03a5cb1f-212c-4869-8b2f-736c6824473a	You can find (a/an) diner which has (a/an) wheels. (A/an) diner usually either has an wheels or no wheels. This distinguishes a certain type of diner from others.	You can find (a/an) car which has (a/an) emergency light. (A/an) car usually either has an emergency light or no emergency light. This distinguishes a certain type of car from others.	You can find (a/an) car which has (a/an) spare_wheel. (A/an) car usually either has an spare_wheel or no spare_wheel. This distinguishes a certain type of car from others.	4	1	https://app.prolific.co/submissions/complete?cc=4C7ED9C9	variability_limited-wheels-diner	Agree or disagree (run4-experiment2-batch14-70-70)
61e38f51-bcf4-46ce-a20c-9eca34cb3aa4	Usually, (a/an) diner does not have wheels, but there could be a highly unusual situation in which (a/an) diner have wheels.	Usually, (a/an) car does not have wings, but there could be a highly unusual situation in which (a/an) car have wings.	Usually, (a/an) bird does not have wings, but there could be a highly unusual situation in which (a/an) bird have wings.	4	1	https://app.prolific.co/submissions/complete?cc=4C7ED9C9	unusual-wheels-diner	Agree or disagree (run4-experiment2-batch14-70-70)
c0271b68-55de-45ea-ab03-87336e7eac2a	I know that having (a/an) wheels is necessary for many things (a/an) diner does or is used for. 	I know that having (a/an) ink is necessary for many things (a/an) pen does or is used for. 	I know that having (a/an) tablecloth is necessary for many things (a/an) table does or is used for. 	4	1	https://app.prolific.co/submissions/complete?cc=4C7ED9C9	affording_activity-wheels-diner	Agree or disagree (run4-experiment2-batch14-70-70)
check2	I am working on a task in which I agree or disagree with statements.	Paris is a city.	Russia is a city.	4	1	https://app.prolific.co/submissions/complete?cc=4C7ED9C9	_check-_check2-_check2	Agree or disagree (run4-experiment2-batch14-70-70)
test1	``Yellow'' is one for the first things which come to mind when I hear ``canary' because yellow is one of the typical colors of (a/an) canary'.	``Blue'' is one for the first things which come to mind when I hear ``sky' because blue is one of the typical colors of (a/an) sky'.	``Orange'' is one for the first things which come to mind when I hear ``milk'' because orange is one of the typical colors of (a/an) milk'.	4	1	https://app.prolific.co/submissions/complete?cc=4C7ED9C9	test_true-_test1-_test1	Agree or disagree (run4-experiment2-batch14-70-70)
