quid	description	exampleTrue	exampleFalse	run	subList	completionUrl	triple	name
cec1e2ab-ea47-4961-8e5e-b0d56ad63730	I know that being black is necessary for many things (a/an) car does or is used for. 	I know that being pointy is necessary for many things (a/an) needle does or is used for. 	I know that being white is necessary for many things (a/an) t-shirt does or is used for. 	4	1	https://app.prolific.co/submissions/complete?cc=7CD84CEB	affording_activity-black-car	Agree or disagree (run4-experiment2-batch17-70-70)
23689546-c55b-4681-9b57-2f5c54180c6f	I could say (a/an) car is black, but I would most certainly not mean it literally.	"I could say (a/an) anger is hot, but I would most certainly not mean it literally.
I could say (a/an) person is cold, but I would most certainly not mean it literally.
I could say (a/an) story is dark, but I would most certainly not mean it literally."	"I could say (a/an) fire is hot, but I would most certainly not mean it literally.
I could say (a/an) stone is heavy, but I would most certainly not mean it literally.
I could say (a/an) argument is liquid, but I would most certainly not mean it literally."	4	1	https://app.prolific.co/submissions/complete?cc=7CD84CEB	creative-black-car	Agree or disagree (run4-experiment2-batch17-70-70)
23975e7e-fa47-4aae-9268-25d9574172e6	I think (a/an) car can be black, but this is rare or uncommon.	I think (a/an) tomato can be yellow, but this is rare or uncommon.	I think (a/an) grizzly bear can be grey, but this is rare or uncommon.	4	1	https://app.prolific.co/submissions/complete?cc=7CD84CEB	rare-black-car	Agree or disagree (run4-experiment2-batch17-70-70)
f6722f8a-5c39-499f-b14f-24b7da16ce36	You can find (a/an) car which is black. Black is one of a few possible colors (a/an) car usually has. There is only a limited range of possible colors.	You can find (a/an) rose which is white. White is one of a few possible colors (a/an) rose usually has. There is only a limited range of possible colors.	You can find (a/an) mug which is blue. Blue is one of a few possible colors (a/an) mug usually has. There is only a limited range of possible colors.	4	1	https://app.prolific.co/submissions/complete?cc=7CD84CEB	variability_limited-black-car	Agree or disagree (run4-experiment2-batch17-70-70)
b8a3077e-2c66-4ea1-9161-4fae6026e264	I think there is a monkey  which can fly/be used for flying, but this is rare or uncommon.	I think there is a student  which can teach/be used for teaching, but this is rare or uncommon.	I think there is a teacher  which can teach/be used for teaching, but this is rare or uncommon.	4	1	https://app.prolific.co/submissions/complete?cc=7CD84CEB	rare-fly-monkey	Agree or disagree (run4-experiment2-batch17-70-70)
a9e53283-4a1c-4e96-b369-5f11b64bf5c3	Usually, (a/an) monkey cannot fly/be used for flying, but there could be a highly unusual situation in which (a/an) monkey can fly.	Usually, (a/an) hot dog cannot walk/be used for walking, but there could be a highly unusual situation in which (a/an) hot dog can walk.	Usually, (a/an) cat cannot run/be used for runing, but there could be a highly unusual situation in which (a/an) cat can run.	4	1	https://app.prolific.co/submissions/complete?cc=7CD84CEB	unusual-fly-monkey	Agree or disagree (run4-experiment2-batch17-70-70)
b704ba42-b325-4b74-a4f3-2e0d11446016	``Monkey'' is one of the first things which come to mind when I hear ``fly' because (a/an) monkey is a typical example of things which fly/are used for flying'. 	``Knife'' is one of the first things which come to mind when I hear ``cut' because (a/an) knife is a typical example of things which cut/are used for cuting'. 	``Hamster'' is one of the first things which come to mind when I hear ``kill' because (a/an) hamster is a typical example of things which kill/are used for killing'. 	4	1	https://app.prolific.co/submissions/complete?cc=7CD84CEB	typical_of_property-fly-monkey	Agree or disagree (run4-experiment2-batch17-70-70)
41667166-b163-4555-adf1-81d8e2c2b4f5	I could say (a/an) monkey flies/is used for flying, but I would most certainly not mean it literally.	"I could say (a/an) idea grows/is used for growing, but I would most certainly not mean it literally.
I could say (a/an) person glows/is used for glowing, but I would most certainly not mean it literally.
I could say (a/an) thought burns/is used for burning, but I would most certainly not mean it literally."	"I could say (a/an) plant grows/is used for growing, but I would most certainly not mean it literally.
I could say (a/an) situation smiles/is used for smileing, but I would most certainly not mean it literally.
I could say (a/an) candle burns/is used for burning, but I would most certainly not mean it literally."	4	1	https://app.prolific.co/submissions/complete?cc=7CD84CEB	creative-fly-monkey	Agree or disagree (run4-experiment2-batch17-70-70)
14da6052-3052-49ad-b09b-50142e04f32a	You can find (a/an) monkey which can fly/be used for flying. This distinguishes a certain type of monkey from others. 	You can find (a/an) dog which can hunt/be used for hunting. This distinguishes a certain type of dog from others. 	You can find (a/an) dog which can breathe/be used for breathing. This distinguishes a certain type of dog from others. 	4	1	https://app.prolific.co/submissions/complete?cc=7CD84CEB	variability_limited-fly-monkey	Agree or disagree (run4-experiment2-batch17-70-70)
fe843850-6ec8-4d80-8040-ea76cb0dd9ee	I know that all or most monkey(s) fly regularly or are used for flying regularly. 	I know that all or most student(s) study regularly or are used for studying regularly. 	I know that all or most jeans(s) clean regularly or are used for cleaning regularly. 	4	1	https://app.prolific.co/submissions/complete?cc=7CD84CEB	afforded_usual-fly-monkey	Agree or disagree (run4-experiment2-batch17-70-70)
442c7464-97bf-491c-8231-e52b75663b97	All or most  monkey(s) can fly/be used for flying. This is not what they normally do or are used for. 	All or most  fork(s) can fight/be used for fighting. This is not what they normally do or are used for. 	All or most  brush(s) can fly/be used for flying. This is not what they normally do or are used for. 	4	1	https://app.prolific.co/submissions/complete?cc=7CD84CEB	afforded_unusual-fly-monkey	Agree or disagree (run4-experiment2-batch17-70-70)
e79cb150-c9c2-4cc8-bd59-25a47de555ab	I know that (a/an) monkey can fly/be used for flying as most or all other things similar to (a/an) monkey fly. 	I know that (a/an) poodle can bark/be used for barking as most or all other things similar to (a/an) poodle bark. 	I know that (a/an) dog can bark/be used for barking as most or all other things similar to (a/an) dog bark. 	4	1	https://app.prolific.co/submissions/complete?cc=7CD84CEB	implied_category-fly-monkey	Agree or disagree (run4-experiment2-batch17-70-70)
ad366517-3a6e-46f8-abb8-5560f80ffb0c	``Fly'' is one for the first things which come to mind when I hear ``monkey' because flying is one of the typical movements of (a/an) monkey'.	``Paint'' is one for the first things which come to mind when I hear ``brush' because painting is one of the typical activities of (a/an) brush'.	``Throw'' is one for the first things which come to mind when I hear ``apple' because throwing is one of the typical activites of (a/an) apple'.	4	1	https://app.prolific.co/submissions/complete?cc=7CD84CEB	typical_of_concept-fly-monkey	Agree or disagree (run4-experiment2-batch17-70-70)
559cc10b-0498-46d3-800d-cccbaf2a4d30	I think it is impossible for (a/an) monkey to fly/be used for flying.	I think it is impossible for (a/an) rock to float/be used for floating.	I think it is impossible for (a/an) metal to melt/be used for melting.	4	1	https://app.prolific.co/submissions/complete?cc=7CD84CEB	impossible-fly-monkey	Agree or disagree (run4-experiment2-batch17-70-70)
38e4f009-7655-4893-ae63-f59093687c1a	``Hot'' is one for the first things which come to mind when I hear ``pasta' because hot is one of the typical temperatures of (a/an) pasta'.	``Heavy'' is one for the first things which come to mind when I hear ``rock' because heavy is one of the typical weights of (a/an) rock'.	``Green'' is one for the first things which come to mind when I hear ``raspberry' because green is one of the typical colors of (a/an) raspberry'.	4	1	https://app.prolific.co/submissions/complete?cc=7CD84CEB	typical_of_concept-hot-pasta	Agree or disagree (run4-experiment2-batch17-70-70)
f3848e55-5353-4207-97db-c96ff1230dca	I think it is impossible for (a/an) pasta to be hot.	I think it is impossible for (a/an) steam to be solid.	I think it is impossible for (a/an) flame to be orange.	4	1	https://app.prolific.co/submissions/complete?cc=7CD84CEB	impossible-hot-pasta	Agree or disagree (run4-experiment2-batch17-70-70)
60ef62be-4cc0-4819-bc75-65acc37340df	I know that (a/an) pasta is hot as most or all other things similar to (a/an) pasta are hot. 	I know that (a/an) wine is liquid as most or all other things similar to (a/an) wine are liquid. 	I know that (a/an) bread is liquid as most or all other things similar to (a/an) bread are liquid. 	4	1	https://app.prolific.co/submissions/complete?cc=7CD84CEB	implied_category-hot-pasta	Agree or disagree (run4-experiment2-batch17-70-70)
e1e81877-24bd-4b21-9c19-b3a3bdd68f03	Usually, (a/an) pasta is not hot, but there could be a highly unusual situation in which (a/an) pasta is hot.	Usually, (a/an) pony is not blue, but there could be a highly unusual situation in which (a/an) pony is blue.	Usually, (a/an) razor is not sharp, but there could be a highly unusual situation in which (a/an) razor is sharp.	4	1	https://app.prolific.co/submissions/complete?cc=7CD84CEB	unusual-hot-pasta	Agree or disagree (run4-experiment2-batch17-70-70)
569b0afa-b2c0-44ed-99a8-0b161ca48f6b	You can find (a/an) pasta which is hot. (A/an) pasta is usually either hot or not hot. It cannot be a bit more or less hot.	You can find (a/an) substance which is liquid. (A/an) substance is usually either liquid or not liquid. It cannot be a bit more or less liquid.	You can find (a/an) knife which is sharp. (A/an) knife is usually either sharp or not sharp. It cannot be a bit more or less sharp.	4	1	https://app.prolific.co/submissions/complete?cc=7CD84CEB	variability_limited-hot-pasta	Agree or disagree (run4-experiment2-batch17-70-70)
a99e9237-580f-4068-bd00-e48bb6024f5c	I know that being hot is necessary for many things (a/an) pasta does or is used for. 	I know that being sharp is necessary for many things (a/an) razor does or is used for. 	I know that being colorful is necessary for many things (a/an) dress does or is used for. 	4	1	https://app.prolific.co/submissions/complete?cc=7CD84CEB	affording_activity-hot-pasta	Agree or disagree (run4-experiment2-batch17-70-70)
434f445b-2409-442a-8692-35280122b2bc	You can find (a/an) pasta which is hot. (A/an) pasta is usually either hot, a bit more or less hot or the opposite of hot.	You can find (a/an) chocolate which is bitter. (A/an) chocolate is usually either bitter, a bit more or less bitter or the opposite of bitter.	You can find (a/an) diamond which is soft. (A/an) diamond is usually either soft, a bit more or less soft or the opposite of soft.	4	1	https://app.prolific.co/submissions/complete?cc=7CD84CEB	variability_open-hot-pasta	Agree or disagree (run4-experiment2-batch17-70-70)
eb2491cd-5e1f-42ee-8893-6dcd7e1f953f	I could say (a/an) pasta is hot, but I would most certainly not mean it literally.	"I could say (a/an) anger is hot, but I would most certainly not mean it literally.
I could say (a/an) person is cold, but I would most certainly not mean it literally.
I could say (a/an) story is dark, but I would most certainly not mean it literally."	"I could say (a/an) fire is hot, but I would most certainly not mean it literally.
I could say (a/an) stone is heavy, but I would most certainly not mean it literally.
I could say (a/an) argument is liquid, but I would most certainly not mean it literally."	4	1	https://app.prolific.co/submissions/complete?cc=7CD84CEB	creative-hot-pasta	Agree or disagree (run4-experiment2-batch17-70-70)
cf55d019-7411-473d-9f32-fc0e730f09c8	I think (a/an) pasta can be hot, but this is rare or uncommon.	I think (a/an) pizza can be sweet, but this is rare or uncommon.	I think (a/an) pizza can be savory, but this is rare or uncommon.	4	1	https://app.prolific.co/submissions/complete?cc=7CD84CEB	rare-hot-pasta	Agree or disagree (run4-experiment2-batch17-70-70)
49f48e04-589e-4111-b26c-e2afd16ae184	``Pasta'' is one of the first things which come to mind when I hear ``hot' because (a/an) pasta is a typical example of things which are hot'. 	``Mouse'' is one of the first things which come to mind when I hear ``small' because (a/an) mouse is a typical example of things which are small'. 	``Dog'' is one of the first things which come to mind when I hear ``small' because (a/an) dog is a typical example of things which are small'. 	4	1	https://app.prolific.co/submissions/complete?cc=7CD84CEB	typical_of_property-hot-pasta	Agree or disagree (run4-experiment2-batch17-70-70)
check1	I am still paying attention to this task.	The earth is round. 	The earth is flat.	4	1	https://app.prolific.co/submissions/complete?cc=7CD84CEB	_check-_check1-_check1	Agree or disagree (run4-experiment2-batch17-70-70)
test2	``Blue'' is one for the first things which come to mind when I hear ``beer' because beer is one of the typical colors of (a/an) beer'.	``Red'' is one for the first things which come to mind when I hear ``blood' because red is one of the typical colors of (a/an) blood'.	``Grey'' is one for the first things which come to mind when I hear ``apple'' because grey is one of the typical colors of (a/an) apple'.	4	1	https://app.prolific.co/submissions/complete?cc=7CD84CEB	test_false-_test2-_test2	Agree or disagree (run4-experiment2-batch17-70-70)
