quid	description	exampleTrue	exampleFalse	run	subList	completionUrl	triple	name
aae14b52-97cc-4633-8465-93581926abbd	Usually, (a/an) tyre is not black, but there could be a highly unusual situation in which (a/an) tyre is black.	Usually, (a/an) pony is not blue, but there could be a highly unusual situation in which (a/an) pony is blue.	Usually, (a/an) beer is not brown, but there could be a highly unusual situation in which (a/an) beer is brown.	4	1	https://app.prolific.co/submissions/complete?cc=A98CC958	unusual-black-tyre	Agree or disagree (run4-experiment2-batch142-70-70)
4a4162ed-d9dd-46dd-bd9b-751ae8adce5c	``Tyre'' is one of the first things which come to mind when I hear ``black' because (a/an) tyre is a typical example of things which are black'. 	``Rainbow'' is one of the first things which come to mind when I hear ``colorful' because (a/an) rainbow is a typical example of things which are colorful'. 	``Table'' is one of the first things which come to mind when I hear ``white' because (a/an) table is a typical example of things which are white'. 	4	1	https://app.prolific.co/submissions/complete?cc=A98CC958	typical_of_property-black-tyre	Agree or disagree (run4-experiment2-batch142-70-70)
79078971-db51-4820-94f4-d631e1c91e70	You can find (a/an) tyre which is black. Black is one of a few possible colors (a/an) tyre usually has. There is only a limited range of possible colors.	You can find (a/an) apple which is green. Green is one of a few possible colors (a/an) apple usually has. There is only a limited range of possible colors.	You can find (a/an) car which is white. White is one of a few possible colors (a/an) car usually has. There is only a limited range of possible colors.	4	1	https://app.prolific.co/submissions/complete?cc=A98CC958	variability_limited-black-tyre	Agree or disagree (run4-experiment2-batch142-70-70)
4c527955-9f5e-4f2a-ad62-26ca5a1986c3	I think it is impossible for (a/an) tyre to be black.	I think it is impossible for (a/an) steam to be solid.	I think it is impossible for (a/an) flame to be orange.	4	1	https://app.prolific.co/submissions/complete?cc=A98CC958	impossible-black-tyre	Agree or disagree (run4-experiment2-batch142-70-70)
61a896ef-fb77-4bb4-96cc-0e750b3d5df6	I think there is a icteridae  which can lay_eggs/be used for laying eggs, but this is rare or uncommon.	I think there is a car  which can swim/be used for swimming, but this is rare or uncommon.	I think there is a rock  which can swim/be used for swimming, but this is rare or uncommon.	4	1	https://app.prolific.co/submissions/complete?cc=A98CC958	rare-lay_eggs-icteridae	Agree or disagree (run4-experiment2-batch142-70-70)
26978ade-d619-45bb-9bd0-b667ee150cc1	I think it is impossible for (a/an) icteridae to lay_eggs/be used for laying eggs.	I think it is impossible for (a/an) rock to float/be used for floating.	I think it is impossible for (a/an) metal to melt/be used for melting.	4	1	https://app.prolific.co/submissions/complete?cc=A98CC958	impossible-lay_eggs-icteridae	Agree or disagree (run4-experiment2-batch142-70-70)
d80d0388-941f-42a1-a367-ed705171266a	You can find (a/an) icteridae which can lay_eggs/be used for laying eggs. This distinguishes a certain type of icteridae from others. 	You can find (a/an) dog which can hunt/be used for hunting. This distinguishes a certain type of dog from others. 	You can find (a/an) dog which can breathe/be used for breathing. This distinguishes a certain type of dog from others. 	4	1	https://app.prolific.co/submissions/complete?cc=A98CC958	variability_limited-lay_eggs-icteridae	Agree or disagree (run4-experiment2-batch142-70-70)
0bd06a2e-883e-4171-899a-3147df497195	Usually, (a/an) icteridae cannot lay_eggs/be used for laying eggs, but there could be a highly unusual situation in which (a/an) icteridae can lay_eggs.	Usually, (a/an) dog cannot speak/be used for speaking, but there could be a highly unusual situation in which (a/an) dog can speak.	Usually, (a/an) dog cannot bark/be used for barking, but there could be a highly unusual situation in which (a/an) dog can bark.	4	1	https://app.prolific.co/submissions/complete?cc=A98CC958	unusual-lay_eggs-icteridae	Agree or disagree (run4-experiment2-batch142-70-70)
8fca2ef7-2daf-4325-9b2a-91f02e1f175e	I know that all or most icteridae(s) lay_eggs regularly or are used for laying eggs regularly. 	I know that all or most student(s) study regularly or are used for studying regularly. 	I know that all or most jeans(s) clean regularly or are used for cleaning regularly. 	4	1	https://app.prolific.co/submissions/complete?cc=A98CC958	afforded_usual-lay_eggs-icteridae	Agree or disagree (run4-experiment2-batch142-70-70)
328c9560-b9f2-498d-9d21-d70c896a0ef9	I know that (a/an) icteridae can lay_eggs/be used for laying eggs as most or all other things similar to (a/an) icteridae lay_eggs. 	I know that (a/an) poodle can bark/be used for barking as most or all other things similar to (a/an) poodle bark. 	I know that (a/an) dog can bark/be used for barking as most or all other things similar to (a/an) dog bark. 	4	1	https://app.prolific.co/submissions/complete?cc=A98CC958	implied_category-lay_eggs-icteridae	Agree or disagree (run4-experiment2-batch142-70-70)
465f86ce-26b6-49a2-b8be-ad28f792d973	``Lay_eggs'' is one for the first things which come to mind when I hear ``icteridae' because laying eggs is one of the typical activities of (a/an) icteridae'.	``Paint'' is one for the first things which come to mind when I hear ``brush' because painting is one of the typical activities of (a/an) brush'.	``Throw'' is one for the first things which come to mind when I hear ``apple' because throwing is one of the typical activites of (a/an) apple'.	4	1	https://app.prolific.co/submissions/complete?cc=A98CC958	typical_of_concept-lay_eggs-icteridae	Agree or disagree (run4-experiment2-batch142-70-70)
69612be1-3eeb-4a84-a3d5-035bacdac593	I could say (a/an) icteridae lays eggs/is used for laying eggs, but I would most certainly not mean it literally.	"I could say (a/an) idea grows/is used for growing, but I would most certainly not mean it literally.
I could say (a/an) person glows/is used for glowing, but I would most certainly not mean it literally.
I could say (a/an) thought burns/is used for burning, but I would most certainly not mean it literally."	"I could say (a/an) plant grows/is used for growing, but I would most certainly not mean it literally.
I could say (a/an) situation smiles/is used for smileing, but I would most certainly not mean it literally.
I could say (a/an) candle burns/is used for burning, but I would most certainly not mean it literally."	4	1	https://app.prolific.co/submissions/complete?cc=A98CC958	creative-lay_eggs-icteridae	Agree or disagree (run4-experiment2-batch142-70-70)
5de889c2-8cba-4c89-aa1a-332f276281bf	All or most  icteridae(s) can lay_eggs/be used for laying eggs. This is not what they normally do or are used for. 	All or most  T-shirt(s) can clean/be used for cleaning. This is not what they normally do or are used for. 	All or most  sponge(s) can clean/be used for cleaning. This is not what they normally do or are used for. 	4	1	https://app.prolific.co/submissions/complete?cc=A98CC958	afforded_unusual-lay_eggs-icteridae	Agree or disagree (run4-experiment2-batch142-70-70)
1ddbcde4-a2dc-4a79-84c6-11a04b105d3e	``Icteridae'' is one of the first things which come to mind when I hear ``lay_eggs' because (a/an) icteridae is a typical example of things which lay_eggs/are used for laying eggs'. 	``Cat'' is one of the first things which come to mind when I hear ``purr' because (a/an) cat is a typical example of things which purr/are used for purring'. 	``Dog'' is one of the first things which come to mind when I hear ``run' because (a/an) dog is a typical example of things which run/are used for runing'. 	4	1	https://app.prolific.co/submissions/complete?cc=A98CC958	typical_of_property-lay_eggs-icteridae	Agree or disagree (run4-experiment2-batch142-70-70)
9614b030-b8b6-40b7-9558-a40a17cced9e	Usually, (a/an) tortilla is not square, but there could be a highly unusual situation in which (a/an) tortilla is square.	Usually, (a/an) pony is not blue, but there could be a highly unusual situation in which (a/an) pony is blue.	Usually, (a/an) beer is not brown, but there could be a highly unusual situation in which (a/an) beer is brown.	4	1	https://app.prolific.co/submissions/complete?cc=A98CC958	unusual-square-tortilla	Agree or disagree (run4-experiment2-batch142-70-70)
bdf9c34d-d95e-4fb6-b472-38350f4c3baf	I could say (a/an) tortilla is square, but I would most certainly not mean it literally.	"I could say (a/an) anger is hot, but I would most certainly not mean it literally.
I could say (a/an) person is cold, but I would most certainly not mean it literally.
I could say (a/an) story is dark, but I would most certainly not mean it literally."	"I could say (a/an) fire is hot, but I would most certainly not mean it literally.
I could say (a/an) stone is heavy, but I would most certainly not mean it literally.
I could say (a/an) argument is liquid, but I would most certainly not mean it literally."	4	1	https://app.prolific.co/submissions/complete?cc=A98CC958	creative-square-tortilla	Agree or disagree (run4-experiment2-batch142-70-70)
4ed1c32e-5719-483a-9148-6c0deb76213e	``Square'' is one for the first things which come to mind when I hear ``tortilla' because square is one of the typical shapes of (a/an) tortilla'.	``Bitter'' is one for the first things which come to mind when I hear ``coffee' because bitter is one of the typical tastes of (a/an) coffee'.	``Salty'' is one for the first things which come to mind when I hear ``beer' because salty is one of the typical tastes of (a/an) beer'.	4	1	https://app.prolific.co/submissions/complete?cc=A98CC958	typical_of_concept-square-tortilla	Agree or disagree (run4-experiment2-batch142-70-70)
c5a579d6-a881-4e5b-84e8-1b6984559f84	I think it is impossible for (a/an) tortilla to be square.	I think it is impossible for (a/an) flame to be frozen.	I think it is impossible for (a/an) book to be light.	4	1	https://app.prolific.co/submissions/complete?cc=A98CC958	impossible-square-tortilla	Agree or disagree (run4-experiment2-batch142-70-70)
98343adc-19d1-4647-a74b-216261cf7351	You can find (a/an) tortilla which is square. Square is one of many possible shapes (a/an) tortilla usually has. The range of shapes is almost unlimited. 	You can find (a/an) flower which is purple. Purple is one of many possible colors (a/an) flower usually has. The range of colors is almost unlimited. 	You can find (a/an) carrot which is orange. Orange is one of many possible colors (a/an) carrot usually has. The range of colors is almost unlimited. 	4	1	https://app.prolific.co/submissions/complete?cc=A98CC958	variability_open-square-tortilla	Agree or disagree (run4-experiment2-batch142-70-70)
fc4d0090-0b73-4cbf-8d47-8c6fc4699cf5	You can find (a/an) tortilla which is square. Square is one of a few possible shapes (a/an) tortilla usually has. There is only a limited range of possible shapes.	You can find (a/an) apple which is green. Green is one of a few possible colors (a/an) apple usually has. There is only a limited range of possible colors.	You can find (a/an) car which is white. White is one of a few possible colors (a/an) car usually has. There is only a limited range of possible colors.	4	1	https://app.prolific.co/submissions/complete?cc=A98CC958	variability_limited-square-tortilla	Agree or disagree (run4-experiment2-batch142-70-70)
fdd93227-b15c-4ca5-9d56-4a088ca38658	I think (a/an) tortilla can be square, but this is rare or uncommon.	I think (a/an) tomato can be yellow, but this is rare or uncommon.	I think (a/an) grizzly bear can be grey, but this is rare or uncommon.	4	1	https://app.prolific.co/submissions/complete?cc=A98CC958	rare-square-tortilla	Agree or disagree (run4-experiment2-batch142-70-70)
60c82429-f33f-4922-a97b-aec488fb78fd	``Tortilla'' is one of the first things which come to mind when I hear ``square' because (a/an) tortilla is a typical example of things which are square'. 	``Rainbow'' is one of the first things which come to mind when I hear ``colorful' because (a/an) rainbow is a typical example of things which are colorful'. 	``Table'' is one of the first things which come to mind when I hear ``white' because (a/an) table is a typical example of things which are white'. 	4	1	https://app.prolific.co/submissions/complete?cc=A98CC958	typical_of_property-square-tortilla	Agree or disagree (run4-experiment2-batch142-70-70)
210f1a01-d8b6-415a-8e95-e22517cc5bcf	I know that being square is necessary for many things (a/an) tortilla does or is used for. 	I know that being bright is necessary for many things (a/an) flashlight does or is used for. 	I know that being grey is necessary for many things (a/an) car does or is used for. 	4	1	https://app.prolific.co/submissions/complete?cc=A98CC958	affording_activity-square-tortilla	Agree or disagree (run4-experiment2-batch142-70-70)
7956be16-e1ab-4288-98af-cd2683d3c2af	I know that (a/an) tortilla is square as most or all other things similar to (a/an) tortilla are square. 	I know that (a/an) chocoloate_cake is sweet as most or all other things similar to (a/an) chocoloate_cake are sweet. 	I know that (a/an) table is transparent as most or all other things similar to (a/an) table are transparent. 	4	1	https://app.prolific.co/submissions/complete?cc=A98CC958	implied_category-square-tortilla	Agree or disagree (run4-experiment2-batch142-70-70)
check4	I am answering questions at random. 	Trains are vehicles. 	Carrots are animals. 	4	1	https://app.prolific.co/submissions/complete?cc=A98CC958	_check-_check4-_check4	Agree or disagree (run4-experiment2-batch142-70-70)
test1	``Yellow'' is one for the first things which come to mind when I hear ``canary' because yellow is one of the typical colors of (a/an) canary'.	``Blue'' is one for the first things which come to mind when I hear ``sky' because blue is one of the typical colors of (a/an) sky'.	``Orange'' is one for the first things which come to mind when I hear ``milk'' because orange is one of the typical colors of (a/an) milk'.	4	1	https://app.prolific.co/submissions/complete?cc=A98CC958	test_true-_test1-_test1	Agree or disagree (run4-experiment2-batch142-70-70)
