quid	description	exampleTrue	exampleFalse	run	subList	completionUrl	triple	name
0906d058-9671-4c5c-b217-c9d93084cad8	I think there is a pig  which can lay_eggs/be used for laying eggs, but this is rare or uncommon.	I think there is a toddler  which can read/be used for reading, but this is rare or uncommon.	I think there is a teenager  which can read/be used for reading, but this is rare or uncommon.	4	1	https://app.prolific.co/submissions/complete?cc=4A1E6E20	rare-lay_eggs-pig	Agree or disagree (run4-experiment2-batch99-70-70)
3cdbce2d-7fe2-4391-8795-0d9bef897e1f	You can find (a/an) pig which can lay_eggs/be used for laying eggs. This distinguishes a certain type of pig from others. 	You can find (a/an) knife which can cook/be used for cooking. This distinguishes a certain type of knife from others. 	You can find (a/an) book which can read/be used for reading. This distinguishes a certain type of book from others. 	4	1	https://app.prolific.co/submissions/complete?cc=4A1E6E20	variability_limited-lay_eggs-pig	Agree or disagree (run4-experiment2-batch99-70-70)
3decff90-930a-4cc3-8d6e-a72d7916acdf	All or most  pig(s) can lay_eggs/be used for laying eggs. This is not what they normally do or are used for. 	All or most  toothbrush(s) can paint/be used for painting. This is not what they normally do or are used for. 	All or most  brush(s) can paint/be used for painting. This is not what they normally do or are used for. 	4	1	https://app.prolific.co/submissions/complete?cc=4A1E6E20	afforded_unusual-lay_eggs-pig	Agree or disagree (run4-experiment2-batch99-70-70)
2b767163-e70d-4b07-8a3c-85e0176264bc	I know that (a/an) pig can lay_eggs/be used for laying eggs as most or all other things similar to (a/an) pig lay_eggs. 	I know that (a/an) poodle can bark/be used for barking as most or all other things similar to (a/an) poodle bark. 	I know that (a/an) dog can bark/be used for barking as most or all other things similar to (a/an) dog bark. 	4	1	https://app.prolific.co/submissions/complete?cc=4A1E6E20	implied_category-lay_eggs-pig	Agree or disagree (run4-experiment2-batch99-70-70)
3217a6ac-7c76-4b92-8702-e71cd0fb5faf	Usually, (a/an) pig cannot lay_eggs/be used for laying eggs, but there could be a highly unusual situation in which (a/an) pig can lay_eggs.	Usually, (a/an) hot dog cannot walk/be used for walking, but there could be a highly unusual situation in which (a/an) hot dog can walk.	Usually, (a/an) cat cannot run/be used for runing, but there could be a highly unusual situation in which (a/an) cat can run.	4	1	https://app.prolific.co/submissions/complete?cc=4A1E6E20	unusual-lay_eggs-pig	Agree or disagree (run4-experiment2-batch99-70-70)
50d5e31e-b7c3-45e5-8d38-d4e533483c53	I think it is impossible for (a/an) pig to lay_eggs/be used for laying eggs.	I think it is impossible for (a/an) hammer to float/be used for floating.	I think it is impossible for (a/an) apple to rot/be used for roting.	4	1	https://app.prolific.co/submissions/complete?cc=4A1E6E20	impossible-lay_eggs-pig	Agree or disagree (run4-experiment2-batch99-70-70)
75681aca-545b-4de3-8f3e-2b65eea9fcd9	``Pig'' is one of the first things which come to mind when I hear ``lay_eggs' because (a/an) pig is a typical example of things which lay_eggs/are used for laying eggs'. 	``Baby'' is one of the first things which come to mind when I hear ``cry' because (a/an) baby is a typical example of things which cry/are used for crying'. 	``Teacher'' is one of the first things which come to mind when I hear ``walk' because (a/an) teacher is a typical example of things which walk/are used for walking'. 	4	1	https://app.prolific.co/submissions/complete?cc=4A1E6E20	typical_of_property-lay_eggs-pig	Agree or disagree (run4-experiment2-batch99-70-70)
716be74a-b552-4527-8a54-9b5a4abceb99	``Lay_eggs'' is one for the first things which come to mind when I hear ``pig' because laying eggs is one of the typical activities of (a/an) pig'.	``Paint'' is one for the first things which come to mind when I hear ``brush' because painting is one of the typical activities of (a/an) brush'.	``Throw'' is one for the first things which come to mind when I hear ``apple' because throwing is one of the typical activites of (a/an) apple'.	4	1	https://app.prolific.co/submissions/complete?cc=4A1E6E20	typical_of_concept-lay_eggs-pig	Agree or disagree (run4-experiment2-batch99-70-70)
fd43f715-9797-4bed-b5c6-28ea795a7e80	I could say (a/an) pig lays eggs/is used for laying eggs, but I would most certainly not mean it literally.	"I could say (a/an) idea grows/is used for growing, but I would most certainly not mean it literally.
I could say (a/an) person glows/is used for glowing, but I would most certainly not mean it literally.
I could say (a/an) thought burns/is used for burning, but I would most certainly not mean it literally."	"I could say (a/an) plant grows/is used for growing, but I would most certainly not mean it literally.
I could say (a/an) situation smiles/is used for smileing, but I would most certainly not mean it literally.
I could say (a/an) candle burns/is used for burning, but I would most certainly not mean it literally."	4	1	https://app.prolific.co/submissions/complete?cc=4A1E6E20	creative-lay_eggs-pig	Agree or disagree (run4-experiment2-batch99-70-70)
e492764e-655a-48b3-9884-5e6eef8d8d2b	I know that all or most pig(s) lay_eggs regularly or are used for laying eggs regularly. 	I know that all or most student(s) study regularly or are used for studying regularly. 	I know that all or most jeans(s) clean regularly or are used for cleaning regularly. 	4	1	https://app.prolific.co/submissions/complete?cc=4A1E6E20	afforded_usual-lay_eggs-pig	Agree or disagree (run4-experiment2-batch99-70-70)
5d84a97c-4dec-4faa-8a7c-7af07bf77786	``Fly'' is one for the first things which come to mind when I hear ``taxi' because flying is one of the typical movements of (a/an) taxi'.	``Cut'' is one for the first things which come to mind when I hear ``knife' because cuting is one of the typical activities of (a/an) knife'.	``Float'' is one for the first things which come to mind when I hear ``needle' because floating is one of the typical activities of (a/an) needle'.	4	1	https://app.prolific.co/submissions/complete?cc=4A1E6E20	typical_of_concept-fly-taxi	Agree or disagree (run4-experiment2-batch99-70-70)
297605d6-57fe-46e5-af79-338ce8c147b2	``Taxi'' is one of the first things which come to mind when I hear ``fly' because (a/an) taxi is a typical example of things which fly/are used for flying'. 	``Baby'' is one of the first things which come to mind when I hear ``cry' because (a/an) baby is a typical example of things which cry/are used for crying'. 	``Teacher'' is one of the first things which come to mind when I hear ``walk' because (a/an) teacher is a typical example of things which walk/are used for walking'. 	4	1	https://app.prolific.co/submissions/complete?cc=4A1E6E20	typical_of_property-fly-taxi	Agree or disagree (run4-experiment2-batch99-70-70)
99a7f0c6-cacf-462b-8e58-a0908b90ef42	You can find (a/an) taxi which can fly/be used for flying. This distinguishes a certain type of taxi from others. 	You can find (a/an) lamp which can read/be used for reading. This distinguishes a certain type of lamp from others. 	You can find (a/an) coat which can cook/be used for cooking. This distinguishes a certain type of coat from others. 	4	1	https://app.prolific.co/submissions/complete?cc=4A1E6E20	variability_limited-fly-taxi	Agree or disagree (run4-experiment2-batch99-70-70)
93ea654e-7e0e-496e-a15b-e06e155e993b	I know that all or most taxi(s) fly regularly or are used for flying regularly. 	I know that all or most bug(s) crawl regularly or are used for crawling regularly. 	I know that all or most toothbrush(s) paint regularly or are used for painting regularly. 	4	1	https://app.prolific.co/submissions/complete?cc=4A1E6E20	afforded_usual-fly-taxi	Agree or disagree (run4-experiment2-batch99-70-70)
e4aa7fa8-ea16-42da-a81a-5a517fe39b4e	All or most  taxi(s) can fly/be used for flying. This is not what they normally do or are used for. 	All or most  fork(s) can fight/be used for fighting. This is not what they normally do or are used for. 	All or most  brush(s) can fly/be used for flying. This is not what they normally do or are used for. 	4	1	https://app.prolific.co/submissions/complete?cc=4A1E6E20	afforded_unusual-fly-taxi	Agree or disagree (run4-experiment2-batch99-70-70)
a18d7d5d-5d37-474e-8de8-d26ab5174a55	I know that (a/an) taxi can fly/be used for flying as most or all other things similar to (a/an) taxi fly. 	I know that (a/an) poodle can bark/be used for barking as most or all other things similar to (a/an) poodle bark. 	I know that (a/an) dog can bark/be used for barking as most or all other things similar to (a/an) dog bark. 	4	1	https://app.prolific.co/submissions/complete?cc=4A1E6E20	implied_category-fly-taxi	Agree or disagree (run4-experiment2-batch99-70-70)
8c1a7026-5bd2-4530-9d67-979cb7bf4937	Usually, (a/an) taxi cannot fly/be used for flying, but there could be a highly unusual situation in which (a/an) taxi can fly.	Usually, (a/an) hot dog cannot walk/be used for walking, but there could be a highly unusual situation in which (a/an) hot dog can walk.	Usually, (a/an) cat cannot run/be used for runing, but there could be a highly unusual situation in which (a/an) cat can run.	4	1	https://app.prolific.co/submissions/complete?cc=4A1E6E20	unusual-fly-taxi	Agree or disagree (run4-experiment2-batch99-70-70)
415b8763-7d43-4de5-90d3-532bae59badd	I could say (a/an) taxi flies/is used for flying, but I would most certainly not mean it literally.	"I could say (a/an) idea grows/is used for growing, but I would most certainly not mean it literally.
I could say (a/an) person glows/is used for glowing, but I would most certainly not mean it literally.
I could say (a/an) thought burns/is used for burning, but I would most certainly not mean it literally."	"I could say (a/an) plant grows/is used for growing, but I would most certainly not mean it literally.
I could say (a/an) situation smiles/is used for smileing, but I would most certainly not mean it literally.
I could say (a/an) candle burns/is used for burning, but I would most certainly not mean it literally."	4	1	https://app.prolific.co/submissions/complete?cc=4A1E6E20	creative-fly-taxi	Agree or disagree (run4-experiment2-batch99-70-70)
180c9203-8bc5-4d85-9f4f-581be7774e9e	I think there is a taxi  which can fly/be used for flying, but this is rare or uncommon.	I think there is a student  which can teach/be used for teaching, but this is rare or uncommon.	I think there is a teacher  which can teach/be used for teaching, but this is rare or uncommon.	4	1	https://app.prolific.co/submissions/complete?cc=4A1E6E20	rare-fly-taxi	Agree or disagree (run4-experiment2-batch99-70-70)
cf745ef6-a4f8-4df6-8b97-1b5a34bfb5ce	I think it is impossible for (a/an) taxi to fly/be used for flying.	I think it is impossible for (a/an) worm to walk/be used for walking.	I think it is impossible for (a/an) worm to move/be used for moveing.	4	1	https://app.prolific.co/submissions/complete?cc=4A1E6E20	impossible-fly-taxi	Agree or disagree (run4-experiment2-batch99-70-70)
d2f854ce-2481-45e1-94a6-56213cf5f999	I could say (a/an) apple is square, but I would most certainly not mean it literally.	"I could say (a/an) anger is hot, but I would most certainly not mean it literally.
I could say (a/an) person is cold, but I would most certainly not mean it literally.
I could say (a/an) story is dark, but I would most certainly not mean it literally."	"I could say (a/an) fire is hot, but I would most certainly not mean it literally.
I could say (a/an) stone is heavy, but I would most certainly not mean it literally.
I could say (a/an) argument is liquid, but I would most certainly not mean it literally."	4	1	https://app.prolific.co/submissions/complete?cc=4A1E6E20	creative-square-apple	Agree or disagree (run4-experiment2-batch99-70-70)
7c5ecc72-6ac6-4fa1-8e92-e7fd94d34c8b	I think (a/an) apple can be square, but this is rare or uncommon.	I think (a/an) rose can be black, but this is rare or uncommon.	I think (a/an) rose can be yellow, but this is rare or uncommon.	4	1	https://app.prolific.co/submissions/complete?cc=4A1E6E20	rare-square-apple	Agree or disagree (run4-experiment2-batch99-70-70)
1da42f2d-af3a-401e-a4a3-d6046112aad3	I think it is impossible for (a/an) apple to be square.	I think it is impossible for (a/an) steam to be solid.	I think it is impossible for (a/an) flame to be orange.	4	1	https://app.prolific.co/submissions/complete?cc=4A1E6E20	impossible-square-apple	Agree or disagree (run4-experiment2-batch99-70-70)
a3958a01-7665-4afd-b7e8-ad11eae953b9	Usually, (a/an) apple is not square, but there could be a highly unusual situation in which (a/an) apple is square.	Usually, (a/an) chocolate is not pink, but there could be a highly unusual situation in which (a/an) chocolate is pink.	Usually, (a/an) chocolate is not brown, but there could be a highly unusual situation in which (a/an) chocolate is brown.	4	1	https://app.prolific.co/submissions/complete?cc=4A1E6E20	unusual-square-apple	Agree or disagree (run4-experiment2-batch99-70-70)
deb938cb-9cdf-4626-a943-42ed7db3827b	``Sweet'' is one for the first things which come to mind when I hear ``bean' because sweet is one of the typical tastes of (a/an) bean'.	``Spicy'' is one for the first things which come to mind when I hear ``chili_pepper' because spicy is one of the typical tastes of (a/an) chili_pepper'.	``Sweet'' is one for the first things which come to mind when I hear ``spinach' because sweet is one of the typical tastes of (a/an) spinach'.	4	1	https://app.prolific.co/submissions/complete?cc=4A1E6E20	typical_of_concept-sweet-bean	Agree or disagree (run4-experiment2-batch99-70-70)
135936ca-b858-4d71-9ba3-c4d38835a4f9	I think it is impossible for (a/an) bean to be sweet.	I think it is impossible for (a/an) steam to be solid.	I think it is impossible for (a/an) flame to be orange.	4	1	https://app.prolific.co/submissions/complete?cc=4A1E6E20	impossible-sweet-bean	Agree or disagree (run4-experiment2-batch99-70-70)
f3e29e99-578b-44cd-bb28-7721d9478d7a	You can find (a/an) bean which is sweet. Sweet is one of many possible tastes (a/an) bean usually has. The range of tastes is almost unlimited. 	You can find (a/an) flower which is purple. Purple is one of many possible colors (a/an) flower usually has. The range of colors is almost unlimited. 	You can find (a/an) carrot which is orange. Orange is one of many possible colors (a/an) carrot usually has. The range of colors is almost unlimited. 	4	1	https://app.prolific.co/submissions/complete?cc=4A1E6E20	variability_open-sweet-bean	Agree or disagree (run4-experiment2-batch99-70-70)
463b17d8-0a73-48af-851a-3049804eb410	I could say (a/an) bean is sweet, but I would most certainly not mean it literally.	"I could say (a/an) anger is hot, but I would most certainly not mean it literally.
I could say (a/an) person is cold, but I would most certainly not mean it literally.
I could say (a/an) story is dark, but I would most certainly not mean it literally."	"I could say (a/an) fire is hot, but I would most certainly not mean it literally.
I could say (a/an) stone is heavy, but I would most certainly not mean it literally.
I could say (a/an) argument is liquid, but I would most certainly not mean it literally."	4	1	https://app.prolific.co/submissions/complete?cc=4A1E6E20	creative-sweet-bean	Agree or disagree (run4-experiment2-batch99-70-70)
339df9ac-bc45-41d6-8915-cc67afc433af	``Bean'' is one of the first things which come to mind when I hear ``sweet' because (a/an) bean is a typical example of things which are sweet'. 	``Snow'' is one of the first things which come to mind when I hear ``white' because (a/an) snow is a typical example of things which are white'. 	``Water'' is one of the first things which come to mind when I hear ``grey' because (a/an) water is a typical example of things which are grey'. 	4	1	https://app.prolific.co/submissions/complete?cc=4A1E6E20	typical_of_property-sweet-bean	Agree or disagree (run4-experiment2-batch99-70-70)
316fd2d5-5fe1-4cda-9c82-3e1de6770014	I know that being sweet is necessary for many things (a/an) bean does or is used for. 	I know that being pointy is necessary for many things (a/an) needle does or is used for. 	I know that being white is necessary for many things (a/an) t-shirt does or is used for. 	4	1	https://app.prolific.co/submissions/complete?cc=4A1E6E20	affording_activity-sweet-bean	Agree or disagree (run4-experiment2-batch99-70-70)
9b8c364b-ef41-431c-a0d2-812c37eb96f8	You can find (a/an) bean which is sweet. Sweet is one of a few possible tastes (a/an) bean usually has. There is only a limited range of possible tastes.	You can find (a/an) apple which is green. Green is one of a few possible colors (a/an) apple usually has. There is only a limited range of possible colors.	You can find (a/an) car which is white. White is one of a few possible colors (a/an) car usually has. There is only a limited range of possible colors.	4	1	https://app.prolific.co/submissions/complete?cc=4A1E6E20	variability_limited-sweet-bean	Agree or disagree (run4-experiment2-batch99-70-70)
6f896535-1b66-408a-9e9c-1b619b648bba	I know that (a/an) bean is sweet as most or all other things similar to (a/an) bean are sweet. 	I know that (a/an) wine is liquid as most or all other things similar to (a/an) wine are liquid. 	I know that (a/an) bread is liquid as most or all other things similar to (a/an) bread are liquid. 	4	1	https://app.prolific.co/submissions/complete?cc=4A1E6E20	implied_category-sweet-bean	Agree or disagree (run4-experiment2-batch99-70-70)
922c732a-8031-498b-b996-f6806002acb8	Usually, (a/an) bean is not sweet, but there could be a highly unusual situation in which (a/an) bean is sweet.	Usually, (a/an) pony is not blue, but there could be a highly unusual situation in which (a/an) pony is blue.	Usually, (a/an) beer is not brown, but there could be a highly unusual situation in which (a/an) beer is brown.	4	1	https://app.prolific.co/submissions/complete?cc=4A1E6E20	unusual-sweet-bean	Agree or disagree (run4-experiment2-batch99-70-70)
741cbaa2-c130-4f35-a338-b562385c2273	I think (a/an) bean can be sweet, but this is rare or uncommon.	I think (a/an) tomato can be yellow, but this is rare or uncommon.	I think (a/an) grizzly bear can be grey, but this is rare or uncommon.	4	1	https://app.prolific.co/submissions/complete?cc=4A1E6E20	rare-sweet-bean	Agree or disagree (run4-experiment2-batch99-70-70)
80c33c64-3629-4faa-99f6-e92e5cd5c0b5	``Glass'' is one of the first things which come to mind when I hear ``hot' because (a/an) glass is a typical example of things which are hot'. 	``Feather'' is one of the first things which come to mind when I hear ``light' because (a/an) feather is a typical example of things which are light'. 	``Mug'' is one of the first things which come to mind when I hear ``bright' because (a/an) mug is a typical example of things which are bright'. 	4	1	https://app.prolific.co/submissions/complete?cc=4A1E6E20	typical_of_property-hot-glass	Agree or disagree (run4-experiment2-batch99-70-70)
3512a40b-4086-4a3e-9727-dc3d4d855c05	I think (a/an) glass can be hot, but this is rare or uncommon.	I think (a/an) cake can be spicy, but this is rare or uncommon.	I think (a/an) window can be transparent, but this is rare or uncommon.	4	1	https://app.prolific.co/submissions/complete?cc=4A1E6E20	rare-hot-glass	Agree or disagree (run4-experiment2-batch99-70-70)
21d57142-3fc0-44af-85fe-513e76c76165	You can find (a/an) glass which is hot. (A/an) glass is usually either hot, a bit more or less hot or the opposite of hot.	You can find (a/an) chocolate which is bitter. (A/an) chocolate is usually either bitter, a bit more or less bitter or the opposite of bitter.	You can find (a/an) diamond which is soft. (A/an) diamond is usually either soft, a bit more or less soft or the opposite of soft.	4	1	https://app.prolific.co/submissions/complete?cc=4A1E6E20	variability_open-hot-glass	Agree or disagree (run4-experiment2-batch99-70-70)
e9810ef8-f867-4df4-b369-e8bec9499769	I know that (a/an) glass is hot as most or all other things similar to (a/an) glass are hot. 	I know that (a/an) wine is liquid as most or all other things similar to (a/an) wine are liquid. 	I know that (a/an) bread is liquid as most or all other things similar to (a/an) bread are liquid. 	4	1	https://app.prolific.co/submissions/complete?cc=4A1E6E20	implied_category-hot-glass	Agree or disagree (run4-experiment2-batch99-70-70)
c9e45a99-12f5-4953-b48e-9433de1cd3b3	I know that being hot is necessary for many things (a/an) glass does or is used for. 	I know that being sharp is necessary for many things (a/an) razor does or is used for. 	I know that being colorful is necessary for many things (a/an) dress does or is used for. 	4	1	https://app.prolific.co/submissions/complete?cc=4A1E6E20	affording_activity-hot-glass	Agree or disagree (run4-experiment2-batch99-70-70)
13685e03-a1a8-40c4-874b-0d835ce7081b	I think it is impossible for (a/an) glass to be hot.	I think it is impossible for (a/an) steam to be solid.	I think it is impossible for (a/an) flame to be orange.	4	1	https://app.prolific.co/submissions/complete?cc=4A1E6E20	impossible-hot-glass	Agree or disagree (run4-experiment2-batch99-70-70)
95e06109-d579-483c-8610-484e1b02f76b	Usually, (a/an) glass is not hot, but there could be a highly unusual situation in which (a/an) glass is hot.	Usually, (a/an) table is not furry, but there could be a highly unusual situation in which (a/an) table is furry.	Usually, (a/an) cat is not furry, but there could be a highly unusual situation in which (a/an) cat is furry.	4	1	https://app.prolific.co/submissions/complete?cc=4A1E6E20	unusual-hot-glass	Agree or disagree (run4-experiment2-batch99-70-70)
49a75785-73f3-455f-ae33-3a2c872d4170	You can find (a/an) glass which is hot. (A/an) glass is usually either hot or not hot. It cannot be a bit more or less hot.	You can find (a/an) pea which is frozen. (A/an) pea is usually either frozen or not frozen. It cannot be a bit more or less frozen.	You can find (a/an) soup which is salty. (A/an) soup is usually either salty or not salty. It cannot be a bit more or less salty.	4	1	https://app.prolific.co/submissions/complete?cc=4A1E6E20	variability_limited-hot-glass	Agree or disagree (run4-experiment2-batch99-70-70)
eb7ef631-8079-4354-b089-394df2d3862d	``Hot'' is one for the first things which come to mind when I hear ``glass' because hot is one of the typical temperatures of (a/an) glass'.	``Heavy'' is one for the first things which come to mind when I hear ``rock' because heavy is one of the typical weights of (a/an) rock'.	``Green'' is one for the first things which come to mind when I hear ``raspberry' because green is one of the typical colors of (a/an) raspberry'.	4	1	https://app.prolific.co/submissions/complete?cc=4A1E6E20	typical_of_concept-hot-glass	Agree or disagree (run4-experiment2-batch99-70-70)
f21c5522-d497-42d0-97c5-09ef06e811ae	I could say (a/an) glass is hot, but I would most certainly not mean it literally.	"I could say (a/an) anger is hot, but I would most certainly not mean it literally.
I could say (a/an) person is cold, but I would most certainly not mean it literally.
I could say (a/an) story is dark, but I would most certainly not mean it literally."	"I could say (a/an) fire is hot, but I would most certainly not mean it literally.
I could say (a/an) stone is heavy, but I would most certainly not mean it literally.
I could say (a/an) argument is liquid, but I would most certainly not mean it literally."	4	1	https://app.prolific.co/submissions/complete?cc=4A1E6E20	creative-hot-glass	Agree or disagree (run4-experiment2-batch99-70-70)
71eb224e-7d30-4794-b6ad-ac48a9847fc9	I could say (a/an) fox is yellow, but I would most certainly not mean it literally.	"I could say (a/an) anger is hot, but I would most certainly not mean it literally.
I could say (a/an) person is cold, but I would most certainly not mean it literally.
I could say (a/an) story is dark, but I would most certainly not mean it literally."	"I could say (a/an) fire is hot, but I would most certainly not mean it literally.
I could say (a/an) stone is heavy, but I would most certainly not mean it literally.
I could say (a/an) argument is liquid, but I would most certainly not mean it literally."	4	1	https://app.prolific.co/submissions/complete?cc=4A1E6E20	creative-yellow-fox	Agree or disagree (run4-experiment2-batch99-70-70)
5838154a-6561-4e09-b466-54175b250a4f	I think (a/an) fox can be yellow, but this is rare or uncommon.	I think (a/an) snail can be purple, but this is rare or uncommon.	I think (a/an) bell pepper can be green, but this is rare or uncommon.	4	1	https://app.prolific.co/submissions/complete?cc=4A1E6E20	rare-yellow-fox	Agree or disagree (run4-experiment2-batch99-70-70)
66d80b8b-76ca-407c-8d6d-4fa319122cd1	I think it is impossible for (a/an) fox to be yellow.	I think it is impossible for (a/an) steam to be solid.	I think it is impossible for (a/an) flame to be orange.	4	1	https://app.prolific.co/submissions/complete?cc=4A1E6E20	impossible-yellow-fox	Agree or disagree (run4-experiment2-batch99-70-70)
5a41d94b-b2e5-47d6-baa8-4dbb42c28c8a	Usually, (a/an) fox is not yellow, but there could be a highly unusual situation in which (a/an) fox is yellow.	Usually, (a/an) chocolate is not pink, but there could be a highly unusual situation in which (a/an) chocolate is pink.	Usually, (a/an) chocolate is not brown, but there could be a highly unusual situation in which (a/an) chocolate is brown.	4	1	https://app.prolific.co/submissions/complete?cc=4A1E6E20	unusual-yellow-fox	Agree or disagree (run4-experiment2-batch99-70-70)
