quid	description	exampleTrue	exampleFalse	run	subList	completionUrl	triple	name
a87f3d9d-7504-469e-9859-585733fa81b0	``Sand'' is one of the first things which come to mind when I hear ``black' because (a/an) sand is a typical example of things which are black'. 	``Mouse'' is one of the first things which come to mind when I hear ``small' because (a/an) mouse is a typical example of things which are small'. 	``Dog'' is one of the first things which come to mind when I hear ``small' because (a/an) dog is a typical example of things which are small'. 	4	1	../worker_interaction/whitelist.txt	typical_of_property-black-sand	Agree or disagree (run4-experiment2-batch56-70-70)
d25c2088-48e3-4415-86d8-c18e1d6b32b8	Usually, (a/an) lime is not yellow, but there could be a highly unusual situation in which (a/an) lime is yellow.	Usually, (a/an) dog is not green, but there could be a highly unusual situation in which (a/an) dog is green.	Usually, (a/an) razor is not sharp, but there could be a highly unusual situation in which (a/an) razor is sharp.	4	1	../worker_interaction/whitelist.txt	unusual-yellow-lime	Agree or disagree (run4-experiment2-batch56-70-70)
32356996-90bc-4b55-ae45-874ae3e19660	I think (a/an) lime can be yellow, but this is rare or uncommon.	I think (a/an) snail can be purple, but this is rare or uncommon.	I think (a/an) bell pepper can be green, but this is rare or uncommon.	4	1	../worker_interaction/whitelist.txt	rare-yellow-lime	Agree or disagree (run4-experiment2-batch56-70-70)
dceb2047-42b6-4147-83f5-ce9e44e0eb2a	I could say (a/an) lime is yellow, but I would most certainly not mean it literally.	"I could say (a/an) anger is hot, but I would most certainly not mean it literally.
I could say (a/an) person is cold, but I would most certainly not mean it literally.
I could say (a/an) story is dark, but I would most certainly not mean it literally."	"I could say (a/an) fire is hot, but I would most certainly not mean it literally.
I could say (a/an) stone is heavy, but I would most certainly not mean it literally.
I could say (a/an) argument is liquid, but I would most certainly not mean it literally."	4	1	../worker_interaction/whitelist.txt	creative-yellow-lime	Agree or disagree (run4-experiment2-batch56-70-70)
b3907546-e070-4cf5-923d-a43eff4ce2e2	I think it is impossible for (a/an) lime to be yellow.	I think it is impossible for (a/an) flame to be frozen.	I think it is impossible for (a/an) book to be light.	4	1	../worker_interaction/whitelist.txt	impossible-yellow-lime	Agree or disagree (run4-experiment2-batch56-70-70)
6e5c4fd4-40ff-4b9b-86c9-33c51f00756b	I could say (a/an) pod is sweet, but I would most certainly not mean it literally.	"I could say (a/an) anger is hot, but I would most certainly not mean it literally.
I could say (a/an) person is cold, but I would most certainly not mean it literally.
I could say (a/an) story is dark, but I would most certainly not mean it literally."	"I could say (a/an) fire is hot, but I would most certainly not mean it literally.
I could say (a/an) stone is heavy, but I would most certainly not mean it literally.
I could say (a/an) argument is liquid, but I would most certainly not mean it literally."	4	1	../worker_interaction/whitelist.txt	creative-sweet-pod	Agree or disagree (run4-experiment2-batch56-70-70)
8cdf16f7-7add-4bda-a431-e30aa3bd457c	I know that being sweet is necessary for many things (a/an) pod does or is used for. 	I know that being bright is necessary for many things (a/an) flashlight does or is used for. 	I know that being grey is necessary for many things (a/an) car does or is used for. 	4	1	../worker_interaction/whitelist.txt	affording_activity-sweet-pod	Agree or disagree (run4-experiment2-batch56-70-70)
42e7dea8-8461-4010-8be8-1623d694383e	You can find (a/an) pod which is sweet. Sweet is one of a few possible tastes (a/an) pod usually has. There is only a limited range of possible tastes.	You can find (a/an) apple which is green. Green is one of a few possible colors (a/an) apple usually has. There is only a limited range of possible colors.	You can find (a/an) car which is white. White is one of a few possible colors (a/an) car usually has. There is only a limited range of possible colors.	4	1	../worker_interaction/whitelist.txt	variability_limited-sweet-pod	Agree or disagree (run4-experiment2-batch56-70-70)
8c5828e6-1991-4bd7-baf6-2229db8a4a53	You can find (a/an) pod which is sweet. Sweet is one of many possible tastes (a/an) pod usually has. The range of tastes is almost unlimited. 	You can find (a/an) t-shirt which is white. White is one of many possible colors (a/an) t-shirt usually has. The range of colors is almost unlimited. 	You can find (a/an) pepper which is green. Green is one of many possible colors (a/an) pepper usually has. The range of colors is almost unlimited. 	4	1	../worker_interaction/whitelist.txt	variability_open-sweet-pod	Agree or disagree (run4-experiment2-batch56-70-70)
c246e31f-3887-411c-b919-6ec8c26ed5ad	``Sweet'' is one for the first things which come to mind when I hear ``pod' because sweet is one of the typical tastes of (a/an) pod'.	``Heavy'' is one for the first things which come to mind when I hear ``rock' because heavy is one of the typical weights of (a/an) rock'.	``Green'' is one for the first things which come to mind when I hear ``raspberry' because green is one of the typical colors of (a/an) raspberry'.	4	1	../worker_interaction/whitelist.txt	typical_of_concept-sweet-pod	Agree or disagree (run4-experiment2-batch56-70-70)
12f34318-8b07-4d37-bbb5-fb284b27e6fa	I know that (a/an) pod is sweet as most or all other things similar to (a/an) pod are sweet. 	I know that (a/an) cotten_candy is sweet as most or all other things similar to (a/an) cotten_candy are sweet. 	I know that (a/an) dress is white as most or all other things similar to (a/an) dress are white. 	4	1	../worker_interaction/whitelist.txt	implied_category-sweet-pod	Agree or disagree (run4-experiment2-batch56-70-70)
58cca4d2-13ca-4452-aad3-7e8612703af3	Usually, (a/an) pod is not sweet, but there could be a highly unusual situation in which (a/an) pod is sweet.	Usually, (a/an) chocolate is not pink, but there could be a highly unusual situation in which (a/an) chocolate is pink.	Usually, (a/an) chocolate is not brown, but there could be a highly unusual situation in which (a/an) chocolate is brown.	4	1	../worker_interaction/whitelist.txt	unusual-sweet-pod	Agree or disagree (run4-experiment2-batch56-70-70)
56cff884-2c42-4af7-b250-74a050db406f	I think (a/an) pod can be sweet, but this is rare or uncommon.	I think (a/an) rose can be black, but this is rare or uncommon.	I think (a/an) rose can be yellow, but this is rare or uncommon.	4	1	../worker_interaction/whitelist.txt	rare-sweet-pod	Agree or disagree (run4-experiment2-batch56-70-70)
954e67e5-b757-40dd-89fb-bfccce3afaa2	``Pod'' is one of the first things which come to mind when I hear ``sweet' because (a/an) pod is a typical example of things which are sweet'. 	``Rainbow'' is one of the first things which come to mind when I hear ``colorful' because (a/an) rainbow is a typical example of things which are colorful'. 	``Table'' is one of the first things which come to mind when I hear ``white' because (a/an) table is a typical example of things which are white'. 	4	1	../worker_interaction/whitelist.txt	typical_of_property-sweet-pod	Agree or disagree (run4-experiment2-batch56-70-70)
fb3dfd31-cdc6-4efe-8d2c-8f36815f650a	I think it is impossible for (a/an) pod to be sweet.	I think it is impossible for (a/an) steam to be solid.	I think it is impossible for (a/an) flame to be orange.	4	1	../worker_interaction/whitelist.txt	impossible-sweet-pod	Agree or disagree (run4-experiment2-batch56-70-70)
44cbc55c-c955-4792-833d-13759bc42322	Usually, (a/an) railing is not made_of_wood, but there could be a highly unusual situation in which (a/an) railing are made_of_wood.	Usually, (a/an) skirt is not made_of_paper, but there could be a highly unusual situation in which (a/an) skirt are made_of_paper.	Usually, (a/an) cup is not made_of_paper, but there could be a highly unusual situation in which (a/an) cup are made_of_paper.	4	1	../worker_interaction/whitelist.txt	unusual-made_of_wood-railing	Agree or disagree (run4-experiment2-batch56-70-70)
5f0360f3-4ff1-482d-bfa7-fcc8ccd6a8de	You can find (a/an) railing which is made_of_wood. Made_of_wood is one of many possible materials (a/an) railing is usually made of. The range of materials is almost unlimited. 	You can find (a/an) bouquet which is made_of_daysies. Made_of_daysies is one of many possible flowers (a/an) bouquet is usually made of. The range of flowers is almost unlimited. 	You can find (a/an) book which is made_of_paper. Made_of_paper is one of many possible materials (a/an) book is usually made of. The range of materials is almost unlimited. 	4	1	../worker_interaction/whitelist.txt	variability_open-made_of_wood-railing	Agree or disagree (run4-experiment2-batch56-70-70)
988386be-0e40-47ad-a0fd-093687347bbd	I think it is impossible for (a/an) railing to be made_of_wood.	I think it is impossible for (a/an) light_bulb to be made_of_wood.	I think it is impossible for (a/an) spoon to be made_of_wood.	4	1	../worker_interaction/whitelist.txt	impossible-made_of_wood-railing	Agree or disagree (run4-experiment2-batch56-70-70)
32c2160c-8c5a-4bd6-b4a1-d892329c50d5	I think (a/an) railing can is made_of_wood, but this is rare or uncommon.	I think (a/an) dress can is made_of_plastic, but this is rare or uncommon.	I think (a/an) cup can is made_of_plastic, but this is rare or uncommon.	4	1	../worker_interaction/whitelist.txt	rare-made_of_wood-railing	Agree or disagree (run4-experiment2-batch56-70-70)
70609e82-0808-4187-8960-a5d72dd77548	I could say (a/an) railing is made_of_wood, but I would most certainly not mean it literally.	"I could say (a/an) anger has hot, but I would most certainly not mean it literally.
I could say (a/an) person has cold, but I would most certainly not mean it literally.
I could say (a/an) story has dark, but I would most certainly not mean it literally."	"I could say (a/an) fire has hot, but I would most certainly not mean it literally.
I could say (a/an) stone has heavy, but I would most certainly not mean it literally.
I could say (a/an) argument has liquid, but I would most certainly not mean it literally."	4	1	../worker_interaction/whitelist.txt	creative-made_of_wood-railing	Agree or disagree (run4-experiment2-batch56-70-70)
81305764-4179-4a25-af69-04db4eef4cd8	``Railing'' is one of the first things which come to mind when I hear ``made_of_wood' because (a/an) railing is a typical example of things which are (a/an) made_of_wood'. 	``Bread'' is one of the first things which come to mind when I hear ``made_of_grain' because (a/an) bread is a typical example of things which are (a/an) made_of_grain'. 	``Cake'' is one of the first things which come to mind when I hear ``made_of_grain' because (a/an) cake is a typical example of things which are (a/an) made_of_grain'. 	4	1	../worker_interaction/whitelist.txt	typical_of_property-made_of_wood-railing	Agree or disagree (run4-experiment2-batch56-70-70)
b42c2b99-33c7-4adc-8d4e-472c7e52a807	You can find (a/an) railing which is made_of_wood. Made_of_wood is one of a few possible materials (a/an) railing is usually made of. There is only a limited range of possible materials.	You can find (a/an) table which is made_of_glass. Made_of_glass is one of a few possible materials (a/an) table is usually made of. There is only a limited range of possible materials.	You can find (a/an) plate which is made_of_sugar. Made_of_sugar is one of a few possible materials (a/an) plate is usually made of. There is only a limited range of possible materials.	4	1	../worker_interaction/whitelist.txt	variability_limited-made_of_wood-railing	Agree or disagree (run4-experiment2-batch56-70-70)
0ab9d884-3587-4263-85c3-6136525c6ba2	I know that (a/an) railing is made_of_wood as most or all other things similar to (a/an) railing are made_of_wood. 	I know that (a/an) sock is made_of_fabric as most or all other things similar to (a/an) sock are made_of_fabric. 	I know that (a/an) fork is made_of_gold as most or all other things similar to (a/an) fork are made_of_gold. 	4	1	../worker_interaction/whitelist.txt	implied_category-made_of_wood-railing	Agree or disagree (run4-experiment2-batch56-70-70)
a8c1968e-2c3d-4ba7-961e-5a548b0f44bb	I know that being made_of_wood is necessary for many things (a/an) railing does or is used for. 	I know that having (a/an) bright is necessary for many things (a/an) flashlight does or is used for. 	I know that having (a/an) grey is necessary for many things (a/an) car does or is used for. 	4	1	../worker_interaction/whitelist.txt	affording_activity-made_of_wood-railing	Agree or disagree (run4-experiment2-batch56-70-70)
cfc135ec-18f7-4368-995d-05ee06d565ed	``Made_of_wood'' is one for the first things which come to mind when I hear ``railing' because made_of_wood is one of the typical materials of (a/an) railing'.	``Made_of_china'' is one for the first things which come to mind when I hear ``mug' because made_of_china is one of the typical materials of (a/an) mug'.	``Made_of_metal'' is one for the first things which come to mind when I hear ``plate' because made_of_metal is one of the typical materials of (a/an) plate'.	4	1	../worker_interaction/whitelist.txt	typical_of_concept-made_of_wood-railing	Agree or disagree (run4-experiment2-batch56-70-70)
check3	I am still focused on this task.	France is a country.	Amsterdam is a country.	4	1	../worker_interaction/whitelist.txt	_check-_check3-_check3	Agree or disagree (run4-experiment2-batch56-70-70)
test1	``Yellow'' is one for the first things which come to mind when I hear ``canary' because yellow is one of the typical colors of (a/an) canary'.	``Blue'' is one for the first things which come to mind when I hear ``sky' because blue is one of the typical colors of (a/an) sky'.	``Orange'' is one for the first things which come to mind when I hear ``milk'' because orange is one of the typical colors of (a/an) milk'.	4	1	../worker_interaction/whitelist.txt	test_true-_test1-_test1	Agree or disagree (run4-experiment2-batch56-70-70)
