quid	description	exampleTrue	exampleFalse	run	subList	completionUrl	triple	name
c0361509-6145-4d44-9829-112879daaa4c	I know that being sweet is necessary for many things (a/an) nectarine does or is used for. 	I know that being bright is necessary for many things (a/an) flashlight does or is used for. 	I know that being grey is necessary for many things (a/an) car does or is used for. 	4	1	https://app.prolific.co/submissions/complete?cc=52F87243	affording_activity-sweet-nectarine	Agree or disagree (run4-experiment2-batch89-70-70)
b8d4e7cb-a55e-4450-a274-dc3abb28bbff	``Nectarine'' is one of the first things which come to mind when I hear ``sweet' because (a/an) nectarine is a typical example of things which are sweet'. 	``Rainbow'' is one of the first things which come to mind when I hear ``colorful' because (a/an) rainbow is a typical example of things which are colorful'. 	``Table'' is one of the first things which come to mind when I hear ``white' because (a/an) table is a typical example of things which are white'. 	4	1	https://app.prolific.co/submissions/complete?cc=52F87243	typical_of_property-sweet-nectarine	Agree or disagree (run4-experiment2-batch89-70-70)
c7058d91-b62f-463b-986a-1d37708d3617	``Sweet'' is one for the first things which come to mind when I hear ``nectarine' because sweet is one of the typical tastes of (a/an) nectarine'.	``Spicy'' is one for the first things which come to mind when I hear ``chili_pepper' because spicy is one of the typical tastes of (a/an) chili_pepper'.	``Sweet'' is one for the first things which come to mind when I hear ``spinach' because sweet is one of the typical tastes of (a/an) spinach'.	4	1	https://app.prolific.co/submissions/complete?cc=52F87243	typical_of_concept-sweet-nectarine	Agree or disagree (run4-experiment2-batch89-70-70)
14b11e13-2995-4cf3-a5f1-0ab256a9009b	I could say (a/an) nectarine is sweet, but I would most certainly not mean it literally.	"I could say (a/an) anger is hot, but I would most certainly not mean it literally.
I could say (a/an) person is cold, but I would most certainly not mean it literally.
I could say (a/an) story is dark, but I would most certainly not mean it literally."	"I could say (a/an) fire is hot, but I would most certainly not mean it literally.
I could say (a/an) stone is heavy, but I would most certainly not mean it literally.
I could say (a/an) argument is liquid, but I would most certainly not mean it literally."	4	1	https://app.prolific.co/submissions/complete?cc=52F87243	creative-sweet-nectarine	Agree or disagree (run4-experiment2-batch89-70-70)
e89e6520-4eae-4a42-b19a-eb8bbefbac02	You can find (a/an) cheesecloth which is hot. (A/an) cheesecloth is usually either hot, a bit more or less hot or the opposite of hot.	You can find (a/an) chocolate which is bitter. (A/an) chocolate is usually either bitter, a bit more or less bitter or the opposite of bitter.	You can find (a/an) diamond which is soft. (A/an) diamond is usually either soft, a bit more or less soft or the opposite of soft.	4	1	https://app.prolific.co/submissions/complete?cc=52F87243	variability_open-hot-cheesecloth	Agree or disagree (run4-experiment2-batch89-70-70)
f7ba8287-7362-47df-8b68-af4b3ddce799	I think (a/an) cheesecloth can be hot, but this is rare or uncommon.	I think (a/an) pizza can be sweet, but this is rare or uncommon.	I think (a/an) pizza can be savory, but this is rare or uncommon.	4	1	https://app.prolific.co/submissions/complete?cc=52F87243	rare-hot-cheesecloth	Agree or disagree (run4-experiment2-batch89-70-70)
6e3b2a3a-451f-4f2c-9f61-ec2bcc231dcc	You can find (a/an) cheesecloth which is hot. (A/an) cheesecloth is usually either hot or not hot. It cannot be a bit more or less hot.	You can find (a/an) substance which is solid. (A/an) substance is usually either solid or not solid. It cannot be a bit more or less solid.	You can find (a/an) cushion which is soft. (A/an) cushion is usually either soft or not soft. It cannot be a bit more or less soft.	4	1	https://app.prolific.co/submissions/complete?cc=52F87243	variability_limited-hot-cheesecloth	Agree or disagree (run4-experiment2-batch89-70-70)
314e12fd-d837-4848-8273-13566b69211b	I think it is impossible for (a/an) cheesecloth to be hot.	I think it is impossible for (a/an) flame to be frozen.	I think it is impossible for (a/an) book to be light.	4	1	https://app.prolific.co/submissions/complete?cc=52F87243	impossible-hot-cheesecloth	Agree or disagree (run4-experiment2-batch89-70-70)
b506c3e0-06b5-49f1-bafc-a8a01d9207e8	Usually, (a/an) cheesecloth is not hot, but there could be a highly unusual situation in which (a/an) cheesecloth is hot.	Usually, (a/an) table is not furry, but there could be a highly unusual situation in which (a/an) table is furry.	Usually, (a/an) cat is not furry, but there could be a highly unusual situation in which (a/an) cat is furry.	4	1	https://app.prolific.co/submissions/complete?cc=52F87243	unusual-hot-cheesecloth	Agree or disagree (run4-experiment2-batch89-70-70)
f8acfdfe-237a-4d96-a333-f00f434c370c	``Cheesecloth'' is one of the first things which come to mind when I hear ``hot' because (a/an) cheesecloth is a typical example of things which are hot'. 	``Snow'' is one of the first things which come to mind when I hear ``white' because (a/an) snow is a typical example of things which are white'. 	``Water'' is one of the first things which come to mind when I hear ``grey' because (a/an) water is a typical example of things which are grey'. 	4	1	https://app.prolific.co/submissions/complete?cc=52F87243	typical_of_property-hot-cheesecloth	Agree or disagree (run4-experiment2-batch89-70-70)
4d9cd999-bdb0-4b64-8447-11ece5023ade	I know that being hot is necessary for many things (a/an) cheesecloth does or is used for. 	I know that being bright is necessary for many things (a/an) flashlight does or is used for. 	I know that being grey is necessary for many things (a/an) car does or is used for. 	4	1	https://app.prolific.co/submissions/complete?cc=52F87243	affording_activity-hot-cheesecloth	Agree or disagree (run4-experiment2-batch89-70-70)
6f963d13-912d-4897-859d-22160657abb5	I could say (a/an) cheesecloth is hot, but I would most certainly not mean it literally.	"I could say (a/an) anger is hot, but I would most certainly not mean it literally.
I could say (a/an) person is cold, but I would most certainly not mean it literally.
I could say (a/an) story is dark, but I would most certainly not mean it literally."	"I could say (a/an) fire is hot, but I would most certainly not mean it literally.
I could say (a/an) stone is heavy, but I would most certainly not mean it literally.
I could say (a/an) argument is liquid, but I would most certainly not mean it literally."	4	1	https://app.prolific.co/submissions/complete?cc=52F87243	creative-hot-cheesecloth	Agree or disagree (run4-experiment2-batch89-70-70)
b49a5945-b7d8-4c05-9991-0bbd7c771abf	``Hot'' is one for the first things which come to mind when I hear ``cheesecloth' because hot is one of the typical temperatures of (a/an) cheesecloth'.	``Heavy'' is one for the first things which come to mind when I hear ``rock' because heavy is one of the typical weights of (a/an) rock'.	``Bright'' is one for the first things which come to mind when I hear ``mug' because bright is one of the typical appearances of (a/an) mug'.	4	1	https://app.prolific.co/submissions/complete?cc=52F87243	typical_of_concept-hot-cheesecloth	Agree or disagree (run4-experiment2-batch89-70-70)
546bc60f-f28e-484d-be22-2cbe2db1ff3e	I know that (a/an) cheesecloth is hot as most or all other things similar to (a/an) cheesecloth are hot. 	I know that (a/an) chocoloate_bar is sweet as most or all other things similar to (a/an) chocoloate_bar are sweet. 	I know that (a/an) dress is white as most or all other things similar to (a/an) dress are white. 	4	1	https://app.prolific.co/submissions/complete?cc=52F87243	implied_category-hot-cheesecloth	Agree or disagree (run4-experiment2-batch89-70-70)
ed709179-c4be-4bbb-9ea1-77568affebaa	I could say (a/an) apple is black, but I would most certainly not mean it literally.	"I could say (a/an) anger is hot, but I would most certainly not mean it literally.
I could say (a/an) person is cold, but I would most certainly not mean it literally.
I could say (a/an) story is dark, but I would most certainly not mean it literally."	"I could say (a/an) fire is hot, but I would most certainly not mean it literally.
I could say (a/an) stone is heavy, but I would most certainly not mean it literally.
I could say (a/an) argument is liquid, but I would most certainly not mean it literally."	4	1	https://app.prolific.co/submissions/complete?cc=52F87243	creative-black-apple	Agree or disagree (run4-experiment2-batch89-70-70)
cb4196ba-2c45-44ba-98b7-1e39eeca68ef	I think (a/an) apple can be black, but this is rare or uncommon.	I think (a/an) snail can be purple, but this is rare or uncommon.	I think (a/an) bell pepper can be green, but this is rare or uncommon.	4	1	https://app.prolific.co/submissions/complete?cc=52F87243	rare-black-apple	Agree or disagree (run4-experiment2-batch89-70-70)
d7a8a0e7-ca51-4731-9ca3-b39ec94d6075	I think it is impossible for (a/an) apple to be black.	I think it is impossible for (a/an) water to be dry.	I think it is impossible for (a/an) rose to be white.	4	1	https://app.prolific.co/submissions/complete?cc=52F87243	impossible-black-apple	Agree or disagree (run4-experiment2-batch89-70-70)
98fd3d1f-3e55-4fec-b0ee-3687188db749	Usually, (a/an) apple is not black, but there could be a highly unusual situation in which (a/an) apple is black.	Usually, (a/an) chocolate is not pink, but there could be a highly unusual situation in which (a/an) chocolate is pink.	Usually, (a/an) chocolate is not brown, but there could be a highly unusual situation in which (a/an) chocolate is brown.	4	1	https://app.prolific.co/submissions/complete?cc=52F87243	unusual-black-apple	Agree or disagree (run4-experiment2-batch89-70-70)
da8de65c-9750-4096-9879-4bce2d6d9df2	Usually, (a/an) mole cannot lay_eggs/be used for laying eggs, but there could be a highly unusual situation in which (a/an) mole can lay_eggs.	Usually, (a/an) dog cannot speak/be used for speaking, but there could be a highly unusual situation in which (a/an) dog can speak.	Usually, (a/an) dog cannot bark/be used for barking, but there could be a highly unusual situation in which (a/an) dog can bark.	4	1	https://app.prolific.co/submissions/complete?cc=52F87243	unusual-lay_eggs-mole	Agree or disagree (run4-experiment2-batch89-70-70)
feb5f4ad-d00e-43e4-ae4a-e4afca733fcb	``Lay_eggs'' is one for the first things which come to mind when I hear ``mole' because laying eggs is one of the typical activities of (a/an) mole'.	``Poke'' is one for the first things which come to mind when I hear ``needle' because pokeing is one of the typical activities of (a/an) needle'.	``Cut'' is one for the first things which come to mind when I hear ``brush' because cuting is one of the typical activities of (a/an) brush'.	4	1	https://app.prolific.co/submissions/complete?cc=52F87243	typical_of_concept-lay_eggs-mole	Agree or disagree (run4-experiment2-batch89-70-70)
892fcdba-1819-4a2b-ba9c-a9b5ec3140ce	I know that all or most mole(s) lay_eggs regularly or are used for laying eggs regularly. 	I know that all or most bug(s) crawl regularly or are used for crawling regularly. 	I know that all or most toothbrush(s) paint regularly or are used for painting regularly. 	4	1	https://app.prolific.co/submissions/complete?cc=52F87243	afforded_usual-lay_eggs-mole	Agree or disagree (run4-experiment2-batch89-70-70)
175add49-ec47-4060-917a-b8cfc0b3650a	``Mole'' is one of the first things which come to mind when I hear ``lay_eggs' because (a/an) mole is a typical example of things which lay_eggs/are used for laying eggs'. 	``Cat'' is one of the first things which come to mind when I hear ``purr' because (a/an) cat is a typical example of things which purr/are used for purring'. 	``Dog'' is one of the first things which come to mind when I hear ``run' because (a/an) dog is a typical example of things which run/are used for runing'. 	4	1	https://app.prolific.co/submissions/complete?cc=52F87243	typical_of_property-lay_eggs-mole	Agree or disagree (run4-experiment2-batch89-70-70)
3cbcf284-7eb4-42e0-8cdb-67e2a89377a6	All or most  mole(s) can lay_eggs/be used for laying eggs. This is not what they normally do or are used for. 	All or most  toothbrush(s) can paint/be used for painting. This is not what they normally do or are used for. 	All or most  brush(s) can paint/be used for painting. This is not what they normally do or are used for. 	4	1	https://app.prolific.co/submissions/complete?cc=52F87243	afforded_unusual-lay_eggs-mole	Agree or disagree (run4-experiment2-batch89-70-70)
3002ce65-06b7-428e-9abc-e064d044befc	I could say (a/an) mole lays eggs/is used for laying eggs, but I would most certainly not mean it literally.	"I could say (a/an) idea grows/is used for growing, but I would most certainly not mean it literally.
I could say (a/an) person glows/is used for glowing, but I would most certainly not mean it literally.
I could say (a/an) thought burns/is used for burning, but I would most certainly not mean it literally."	"I could say (a/an) plant grows/is used for growing, but I would most certainly not mean it literally.
I could say (a/an) situation smiles/is used for smileing, but I would most certainly not mean it literally.
I could say (a/an) candle burns/is used for burning, but I would most certainly not mean it literally."	4	1	https://app.prolific.co/submissions/complete?cc=52F87243	creative-lay_eggs-mole	Agree or disagree (run4-experiment2-batch89-70-70)
8f398489-9cdf-401b-a937-a59928e59708	I know that (a/an) mole can lay_eggs/be used for laying eggs as most or all other things similar to (a/an) mole lay_eggs. 	I know that (a/an) poodle can bark/be used for barking as most or all other things similar to (a/an) poodle bark. 	I know that (a/an) dog can bark/be used for barking as most or all other things similar to (a/an) dog bark. 	4	1	https://app.prolific.co/submissions/complete?cc=52F87243	implied_category-lay_eggs-mole	Agree or disagree (run4-experiment2-batch89-70-70)
ef2f2572-ca1d-4e66-9b35-8976aece9a46	You can find (a/an) mole which can lay_eggs/be used for laying eggs. This distinguishes a certain type of mole from others. 	You can find (a/an) knife which can cook/be used for cooking. This distinguishes a certain type of knife from others. 	You can find (a/an) book which can read/be used for reading. This distinguishes a certain type of book from others. 	4	1	https://app.prolific.co/submissions/complete?cc=52F87243	variability_limited-lay_eggs-mole	Agree or disagree (run4-experiment2-batch89-70-70)
0391f7c5-dbe7-4e6a-8d06-242de8ed81a0	I think it is impossible for (a/an) mole to lay_eggs/be used for laying eggs.	I think it is impossible for (a/an) hammer to float/be used for floating.	I think it is impossible for (a/an) apple to rot/be used for roting.	4	1	https://app.prolific.co/submissions/complete?cc=52F87243	impossible-lay_eggs-mole	Agree or disagree (run4-experiment2-batch89-70-70)
032a8552-7d58-41c6-a2e7-42bb288e337c	I think there is a mole  which can lay_eggs/be used for laying eggs, but this is rare or uncommon.	I think there is a car  which can swim/be used for swimming, but this is rare or uncommon.	I think there is a rock  which can swim/be used for swimming, but this is rare or uncommon.	4	1	https://app.prolific.co/submissions/complete?cc=52F87243	rare-lay_eggs-mole	Agree or disagree (run4-experiment2-batch89-70-70)
check4	I am answering questions at random. 	Trains are vehicles. 	Carrots are animals. 	4	1	https://app.prolific.co/submissions/complete?cc=52F87243	_check-_check4-_check4	Agree or disagree (run4-experiment2-batch89-70-70)
test1	``Yellow'' is one for the first things which come to mind when I hear ``canary' because yellow is one of the typical colors of (a/an) canary'.	``Blue'' is one for the first things which come to mind when I hear ``sky' because blue is one of the typical colors of (a/an) sky'.	``Orange'' is one for the first things which come to mind when I hear ``milk'' because orange is one of the typical colors of (a/an) milk'.	4	1	https://app.prolific.co/submissions/complete?cc=52F87243	test_true-_test1-_test1	Agree or disagree (run4-experiment2-batch89-70-70)
