quid	description	exampleTrue	exampleFalse	run	subList	completionUrl	triple	name
ab030758-ac92-469e-b7c4-b33df4426639	I know that (a/an) ape can fly/be used for flying as most or all other things similar to (a/an) ape fly. 	I know that (a/an) apple_tree can grow/be used for growing as most or all other things similar to (a/an) apple_tree grow. 	I know that (a/an) worm can run/be used for runing as most or all other things similar to (a/an) worm run. 	4	1	https://app.prolific.co/submissions/complete?cc=6A5D90CA	implied_category-fly-ape	Agree or disagree (run4-experiment2-batch106-70-70)
518b2723-9aab-41d8-bc37-04854029809f	``Ape'' is one of the first things which come to mind when I hear ``fly' because (a/an) ape is a typical example of things which fly/are used for flying'. 	``Baby'' is one of the first things which come to mind when I hear ``cry' because (a/an) baby is a typical example of things which cry/are used for crying'. 	``Teacher'' is one of the first things which come to mind when I hear ``walk' because (a/an) teacher is a typical example of things which walk/are used for walking'. 	4	1	https://app.prolific.co/submissions/complete?cc=6A5D90CA	typical_of_property-fly-ape	Agree or disagree (run4-experiment2-batch106-70-70)
f667e4ef-e091-41d2-b293-686171553ef3	All or most  ape(s) can fly/be used for flying. This is not what they normally do or are used for. 	All or most  fork(s) can fight/be used for fighting. This is not what they normally do or are used for. 	All or most  brush(s) can fly/be used for flying. This is not what they normally do or are used for. 	4	1	https://app.prolific.co/submissions/complete?cc=6A5D90CA	afforded_unusual-fly-ape	Agree or disagree (run4-experiment2-batch106-70-70)
309d6e0b-b083-4bef-a42f-b688b224573c	You can find (a/an) ape which can fly/be used for flying. This distinguishes a certain type of ape from others. 	You can find (a/an) lamp which can read/be used for reading. This distinguishes a certain type of lamp from others. 	You can find (a/an) coat which can cook/be used for cooking. This distinguishes a certain type of coat from others. 	4	1	https://app.prolific.co/submissions/complete?cc=6A5D90CA	variability_limited-fly-ape	Agree or disagree (run4-experiment2-batch106-70-70)
6de2efc0-2554-4df8-82e6-3072a3f317e8	Usually, (a/an) ape cannot fly/be used for flying, but there could be a highly unusual situation in which (a/an) ape can fly.	Usually, (a/an) dog cannot speak/be used for speaking, but there could be a highly unusual situation in which (a/an) dog can speak.	Usually, (a/an) dog cannot bark/be used for barking, but there could be a highly unusual situation in which (a/an) dog can bark.	4	1	https://app.prolific.co/submissions/complete?cc=6A5D90CA	unusual-fly-ape	Agree or disagree (run4-experiment2-batch106-70-70)
1bcb5371-b16e-42fe-a28e-6868ed96d8c9	I think it is impossible for (a/an) garlic to be yellow.	I think it is impossible for (a/an) water to be dry.	I think it is impossible for (a/an) rose to be white.	4	1	https://app.prolific.co/submissions/complete?cc=6A5D90CA	impossible-yellow-garlic	Agree or disagree (run4-experiment2-batch106-70-70)
c07a8b24-3474-442c-bfa4-56e4428e8848	Usually, (a/an) garlic is not yellow, but there could be a highly unusual situation in which (a/an) garlic is yellow.	Usually, (a/an) pony is not blue, but there could be a highly unusual situation in which (a/an) pony is blue.	Usually, (a/an) beer is not brown, but there could be a highly unusual situation in which (a/an) beer is brown.	4	1	https://app.prolific.co/submissions/complete?cc=6A5D90CA	unusual-yellow-garlic	Agree or disagree (run4-experiment2-batch106-70-70)
59bc8ca1-4aad-40d1-ab81-f26d08418e8b	I think (a/an) garlic can be yellow, but this is rare or uncommon.	I think (a/an) tomato can be yellow, but this is rare or uncommon.	I think (a/an) grizzly bear can be grey, but this is rare or uncommon.	4	1	https://app.prolific.co/submissions/complete?cc=6A5D90CA	rare-yellow-garlic	Agree or disagree (run4-experiment2-batch106-70-70)
c0bcdc43-5c86-4bed-a970-33318b48edc4	I could say (a/an) garlic is yellow, but I would most certainly not mean it literally.	"I could say (a/an) anger is hot, but I would most certainly not mean it literally.
I could say (a/an) person is cold, but I would most certainly not mean it literally.
I could say (a/an) story is dark, but I would most certainly not mean it literally."	"I could say (a/an) fire is hot, but I would most certainly not mean it literally.
I could say (a/an) stone is heavy, but I would most certainly not mean it literally.
I could say (a/an) argument is liquid, but I would most certainly not mean it literally."	4	1	https://app.prolific.co/submissions/complete?cc=6A5D90CA	creative-yellow-garlic	Agree or disagree (run4-experiment2-batch106-70-70)
a1fae98b-8422-4ea5-be79-3fb66942cf7c	All or most  turkey(s) can lay_eggs/be used for laying eggs. This is not what they normally do or are used for. 	All or most  fork(s) can fight/be used for fighting. This is not what they normally do or are used for. 	All or most  brush(s) can fly/be used for flying. This is not what they normally do or are used for. 	4	1	https://app.prolific.co/submissions/complete?cc=6A5D90CA	afforded_unusual-lay_eggs-turkey	Agree or disagree (run4-experiment2-batch106-70-70)
77afc029-910e-45b4-bb71-e35cfc42b317	``Turkey'' is one of the first things which come to mind when I hear ``lay_eggs' because (a/an) turkey is a typical example of things which lay_eggs/are used for laying eggs'. 	``Cat'' is one of the first things which come to mind when I hear ``purr' because (a/an) cat is a typical example of things which purr/are used for purring'. 	``Dog'' is one of the first things which come to mind when I hear ``run' because (a/an) dog is a typical example of things which run/are used for runing'. 	4	1	https://app.prolific.co/submissions/complete?cc=6A5D90CA	typical_of_property-lay_eggs-turkey	Agree or disagree (run4-experiment2-batch106-70-70)
9b731be1-3d67-4d89-bf40-eb5efc087084	``Lay_eggs'' is one for the first things which come to mind when I hear ``turkey' because laying eggs is one of the typical activities of (a/an) turkey'.	``Paint'' is one for the first things which come to mind when I hear ``brush' because painting is one of the typical activities of (a/an) brush'.	``Throw'' is one for the first things which come to mind when I hear ``apple' because throwing is one of the typical activites of (a/an) apple'.	4	1	https://app.prolific.co/submissions/complete?cc=6A5D90CA	typical_of_concept-lay_eggs-turkey	Agree or disagree (run4-experiment2-batch106-70-70)
4835ee30-61d5-46da-af72-28fa4832a6b8	You can find (a/an) turkey which can lay_eggs/be used for laying eggs. This distinguishes a certain type of turkey from others. 	You can find (a/an) dog which can hunt/be used for hunting. This distinguishes a certain type of dog from others. 	You can find (a/an) dog which can breathe/be used for breathing. This distinguishes a certain type of dog from others. 	4	1	https://app.prolific.co/submissions/complete?cc=6A5D90CA	variability_limited-lay_eggs-turkey	Agree or disagree (run4-experiment2-batch106-70-70)
585d56ca-f0a8-40b9-b996-1b7928cd1439	I think there is a turkey  which can lay_eggs/be used for laying eggs, but this is rare or uncommon.	I think there is a toddler  which can read/be used for reading, but this is rare or uncommon.	I think there is a teenager  which can read/be used for reading, but this is rare or uncommon.	4	1	https://app.prolific.co/submissions/complete?cc=6A5D90CA	rare-lay_eggs-turkey	Agree or disagree (run4-experiment2-batch106-70-70)
9af855a2-0965-4c27-b14e-88c11ed2f47c	I could say (a/an) turkey lays eggs/is used for laying eggs, but I would most certainly not mean it literally.	"I could say (a/an) idea grows/is used for growing, but I would most certainly not mean it literally.
I could say (a/an) person glows/is used for glowing, but I would most certainly not mean it literally.
I could say (a/an) thought burns/is used for burning, but I would most certainly not mean it literally."	"I could say (a/an) plant grows/is used for growing, but I would most certainly not mean it literally.
I could say (a/an) situation smiles/is used for smileing, but I would most certainly not mean it literally.
I could say (a/an) candle burns/is used for burning, but I would most certainly not mean it literally."	4	1	https://app.prolific.co/submissions/complete?cc=6A5D90CA	creative-lay_eggs-turkey	Agree or disagree (run4-experiment2-batch106-70-70)
d6a20e7c-6ae5-472d-a74a-8bcecc4b2ece	I know that all or most turkey(s) lay_eggs regularly or are used for laying eggs regularly. 	I know that all or most candle(s) burn regularly or are used for burning regularly. 	I know that all or most T-shirt(s) wrap regularly or are used for wraping regularly. 	4	1	https://app.prolific.co/submissions/complete?cc=6A5D90CA	afforded_usual-lay_eggs-turkey	Agree or disagree (run4-experiment2-batch106-70-70)
eb8548d7-a6f8-41fe-9ab4-2edd4fedcdf0	I know that (a/an) turkey can lay_eggs/be used for laying eggs as most or all other things similar to (a/an) turkey lay_eggs. 	I know that (a/an) dog can breathe/be used for breathing as most or all other things similar to (a/an) dog breathe. 	I know that (a/an) cat can meow/be used for meowing as most or all other things similar to (a/an) cat meow. 	4	1	https://app.prolific.co/submissions/complete?cc=6A5D90CA	implied_category-lay_eggs-turkey	Agree or disagree (run4-experiment2-batch106-70-70)
e95a7906-3d06-4384-89ac-c2cc63f01e99	Usually, (a/an) turkey cannot lay_eggs/be used for laying eggs, but there could be a highly unusual situation in which (a/an) turkey can lay_eggs.	Usually, (a/an) rat cannot cook/be used for cooking, but there could be a highly unusual situation in which (a/an) rat can cook.	Usually, (a/an) teacher cannot teach/be used for teaching, but there could be a highly unusual situation in which (a/an) teacher can teach.	4	1	https://app.prolific.co/submissions/complete?cc=6A5D90CA	unusual-lay_eggs-turkey	Agree or disagree (run4-experiment2-batch106-70-70)
916865fc-bf44-4022-8a64-ee64872f1240	I think it is impossible for (a/an) turkey to lay_eggs/be used for laying eggs.	I think it is impossible for (a/an) worm to walk/be used for walking.	I think it is impossible for (a/an) worm to move/be used for moveing.	4	1	https://app.prolific.co/submissions/complete?cc=6A5D90CA	impossible-lay_eggs-turkey	Agree or disagree (run4-experiment2-batch106-70-70)
d38d7f00-9ab6-4da9-9015-f75c996a2c23	I know that (a/an) cubicle is square as most or all other things similar to (a/an) cubicle are square. 	I know that (a/an) chocoloate_cake is sweet as most or all other things similar to (a/an) chocoloate_cake are sweet. 	I know that (a/an) table is transparent as most or all other things similar to (a/an) table are transparent. 	4	1	https://app.prolific.co/submissions/complete?cc=6A5D90CA	implied_category-square-cubicle	Agree or disagree (run4-experiment2-batch106-70-70)
be3e32ce-d5e8-482a-9696-acdc8e68f308	I could say (a/an) cubicle is square, but I would most certainly not mean it literally.	"I could say (a/an) anger is hot, but I would most certainly not mean it literally.
I could say (a/an) person is cold, but I would most certainly not mean it literally.
I could say (a/an) story is dark, but I would most certainly not mean it literally."	"I could say (a/an) fire is hot, but I would most certainly not mean it literally.
I could say (a/an) stone is heavy, but I would most certainly not mean it literally.
I could say (a/an) argument is liquid, but I would most certainly not mean it literally."	4	1	https://app.prolific.co/submissions/complete?cc=6A5D90CA	creative-square-cubicle	Agree or disagree (run4-experiment2-batch106-70-70)
5962fdea-d3b9-47eb-aad8-fc6f6264acbc	Usually, (a/an) cubicle is not square, but there could be a highly unusual situation in which (a/an) cubicle is square.	Usually, (a/an) dog is not green, but there could be a highly unusual situation in which (a/an) dog is green.	Usually, (a/an) razor is not sharp, but there could be a highly unusual situation in which (a/an) razor is sharp.	4	1	https://app.prolific.co/submissions/complete?cc=6A5D90CA	unusual-square-cubicle	Agree or disagree (run4-experiment2-batch106-70-70)
8b6a9606-6aa6-43c6-92ab-c839ea98ae55	I think (a/an) cubicle can be square, but this is rare or uncommon.	I think (a/an) tomato can be yellow, but this is rare or uncommon.	I think (a/an) grizzly bear can be grey, but this is rare or uncommon.	4	1	https://app.prolific.co/submissions/complete?cc=6A5D90CA	rare-square-cubicle	Agree or disagree (run4-experiment2-batch106-70-70)
bcfd0eb0-dcca-4f48-862a-1f230846e9fb	I think it is impossible for (a/an) cubicle to be square.	I think it is impossible for (a/an) water to be dry.	I think it is impossible for (a/an) rose to be white.	4	1	https://app.prolific.co/submissions/complete?cc=6A5D90CA	impossible-square-cubicle	Agree or disagree (run4-experiment2-batch106-70-70)
ba588356-4d17-4a76-b47b-ccae1e0920a9	I know that being square is necessary for many things (a/an) cubicle does or is used for. 	I know that being sharp is necessary for many things (a/an) razor does or is used for. 	I know that being colorful is necessary for many things (a/an) dress does or is used for. 	4	1	https://app.prolific.co/submissions/complete?cc=6A5D90CA	affording_activity-square-cubicle	Agree or disagree (run4-experiment2-batch106-70-70)
151a1c95-1182-459d-b827-e3ef33e1e2c5	You can find (a/an) cubicle which is square. Square is one of many possible shapes (a/an) cubicle usually has. The range of shapes is almost unlimited. 	You can find (a/an) t-shirt which is white. White is one of many possible colors (a/an) t-shirt usually has. The range of colors is almost unlimited. 	You can find (a/an) pepper which is green. Green is one of many possible colors (a/an) pepper usually has. The range of colors is almost unlimited. 	4	1	https://app.prolific.co/submissions/complete?cc=6A5D90CA	variability_open-square-cubicle	Agree or disagree (run4-experiment2-batch106-70-70)
7948ce07-cc18-4f70-b792-e88bb006f661	You can find (a/an) cubicle which is square. Square is one of a few possible shapes (a/an) cubicle usually has. There is only a limited range of possible shapes.	You can find (a/an) apple which is green. Green is one of a few possible colors (a/an) apple usually has. There is only a limited range of possible colors.	You can find (a/an) car which is white. White is one of a few possible colors (a/an) car usually has. There is only a limited range of possible colors.	4	1	https://app.prolific.co/submissions/complete?cc=6A5D90CA	variability_limited-square-cubicle	Agree or disagree (run4-experiment2-batch106-70-70)
0dc90ba5-8ee9-4090-a213-4cb07c9c9a6b	``Square'' is one for the first things which come to mind when I hear ``cubicle' because square is one of the typical shapes of (a/an) cubicle'.	``Bitter'' is one for the first things which come to mind when I hear ``coffee' because bitter is one of the typical tastes of (a/an) coffee'.	``Salty'' is one for the first things which come to mind when I hear ``beer' because salty is one of the typical tastes of (a/an) beer'.	4	1	https://app.prolific.co/submissions/complete?cc=6A5D90CA	typical_of_concept-square-cubicle	Agree or disagree (run4-experiment2-batch106-70-70)
c7008c71-af1a-4aed-ba78-449ae939076f	``Cubicle'' is one of the first things which come to mind when I hear ``square' because (a/an) cubicle is a typical example of things which are square'. 	``Rainbow'' is one of the first things which come to mind when I hear ``colorful' because (a/an) rainbow is a typical example of things which are colorful'. 	``Table'' is one of the first things which come to mind when I hear ``white' because (a/an) table is a typical example of things which are white'. 	4	1	https://app.prolific.co/submissions/complete?cc=6A5D90CA	typical_of_property-square-cubicle	Agree or disagree (run4-experiment2-batch106-70-70)
check3	I am still focused on this task.	France is a country.	Amsterdam is a country.	4	1	https://app.prolific.co/submissions/complete?cc=6A5D90CA	_check-_check3-_check3	Agree or disagree (run4-experiment2-batch106-70-70)
test4	You can find (a/an) chocolate which is pink. Pink is one of a few possible colors (a/an) chocolate usually has. There is only a limited range of possible colors.	You can find (a/an) banana which is brown. Brown is one of a few possible colors (a/an) banana usually has. There is only a limited range of possible colors.	You can find (a/an) raven which is blue. Blue is one of a few possible colors (a/an) raven usually has. There is only a limited range of possible colors.	4	1	https://app.prolific.co/submissions/complete?cc=6A5D90CA	test_false-_test4-_test	Agree or disagree (run4-experiment2-batch106-70-70)
