quid	description	exampleTrue	exampleFalse	run	subList	completionUrl	triple	name
14ba44ed-646d-4409-a7a0-d2dcfdd49d17	``Made_of_wood'' is one for the first things which come to mind when I hear ``spindle' because made_of_wood is one of the typical materials of (a/an) spindle'.	``Made_of_metal'' is one for the first things which come to mind when I hear ``chain' because made_of_metal is one of the typical materials of (a/an) chain'.	``Made_of_fabric'' is one for the first things which come to mind when I hear ``chain' because made_of_fabric is one of the typical materials of (a/an) chain'.	4	1	https://app.prolific.co/submissions/complete?cc=6C6E4DAD	typical_of_concept-made_of_wood-spindle	Agree or disagree (run4-experiment2-batch123-70-70)
8fd85bd1-ce48-4d83-99d8-c7628231ab98	I could say (a/an) spindle is made_of_wood, but I would most certainly not mean it literally.	"I could say (a/an) anger has hot, but I would most certainly not mean it literally.
I could say (a/an) person has cold, but I would most certainly not mean it literally.
I could say (a/an) story has dark, but I would most certainly not mean it literally."	"I could say (a/an) fire has hot, but I would most certainly not mean it literally.
I could say (a/an) stone has heavy, but I would most certainly not mean it literally.
I could say (a/an) argument has liquid, but I would most certainly not mean it literally."	4	1	https://app.prolific.co/submissions/complete?cc=6C6E4DAD	creative-made_of_wood-spindle	Agree or disagree (run4-experiment2-batch123-70-70)
0b0e84b7-5129-4698-97d0-60efd84e729d	``Spindle'' is one of the first things which come to mind when I hear ``made_of_wood' because (a/an) spindle is a typical example of things which are (a/an) made_of_wood'. 	``Bread'' is one of the first things which come to mind when I hear ``made_of_grain' because (a/an) bread is a typical example of things which are (a/an) made_of_grain'. 	``Cake'' is one of the first things which come to mind when I hear ``made_of_grain' because (a/an) cake is a typical example of things which are (a/an) made_of_grain'. 	4	1	https://app.prolific.co/submissions/complete?cc=6C6E4DAD	typical_of_property-made_of_wood-spindle	Agree or disagree (run4-experiment2-batch123-70-70)
fca769f1-d700-4032-90fe-930b370e8948	You can find (a/an) spindle which is made_of_wood. Made_of_wood is one of many possible materials (a/an) spindle is usually made of. The range of materials is almost unlimited. 	You can find (a/an) bouquet which is made_of_daysies. Made_of_daysies is one of many possible flowers (a/an) bouquet is usually made of. The range of flowers is almost unlimited. 	You can find (a/an) book which is made_of_paper. Made_of_paper is one of many possible materials (a/an) book is usually made of. The range of materials is almost unlimited. 	4	1	https://app.prolific.co/submissions/complete?cc=6C6E4DAD	variability_open-made_of_wood-spindle	Agree or disagree (run4-experiment2-batch123-70-70)
22c9dba6-e23a-4d79-8df2-0abefab71792	I think (a/an) ingredient can be hot, but this is rare or uncommon.	I think (a/an) pizza can be sweet, but this is rare or uncommon.	I think (a/an) pizza can be savory, but this is rare or uncommon.	4	1	https://app.prolific.co/submissions/complete?cc=6C6E4DAD	rare-hot-ingredient	Agree or disagree (run4-experiment2-batch123-70-70)
c212b99b-0b16-4178-b2a7-a61c943f7690	``Hot'' is one for the first things which come to mind when I hear ``ingredient' because hot is one of the typical temperatures of (a/an) ingredient'.	``Spicy'' is one for the first things which come to mind when I hear ``chili_pepper' because spicy is one of the typical tastes of (a/an) chili_pepper'.	``Sweet'' is one for the first things which come to mind when I hear ``spinach' because sweet is one of the typical tastes of (a/an) spinach'.	4	1	https://app.prolific.co/submissions/complete?cc=6C6E4DAD	typical_of_concept-hot-ingredient	Agree or disagree (run4-experiment2-batch123-70-70)
1f1f971a-bc5e-4675-a6e3-efd0d816d693	``Ingredient'' is one of the first things which come to mind when I hear ``hot' because (a/an) ingredient is a typical example of things which are hot'. 	``Rainbow'' is one of the first things which come to mind when I hear ``colorful' because (a/an) rainbow is a typical example of things which are colorful'. 	``Dress'' is one of the first things which come to mind when I hear ``white' because (a/an) dress is a typical example of things which are white'. 	4	1	https://app.prolific.co/submissions/complete?cc=6C6E4DAD	typical_of_property-hot-ingredient	Agree or disagree (run4-experiment2-batch123-70-70)
f3cac62b-f72e-4dc2-8d9e-702e2317c898	I know that being hot is necessary for many things (a/an) ingredient does or is used for. 	I know that being sharp is necessary for many things (a/an) razor does or is used for. 	I know that being colorful is necessary for many things (a/an) dress does or is used for. 	4	1	https://app.prolific.co/submissions/complete?cc=6C6E4DAD	affording_activity-hot-ingredient	Agree or disagree (run4-experiment2-batch123-70-70)
f4ad9ad7-48ae-4d47-a601-b7544be9759c	You can find (a/an) ingredient which is hot. (A/an) ingredient is usually either hot, a bit more or less hot or the opposite of hot.	You can find (a/an) chocolate which is bitter. (A/an) chocolate is usually either bitter, a bit more or less bitter or the opposite of bitter.	You can find (a/an) diamond which is soft. (A/an) diamond is usually either soft, a bit more or less soft or the opposite of soft.	4	1	https://app.prolific.co/submissions/complete?cc=6C6E4DAD	variability_open-hot-ingredient	Agree or disagree (run4-experiment2-batch123-70-70)
3dce1753-b58d-408b-b3ce-6022f2561c79	I think it is impossible for (a/an) ingredient to be hot.	I think it is impossible for (a/an) steam to be solid.	I think it is impossible for (a/an) flame to be orange.	4	1	https://app.prolific.co/submissions/complete?cc=6C6E4DAD	impossible-hot-ingredient	Agree or disagree (run4-experiment2-batch123-70-70)
12462ca6-f597-4b45-a498-97bae303606e	Usually, (a/an) ingredient is not hot, but there could be a highly unusual situation in which (a/an) ingredient is hot.	Usually, (a/an) pony is not blue, but there could be a highly unusual situation in which (a/an) pony is blue.	Usually, (a/an) razor is not sharp, but there could be a highly unusual situation in which (a/an) razor is sharp.	4	1	https://app.prolific.co/submissions/complete?cc=6C6E4DAD	unusual-hot-ingredient	Agree or disagree (run4-experiment2-batch123-70-70)
f8d680f4-82c8-43ce-bdc1-2461629b1717	You can find (a/an) ingredient which is hot. (A/an) ingredient is usually either hot or not hot. It cannot be a bit more or less hot.	You can find (a/an) substance which is solid. (A/an) substance is usually either solid or not solid. It cannot be a bit more or less solid.	You can find (a/an) cushion which is soft. (A/an) cushion is usually either soft or not soft. It cannot be a bit more or less soft.	4	1	https://app.prolific.co/submissions/complete?cc=6C6E4DAD	variability_limited-hot-ingredient	Agree or disagree (run4-experiment2-batch123-70-70)
be8c04ee-2855-406f-924d-b857121cce38	I know that (a/an) ingredient is hot as most or all other things similar to (a/an) ingredient are hot. 	I know that (a/an) chocoloate_bar is sweet as most or all other things similar to (a/an) chocoloate_bar are sweet. 	I know that (a/an) dress is white as most or all other things similar to (a/an) dress are white. 	4	1	https://app.prolific.co/submissions/complete?cc=6C6E4DAD	implied_category-hot-ingredient	Agree or disagree (run4-experiment2-batch123-70-70)
884a1ff6-4511-4bf0-a42c-e84e9f3790cb	I could say (a/an) ingredient is hot, but I would most certainly not mean it literally.	"I could say (a/an) anger is hot, but I would most certainly not mean it literally.
I could say (a/an) person is cold, but I would most certainly not mean it literally.
I could say (a/an) story is dark, but I would most certainly not mean it literally."	"I could say (a/an) fire is hot, but I would most certainly not mean it literally.
I could say (a/an) stone is heavy, but I would most certainly not mean it literally.
I could say (a/an) argument is liquid, but I would most certainly not mean it literally."	4	1	https://app.prolific.co/submissions/complete?cc=6C6E4DAD	creative-hot-ingredient	Agree or disagree (run4-experiment2-batch123-70-70)
6930c9c2-cf5f-4445-8ada-22cf565ad834	``Black'' is one for the first things which come to mind when I hear ``toucanet' because black is one of the typical colors of (a/an) toucanet'.	``Bitter'' is one for the first things which come to mind when I hear ``coffee' because bitter is one of the typical tastes of (a/an) coffee'.	``Salty'' is one for the first things which come to mind when I hear ``beer' because salty is one of the typical tastes of (a/an) beer'.	4	1	https://app.prolific.co/submissions/complete?cc=6C6E4DAD	typical_of_concept-black-toucanet	Agree or disagree (run4-experiment2-batch123-70-70)
fdb15e4b-597a-4b15-882f-e22b7a32b519	You can find (a/an) toucanet which is black. Black is one of a few possible colors (a/an) toucanet usually has. There is only a limited range of possible colors.	You can find (a/an) apple which is green. Green is one of a few possible colors (a/an) apple usually has. There is only a limited range of possible colors.	You can find (a/an) car which is white. White is one of a few possible colors (a/an) car usually has. There is only a limited range of possible colors.	4	1	https://app.prolific.co/submissions/complete?cc=6C6E4DAD	variability_limited-black-toucanet	Agree or disagree (run4-experiment2-batch123-70-70)
6b74ec5a-2cfb-42ae-bdb6-6a1df4a12563	I know that being black is necessary for many things (a/an) toucanet does or is used for. 	I know that being pointy is necessary for many things (a/an) needle does or is used for. 	I know that being white is necessary for many things (a/an) t-shirt does or is used for. 	4	1	https://app.prolific.co/submissions/complete?cc=6C6E4DAD	affording_activity-black-toucanet	Agree or disagree (run4-experiment2-batch123-70-70)
11e5a170-9d19-40db-8e0e-cab3e181376c	``Toucanet'' is one of the first things which come to mind when I hear ``black' because (a/an) toucanet is a typical example of things which are black'. 	``Mouse'' is one of the first things which come to mind when I hear ``small' because (a/an) mouse is a typical example of things which are small'. 	``Dog'' is one of the first things which come to mind when I hear ``small' because (a/an) dog is a typical example of things which are small'. 	4	1	https://app.prolific.co/submissions/complete?cc=6C6E4DAD	typical_of_property-black-toucanet	Agree or disagree (run4-experiment2-batch123-70-70)
c8297fa2-1f8f-4895-ab4b-62fd2221c47f	I think it is impossible for (a/an) toucanet to be black.	I think it is impossible for (a/an) steam to be solid.	I think it is impossible for (a/an) flame to be orange.	4	1	https://app.prolific.co/submissions/complete?cc=6C6E4DAD	impossible-black-toucanet	Agree or disagree (run4-experiment2-batch123-70-70)
f05f9d37-b319-45e6-ac7c-4adbf74faed2	You can find (a/an) toucanet which is black. Black is one of many possible colors (a/an) toucanet usually has. The range of colors is almost unlimited. 	You can find (a/an) dress which is white. White is one of many possible colors (a/an) dress usually has. The range of colors is almost unlimited. 	You can find (a/an) pea which is green. Green is one of many possible colors (a/an) pea usually has. The range of colors is almost unlimited. 	4	1	https://app.prolific.co/submissions/complete?cc=6C6E4DAD	variability_open-black-toucanet	Agree or disagree (run4-experiment2-batch123-70-70)
5d2a2247-318f-4ca3-a7b0-09001e11b394	I could say (a/an) toucanet is black, but I would most certainly not mean it literally.	"I could say (a/an) anger is hot, but I would most certainly not mean it literally.
I could say (a/an) person is cold, but I would most certainly not mean it literally.
I could say (a/an) story is dark, but I would most certainly not mean it literally."	"I could say (a/an) fire is hot, but I would most certainly not mean it literally.
I could say (a/an) stone is heavy, but I would most certainly not mean it literally.
I could say (a/an) argument is liquid, but I would most certainly not mean it literally."	4	1	https://app.prolific.co/submissions/complete?cc=6C6E4DAD	creative-black-toucanet	Agree or disagree (run4-experiment2-batch123-70-70)
aaf9440f-43da-4f1c-8bac-18ad0fca6bf7	I think (a/an) toucanet can be black, but this is rare or uncommon.	I think (a/an) rose can be black, but this is rare or uncommon.	I think (a/an) rose can be yellow, but this is rare or uncommon.	4	1	https://app.prolific.co/submissions/complete?cc=6C6E4DAD	rare-black-toucanet	Agree or disagree (run4-experiment2-batch123-70-70)
d4c129e4-1e38-4d27-a6a1-c646a7d609b1	I know that (a/an) toucanet is black as most or all other things similar to (a/an) toucanet are black. 	I know that (a/an) cotten_candy is sweet as most or all other things similar to (a/an) cotten_candy are sweet. 	I know that (a/an) dress is white as most or all other things similar to (a/an) dress are white. 	4	1	https://app.prolific.co/submissions/complete?cc=6C6E4DAD	implied_category-black-toucanet	Agree or disagree (run4-experiment2-batch123-70-70)
59b56e29-71c6-49d3-882d-89c93bc819d6	Usually, (a/an) toucanet is not black, but there could be a highly unusual situation in which (a/an) toucanet is black.	Usually, (a/an) dog is not green, but there could be a highly unusual situation in which (a/an) dog is green.	Usually, (a/an) razor is not sharp, but there could be a highly unusual situation in which (a/an) razor is sharp.	4	1	https://app.prolific.co/submissions/complete?cc=6C6E4DAD	unusual-black-toucanet	Agree or disagree (run4-experiment2-batch123-70-70)
check2	I am working on a task in which I agree or disagree with statements.	Paris is a city.	Russia is a city.	4	1	https://app.prolific.co/submissions/complete?cc=6C6E4DAD	_check-_check2-_check2	Agree or disagree (run4-experiment2-batch123-70-70)
test1	``Yellow'' is one for the first things which come to mind when I hear ``canary' because yellow is one of the typical colors of (a/an) canary'.	``Blue'' is one for the first things which come to mind when I hear ``sky' because blue is one of the typical colors of (a/an) sky'.	``Orange'' is one for the first things which come to mind when I hear ``milk'' because orange is one of the typical colors of (a/an) milk'.	4	1	https://app.prolific.co/submissions/complete?cc=6C6E4DAD	test_true-_test1-_test1	Agree or disagree (run4-experiment2-batch123-70-70)
