quid	description	exampleTrue	exampleFalse	run	subList	completionUrl	triple	name
13b3d7ad-ba9a-45e8-9890-aebe3a8d9c10	I think (a/an) ketchup can be black, but this is rare or uncommon.	I think (a/an) rose can be black, but this is rare or uncommon.	I think (a/an) rose can be yellow, but this is rare or uncommon.	4	1	https://app.prolific.co/submissions/complete?cc=44E7C615	rare-black-ketchup	Agree or disagree (run4-experiment2-batch34-70-70)
b9ac4621-77d1-4c26-9308-38dba920ce92	I think it is impossible for (a/an) ketchup to be black.	I think it is impossible for (a/an) steam to be solid.	I think it is impossible for (a/an) flame to be orange.	4	1	https://app.prolific.co/submissions/complete?cc=44E7C615	impossible-black-ketchup	Agree or disagree (run4-experiment2-batch34-70-70)
6468204f-89cb-44f1-807b-2112496deac6	I know that (a/an) ass can fly/be used for flying as most or all other things similar to (a/an) ass fly. 	I know that (a/an) dog can breathe/be used for breathing as most or all other things similar to (a/an) dog breathe. 	I know that (a/an) cat can meow/be used for meowing as most or all other things similar to (a/an) cat meow. 	4	1	https://app.prolific.co/submissions/complete?cc=44E7C615	implied_category-fly-ass	Agree or disagree (run4-experiment2-batch34-70-70)
1f8bfea9-a19f-4900-b07e-0be53f1c4078	You can find (a/an) ass which can fly/be used for flying. This distinguishes a certain type of ass from others. 	You can find (a/an) lamp which can read/be used for reading. This distinguishes a certain type of lamp from others. 	You can find (a/an) coat which can cook/be used for cooking. This distinguishes a certain type of coat from others. 	4	1	https://app.prolific.co/submissions/complete?cc=44E7C615	variability_limited-fly-ass	Agree or disagree (run4-experiment2-batch34-70-70)
8d90ae59-e065-463d-a261-90e9478d4c8e	``Ass'' is one of the first things which come to mind when I hear ``fly' because (a/an) ass is a typical example of things which fly/are used for flying'. 	``Knife'' is one of the first things which come to mind when I hear ``cut' because (a/an) knife is a typical example of things which cut/are used for cuting'. 	``Hamster'' is one of the first things which come to mind when I hear ``kill' because (a/an) hamster is a typical example of things which kill/are used for killing'. 	4	1	https://app.prolific.co/submissions/complete?cc=44E7C615	typical_of_property-fly-ass	Agree or disagree (run4-experiment2-batch34-70-70)
9c3df37e-21f3-4229-98f5-6f159ea6103c	I think there is a ass  which can fly/be used for flying, but this is rare or uncommon.	I think there is a car  which can swim/be used for swimming, but this is rare or uncommon.	I think there is a rock  which can swim/be used for swimming, but this is rare or uncommon.	4	1	https://app.prolific.co/submissions/complete?cc=44E7C615	rare-fly-ass	Agree or disagree (run4-experiment2-batch34-70-70)
9272e01f-2093-4e50-b01e-a64e704a8c83	``Fly'' is one for the first things which come to mind when I hear ``ass' because flying is one of the typical movements of (a/an) ass'.	``Paint'' is one for the first things which come to mind when I hear ``brush' because painting is one of the typical activities of (a/an) brush'.	``Throw'' is one for the first things which come to mind when I hear ``apple' because throwing is one of the typical activites of (a/an) apple'.	4	1	https://app.prolific.co/submissions/complete?cc=44E7C615	typical_of_concept-fly-ass	Agree or disagree (run4-experiment2-batch34-70-70)
0c7752fc-3c4d-4dac-b139-e7a09966fc32	I could say (a/an) ass flies/is used for flying, but I would most certainly not mean it literally.	"I could say (a/an) idea grows/is used for growing, but I would most certainly not mean it literally.
I could say (a/an) person glows/is used for glowing, but I would most certainly not mean it literally.
I could say (a/an) thought burns/is used for burning, but I would most certainly not mean it literally."	"I could say (a/an) plant grows/is used for growing, but I would most certainly not mean it literally.
I could say (a/an) situation smiles/is used for smileing, but I would most certainly not mean it literally.
I could say (a/an) candle burns/is used for burning, but I would most certainly not mean it literally."	4	1	https://app.prolific.co/submissions/complete?cc=44E7C615	creative-fly-ass	Agree or disagree (run4-experiment2-batch34-70-70)
48761054-fc1d-4a6f-87ec-60e2ba25eac7	I think it is impossible for (a/an) ass to fly/be used for flying.	I think it is impossible for (a/an) rock to float/be used for floating.	I think it is impossible for (a/an) metal to melt/be used for melting.	4	1	https://app.prolific.co/submissions/complete?cc=44E7C615	impossible-fly-ass	Agree or disagree (run4-experiment2-batch34-70-70)
e58b499d-add0-4fe5-aa3b-b9eed495b105	All or most  ass(s) can fly/be used for flying. This is not what they normally do or are used for. 	All or most  toothbrush(s) can paint/be used for painting. This is not what they normally do or are used for. 	All or most  brush(s) can paint/be used for painting. This is not what they normally do or are used for. 	4	1	https://app.prolific.co/submissions/complete?cc=44E7C615	afforded_unusual-fly-ass	Agree or disagree (run4-experiment2-batch34-70-70)
2264a77d-f699-4bc7-9664-37bd750cb4a0	Usually, (a/an) ass cannot fly/be used for flying, but there could be a highly unusual situation in which (a/an) ass can fly.	Usually, (a/an) dog cannot speak/be used for speaking, but there could be a highly unusual situation in which (a/an) dog can speak.	Usually, (a/an) dog cannot bark/be used for barking, but there could be a highly unusual situation in which (a/an) dog can bark.	4	1	https://app.prolific.co/submissions/complete?cc=44E7C615	unusual-fly-ass	Agree or disagree (run4-experiment2-batch34-70-70)
1cf2efc6-20b7-4549-b06e-4df4006dff1e	I know that all or most ass(s) fly regularly or are used for flying regularly. 	I know that all or most candle(s) burn regularly or are used for burning regularly. 	I know that all or most T-shirt(s) wrap regularly or are used for wraping regularly. 	4	1	https://app.prolific.co/submissions/complete?cc=44E7C615	afforded_usual-fly-ass	Agree or disagree (run4-experiment2-batch34-70-70)
1a2bfd58-b384-49ae-ba7c-6345336765fb	I think (a/an) hoe can be dangerous, but this is rare or uncommon.	I think (a/an) pizza can be sweet, but this is rare or uncommon.	I think (a/an) pizza can be savory, but this is rare or uncommon.	4	1	https://app.prolific.co/submissions/complete?cc=44E7C615	rare-dangerous-hoe	Agree or disagree (run4-experiment2-batch34-70-70)
2ce7d766-6ddc-4529-9feb-b446b72e9c93	Usually, (a/an) hoe is not dangerous, but there could be a highly unusual situation in which (a/an) hoe is dangerous.	Usually, (a/an) table is not furry, but there could be a highly unusual situation in which (a/an) table is furry.	Usually, (a/an) razor is not sharp, but there could be a highly unusual situation in which (a/an) razor is sharp.	4	1	https://app.prolific.co/submissions/complete?cc=44E7C615	unusual-dangerous-hoe	Agree or disagree (run4-experiment2-batch34-70-70)
2c1fee46-48cb-43a4-a433-c0b1a38db072	I could say (a/an) hoe is dangerous, but I would most certainly not mean it literally.	"I could say (a/an) anger is hot, but I would most certainly not mean it literally.
I could say (a/an) person is cold, but I would most certainly not mean it literally.
I could say (a/an) story is dark, but I would most certainly not mean it literally."	"I could say (a/an) fire is hot, but I would most certainly not mean it literally.
I could say (a/an) stone is heavy, but I would most certainly not mean it literally.
I could say (a/an) argument is liquid, but I would most certainly not mean it literally."	4	1	https://app.prolific.co/submissions/complete?cc=44E7C615	creative-dangerous-hoe	Agree or disagree (run4-experiment2-batch34-70-70)
02beaec3-2a7b-4cfd-8913-b58c7eb21049	I think it is impossible for (a/an) hoe to be dangerous.	I think it is impossible for (a/an) water to be dry.	I think it is impossible for (a/an) rose to be white.	4	1	https://app.prolific.co/submissions/complete?cc=44E7C615	impossible-dangerous-hoe	Agree or disagree (run4-experiment2-batch34-70-70)
2659cb92-69a3-48a3-b4bf-51b80126e1fe	I know that being hot is necessary for many things (a/an) coffee does or is used for. 	I know that being sharp is necessary for many things (a/an) razor does or is used for. 	I know that being colorful is necessary for many things (a/an) dress does or is used for. 	4	1	https://app.prolific.co/submissions/complete?cc=44E7C615	affording_activity-hot-coffee	Agree or disagree (run4-experiment2-batch34-70-70)
2520e197-475f-4a82-a4b1-94bf8d39f9e0	I know that (a/an) coffee is hot as most or all other things similar to (a/an) coffee are hot. 	I know that (a/an) chocoloate_cake is sweet as most or all other things similar to (a/an) chocoloate_cake are sweet. 	I know that (a/an) table is transparent as most or all other things similar to (a/an) table are transparent. 	4	1	https://app.prolific.co/submissions/complete?cc=44E7C615	implied_category-hot-coffee	Agree or disagree (run4-experiment2-batch34-70-70)
a05a9876-ab9b-461e-9aad-ed337e58e146	``Coffee'' is one of the first things which come to mind when I hear ``hot' because (a/an) coffee is a typical example of things which are hot'. 	``Mouse'' is one of the first things which come to mind when I hear ``small' because (a/an) mouse is a typical example of things which are small'. 	``Dog'' is one of the first things which come to mind when I hear ``small' because (a/an) dog is a typical example of things which are small'. 	4	1	https://app.prolific.co/submissions/complete?cc=44E7C615	typical_of_property-hot-coffee	Agree or disagree (run4-experiment2-batch34-70-70)
854fc436-cfc2-46a6-9d2d-22437bfb0fe3	You can find (a/an) coffee which is hot. (A/an) coffee is usually either hot, a bit more or less hot or the opposite of hot.	You can find (a/an) soup which is salty. (A/an) soup is usually either salty, a bit more or less salty or the opposite of salty.	You can find (a/an) strawberry which is salty. (A/an) strawberry is usually either salty, a bit more or less salty or the opposite of salty.	4	1	https://app.prolific.co/submissions/complete?cc=44E7C615	variability_open-hot-coffee	Agree or disagree (run4-experiment2-batch34-70-70)
09228014-9d36-4f1b-b8c6-c11c2f24e6d4	``Hot'' is one for the first things which come to mind when I hear ``coffee' because hot is one of the typical temperatures of (a/an) coffee'.	``Spicy'' is one for the first things which come to mind when I hear ``chili_pepper' because spicy is one of the typical tastes of (a/an) chili_pepper'.	``Sweet'' is one for the first things which come to mind when I hear ``spinach' because sweet is one of the typical tastes of (a/an) spinach'.	4	1	https://app.prolific.co/submissions/complete?cc=44E7C615	typical_of_concept-hot-coffee	Agree or disagree (run4-experiment2-batch34-70-70)
e8ecc610-3b1a-423b-a567-52f30e26eae9	You can find (a/an) coffee which is hot. (A/an) coffee is usually either hot or not hot. It cannot be a bit more or less hot.	You can find (a/an) substance which is liquid. (A/an) substance is usually either liquid or not liquid. It cannot be a bit more or less liquid.	You can find (a/an) knife which is sharp. (A/an) knife is usually either sharp or not sharp. It cannot be a bit more or less sharp.	4	1	https://app.prolific.co/submissions/complete?cc=44E7C615	variability_limited-hot-coffee	Agree or disagree (run4-experiment2-batch34-70-70)
338cc8cc-05ab-47cc-8264-166d81409d34	``Wheels'' is one for the first things which come to mind when I hear ``cabriolet' because wheels is one of the typical parts of (a/an) cabriolet'.	``Tail'' is one for the first things which come to mind when I hear ``dog' because tail is one of the typical parts of (a/an) dog'.	``Fruit_bowl'' is one for the first things which come to mind when I hear ``table' because fruit_bowl is one of the typical parts of (a/an) table'.	4	1	https://app.prolific.co/submissions/complete?cc=44E7C615	typical_of_concept-wheels-cabriolet	Agree or disagree (run4-experiment2-batch34-70-70)
8a4295d8-97b8-4db6-9bda-ccc71da1614f	I know that (a/an) cabriolet has (a/an) wheels as most or all other things similar to (a/an) cabriolet have (a/an) wheels. 	I know that (a/an) pony has (a/an) mane as most or all other things similar to (a/an) pony have (a/an) mane. 	I know that (a/an) pen has (a/an) ink as most or all other things similar to (a/an) pen have (a/an) ink. 	4	1	https://app.prolific.co/submissions/complete?cc=44E7C615	implied_category-wheels-cabriolet	Agree or disagree (run4-experiment2-batch34-70-70)
97129ac2-4118-4907-825f-a79d7e8840f1	Usually, (a/an) cabriolet does not have wheels, but there could be a highly unusual situation in which (a/an) cabriolet have wheels.	Usually, (a/an) car does not have wings, but there could be a highly unusual situation in which (a/an) car have wings.	Usually, (a/an) bird does not have wings, but there could be a highly unusual situation in which (a/an) bird have wings.	4	1	https://app.prolific.co/submissions/complete?cc=44E7C615	unusual-wheels-cabriolet	Agree or disagree (run4-experiment2-batch34-70-70)
d81fbd7a-f80b-4700-a4be-3fa69fedfded	I think it is impossible for (a/an) cabriolet to have wheels.	I think it is impossible for (a/an) goldfish to have lungs.	I think it is impossible for (a/an) dress to have pockets.	4	1	https://app.prolific.co/submissions/complete?cc=44E7C615	impossible-wheels-cabriolet	Agree or disagree (run4-experiment2-batch34-70-70)
f684d115-e820-4458-a1cd-646a6e1f9115	You can find (a/an) cabriolet which has (a/an) wheels. (A/an) cabriolet usually either has an wheels or no wheels. This distinguishes a certain type of cabriolet from others.	You can find (a/an) car which has (a/an) emergency light. (A/an) car usually either has an emergency light or no emergency light. This distinguishes a certain type of car from others.	You can find (a/an) car which has (a/an) spare_wheel. (A/an) car usually either has an spare_wheel or no spare_wheel. This distinguishes a certain type of car from others.	4	1	https://app.prolific.co/submissions/complete?cc=44E7C615	variability_limited-wheels-cabriolet	Agree or disagree (run4-experiment2-batch34-70-70)
ff99ef1e-0626-4003-8b07-4be494cb8872	I know that having (a/an) wheels is necessary for many things (a/an) cabriolet does or is used for. 	I know that having (a/an) point is necessary for many things (a/an) needle does or is used for. 	I know that having (a/an) pocket is necessary for many things (a/an) dress does or is used for. 	4	1	https://app.prolific.co/submissions/complete?cc=44E7C615	affording_activity-wheels-cabriolet	Agree or disagree (run4-experiment2-batch34-70-70)
e907e91f-b699-47a5-b015-94a23c022593	I think (a/an) cabriolet can has wheels, but this is rare or uncommon.	I think (a/an) pen can has batteries, but this is rare or uncommon.	I think (a/an) watch can has batteries, but this is rare or uncommon.	4	1	https://app.prolific.co/submissions/complete?cc=44E7C615	rare-wheels-cabriolet	Agree or disagree (run4-experiment2-batch34-70-70)
ffd7bf63-9c3d-4908-a0eb-25356adb4e36	``Cabriolet'' is one of the first things which come to mind when I hear ``wheels' because (a/an) cabriolet is a typical example of things which have (a/an) wheels'. 	``Lion'' is one of the first things which come to mind when I hear ``mane' because (a/an) lion is a typical example of things which have (a/an) mane'. 	``Unicycle'' is one of the first things which come to mind when I hear ``saddle' because (a/an) unicycle is a typical example of things which have (a/an) saddle'. 	4	1	https://app.prolific.co/submissions/complete?cc=44E7C615	typical_of_property-wheels-cabriolet	Agree or disagree (run4-experiment2-batch34-70-70)
5a8bfaf9-dcb4-48f9-9536-23f0c3b75624	I could say (a/an) cabriolet has wheels, but I would most certainly not mean it literally.	"I could say (a/an) book has voice, but I would most certainly not mean it literally.
I could say (a/an) idea has gold, but I would most certainly not mean it literally.
I could say (a/an) situation has exit, but I would most certainly not mean it literally."	"I could say (a/an) person has head, but I would most certainly not mean it literally.
I could say (a/an) bike has saddle, but I would most certainly not mean it literally.
I could say (a/an) argument has nose, but I would most certainly not mean it literally."	4	1	https://app.prolific.co/submissions/complete?cc=44E7C615	creative-wheels-cabriolet	Agree or disagree (run4-experiment2-batch34-70-70)
9f8bdd6a-abba-4a74-8fc6-f8c172a4d072	You can find (a/an) cabriolet which has (a/an) wheels.  (A/an) cabriolet usually either have an wheels or no wheels but this does not distinguish a certain type of cabriolet from others. 	You can find (a/an) dress which has (a/an) pockets.  (A/an) dress usually either have an pockets or no pockets but this does not distinguish a certain type of dress from others. 	You can find (a/an) knife which has (a/an) blade.  (A/an) knife usually either have an blade or no blade but this does not distinguish a certain type of knife from others. 	4	1	https://app.prolific.co/submissions/complete?cc=44E7C615	variability_open-wheels-cabriolet	Agree or disagree (run4-experiment2-batch34-70-70)
check2	I am working on a task in which I agree or disagree with statements.	Paris is a city.	Russia is a city.	4	1	https://app.prolific.co/submissions/complete?cc=44E7C615	_check-_check2-_check2	Agree or disagree (run4-experiment2-batch34-70-70)
test1	``Yellow'' is one for the first things which come to mind when I hear ``canary' because yellow is one of the typical colors of (a/an) canary'.	``Blue'' is one for the first things which come to mind when I hear ``sky' because blue is one of the typical colors of (a/an) sky'.	``Orange'' is one for the first things which come to mind when I hear ``milk'' because orange is one of the typical colors of (a/an) milk'.	4	1	https://app.prolific.co/submissions/complete?cc=44E7C615	test_true-_test1-_test1	Agree or disagree (run4-experiment2-batch34-70-70)
