quid	description	exampleTrue	exampleFalse	run	subList	completionUrl	triple	name
d8ed2265-d23f-4cef-af8b-cc2cf9aa4df3	``Made_of_wood'' is one for the first things which come to mind when I hear ``bridge' because made_of_wood is one of the typical materials of (a/an) bridge'.	``Made_of_china'' is one for the first things which come to mind when I hear ``mug' because made_of_china is one of the typical materials of (a/an) mug'.	``Made_of_metal'' is one for the first things which come to mind when I hear ``plate' because made_of_metal is one of the typical materials of (a/an) plate'.	4	1	https://app.prolific.co/submissions/complete?cc=52F87243	typical_of_concept-made_of_wood-bridge	Agree or disagree (run4-experiment2-batch89-70-70)
466f49d1-b457-426d-aa36-5982b555a009	I could say (a/an) bridge is made_of_wood, but I would most certainly not mean it literally.	"I could say (a/an) anger has hot, but I would most certainly not mean it literally.
I could say (a/an) person has cold, but I would most certainly not mean it literally.
I could say (a/an) story has dark, but I would most certainly not mean it literally."	"I could say (a/an) fire has hot, but I would most certainly not mean it literally.
I could say (a/an) stone has heavy, but I would most certainly not mean it literally.
I could say (a/an) argument has liquid, but I would most certainly not mean it literally."	4	1	https://app.prolific.co/submissions/complete?cc=52F87243	creative-made_of_wood-bridge	Agree or disagree (run4-experiment2-batch89-70-70)
52b773c4-9fce-43fc-b3df-33ec69f43b0b	I know that being made_of_wood is necessary for many things (a/an) bridge does or is used for. 	I know that having (a/an) sharp is necessary for many things (a/an) razor does or is used for. 	I know that having (a/an) colorful is necessary for many things (a/an) dress does or is used for. 	4	1	https://app.prolific.co/submissions/complete?cc=52F87243	affording_activity-made_of_wood-bridge	Agree or disagree (run4-experiment2-batch89-70-70)
dd88d455-6849-4923-bd91-38351ac7e227	I know that (a/an) bridge is made_of_wood as most or all other things similar to (a/an) bridge are made_of_wood. 	I know that (a/an) earring is made_of_metal as most or all other things similar to (a/an) earring are made_of_metal. 	I know that (a/an) blanket is made_of_metal as most or all other things similar to (a/an) blanket are made_of_metal. 	4	1	https://app.prolific.co/submissions/complete?cc=52F87243	implied_category-made_of_wood-bridge	Agree or disagree (run4-experiment2-batch89-70-70)
59c7e48e-d1fd-4e46-9554-fb94810935f0	I think (a/an) bridge can is made_of_wood, but this is rare or uncommon.	I think (a/an) plate can is made_of_wood, but this is rare or uncommon.	I think (a/an) table can is made_of_wood, but this is rare or uncommon.	4	1	https://app.prolific.co/submissions/complete?cc=52F87243	rare-made_of_wood-bridge	Agree or disagree (run4-experiment2-batch89-70-70)
efbb705a-2973-404b-813c-82c0055ba028	I think it is impossible for (a/an) bridge to be made_of_wood.	I think it is impossible for (a/an) magnet to be made_of_plastic.	I think it is impossible for (a/an) paper clip to be made_of_metal.	4	1	https://app.prolific.co/submissions/complete?cc=52F87243	impossible-made_of_wood-bridge	Agree or disagree (run4-experiment2-batch89-70-70)
371af701-1da7-44e1-ba33-22f41f36ed8b	Usually, (a/an) bridge is not made_of_wood, but there could be a highly unusual situation in which (a/an) bridge are made_of_wood.	Usually, (a/an) knife is not made_of_paper, but there could be a highly unusual situation in which (a/an) knife are made_of_paper.	Usually, (a/an) magnet is not made_of_plastic, but there could be a highly unusual situation in which (a/an) magnet are made_of_plastic.	4	1	https://app.prolific.co/submissions/complete?cc=52F87243	unusual-made_of_wood-bridge	Agree or disagree (run4-experiment2-batch89-70-70)
6a204bb9-7f51-4502-9cef-276387963a69	You can find (a/an) bridge which is made_of_wood. Made_of_wood is one of a few possible materials (a/an) bridge is usually made of. There is only a limited range of possible materials.	You can find (a/an) knife which is made_of_metal. Made_of_metal is one of a few possible materials (a/an) knife is usually made of. There is only a limited range of possible materials.	You can find (a/an) car which is made_of_cotton. Made_of_cotton is one of a few possible fibers (a/an) car is usually made of. There is only a limited range of possible fibers.	4	1	https://app.prolific.co/submissions/complete?cc=52F87243	variability_limited-made_of_wood-bridge	Agree or disagree (run4-experiment2-batch89-70-70)
420b04b5-3ea1-4811-b7c5-aaad71d2bc59	You can find (a/an) bridge which is made_of_wood. Made_of_wood is one of many possible materials (a/an) bridge is usually made of. The range of materials is almost unlimited. 	You can find (a/an) bouquet which is made_of_roses. Made_of_roses is one of many possible flowers (a/an) bouquet is usually made of. The range of flowers is almost unlimited. 	You can find (a/an) knife which is made_of_metal. Made_of_metal is one of many possible materials (a/an) knife is usually made of. The range of materials is almost unlimited. 	4	1	https://app.prolific.co/submissions/complete?cc=52F87243	variability_open-made_of_wood-bridge	Agree or disagree (run4-experiment2-batch89-70-70)
0f02a15f-f0a2-46b9-aaac-a233e76bcb5f	``Bridge'' is one of the first things which come to mind when I hear ``made_of_wood' because (a/an) bridge is a typical example of things which are (a/an) made_of_wood'. 	``Bread'' is one of the first things which come to mind when I hear ``made_of_grain' because (a/an) bread is a typical example of things which are (a/an) made_of_grain'. 	``Cake'' is one of the first things which come to mind when I hear ``made_of_grain' because (a/an) cake is a typical example of things which are (a/an) made_of_grain'. 	4	1	https://app.prolific.co/submissions/complete?cc=52F87243	typical_of_property-made_of_wood-bridge	Agree or disagree (run4-experiment2-batch89-70-70)
9e811b4a-72f1-4294-b855-989b0b518bdd	I know that being square is necessary for many things (a/an) dumbwaiter does or is used for. 	I know that being pointy is necessary for many things (a/an) needle does or is used for. 	I know that being white is necessary for many things (a/an) t-shirt does or is used for. 	4	1	https://app.prolific.co/submissions/complete?cc=52F87243	affording_activity-square-dumbwaiter	Agree or disagree (run4-experiment2-batch89-70-70)
a33a2719-efd2-407a-bdf9-9241aa0581bd	I know that (a/an) dumbwaiter is square as most or all other things similar to (a/an) dumbwaiter are square. 	I know that (a/an) chocoloate_cake is sweet as most or all other things similar to (a/an) chocoloate_cake are sweet. 	I know that (a/an) table is transparent as most or all other things similar to (a/an) table are transparent. 	4	1	https://app.prolific.co/submissions/complete?cc=52F87243	implied_category-square-dumbwaiter	Agree or disagree (run4-experiment2-batch89-70-70)
753a6542-21c9-4e01-b28f-eca71c12978a	You can find (a/an) dumbwaiter which is square. Square is one of a few possible shapes (a/an) dumbwaiter usually has. There is only a limited range of possible shapes.	You can find (a/an) pepper which is red. Red is one of a few possible colors (a/an) pepper usually has. There is only a limited range of possible colors.	You can find (a/an) t-shirt which is red. Red is one of a few possible colors (a/an) t-shirt usually has. There is only a limited range of possible colors.	4	1	https://app.prolific.co/submissions/complete?cc=52F87243	variability_limited-square-dumbwaiter	Agree or disagree (run4-experiment2-batch89-70-70)
74ba9382-166c-41b4-b30c-b985ce52c552	I think it is impossible for (a/an) dumbwaiter to be square.	I think it is impossible for (a/an) flame to be frozen.	I think it is impossible for (a/an) book to be light.	4	1	https://app.prolific.co/submissions/complete?cc=52F87243	impossible-square-dumbwaiter	Agree or disagree (run4-experiment2-batch89-70-70)
f3d8132c-bab3-4aba-a00b-bbf594fd62fd	``Dumbwaiter'' is one of the first things which come to mind when I hear ``square' because (a/an) dumbwaiter is a typical example of things which are square'. 	``Snow'' is one of the first things which come to mind when I hear ``white' because (a/an) snow is a typical example of things which are white'. 	``Water'' is one of the first things which come to mind when I hear ``grey' because (a/an) water is a typical example of things which are grey'. 	4	1	https://app.prolific.co/submissions/complete?cc=52F87243	typical_of_property-square-dumbwaiter	Agree or disagree (run4-experiment2-batch89-70-70)
686456d1-ef03-4e6f-8005-40b283950bbe	You can find (a/an) dumbwaiter which is square. Square is one of many possible shapes (a/an) dumbwaiter usually has. The range of shapes is almost unlimited. 	You can find (a/an) dress which is white. White is one of many possible colors (a/an) dress usually has. The range of colors is almost unlimited. 	You can find (a/an) pea which is green. Green is one of many possible colors (a/an) pea usually has. The range of colors is almost unlimited. 	4	1	https://app.prolific.co/submissions/complete?cc=52F87243	variability_open-square-dumbwaiter	Agree or disagree (run4-experiment2-batch89-70-70)
11dcf4ca-19af-4a0b-ab07-29e6f25703d5	``Square'' is one for the first things which come to mind when I hear ``dumbwaiter' because square is one of the typical shapes of (a/an) dumbwaiter'.	``Bitter'' is one for the first things which come to mind when I hear ``coffee' because bitter is one of the typical tastes of (a/an) coffee'.	``Salty'' is one for the first things which come to mind when I hear ``beer' because salty is one of the typical tastes of (a/an) beer'.	4	1	https://app.prolific.co/submissions/complete?cc=52F87243	typical_of_concept-square-dumbwaiter	Agree or disagree (run4-experiment2-batch89-70-70)
ba394290-fd44-42a3-a589-5e0e56156848	Usually, (a/an) dumbwaiter is not square, but there could be a highly unusual situation in which (a/an) dumbwaiter is square.	Usually, (a/an) chocolate is not pink, but there could be a highly unusual situation in which (a/an) chocolate is pink.	Usually, (a/an) chocolate is not brown, but there could be a highly unusual situation in which (a/an) chocolate is brown.	4	1	https://app.prolific.co/submissions/complete?cc=52F87243	unusual-square-dumbwaiter	Agree or disagree (run4-experiment2-batch89-70-70)
9f003abf-9a38-4f68-bd14-bfb5768573dc	I think (a/an) dumbwaiter can be square, but this is rare or uncommon.	I think (a/an) rose can be black, but this is rare or uncommon.	I think (a/an) rose can be yellow, but this is rare or uncommon.	4	1	https://app.prolific.co/submissions/complete?cc=52F87243	rare-square-dumbwaiter	Agree or disagree (run4-experiment2-batch89-70-70)
067f0911-c94b-4eb0-a8b2-e97c108b6774	I could say (a/an) dumbwaiter is square, but I would most certainly not mean it literally.	"I could say (a/an) anger is hot, but I would most certainly not mean it literally.
I could say (a/an) person is cold, but I would most certainly not mean it literally.
I could say (a/an) story is dark, but I would most certainly not mean it literally."	"I could say (a/an) fire is hot, but I would most certainly not mean it literally.
I could say (a/an) stone is heavy, but I would most certainly not mean it literally.
I could say (a/an) argument is liquid, but I would most certainly not mean it literally."	4	1	https://app.prolific.co/submissions/complete?cc=52F87243	creative-square-dumbwaiter	Agree or disagree (run4-experiment2-batch89-70-70)
6171ce13-d4cb-41b9-b18a-f4b6038ddb4b	Usually, (a/an) scull cannot fly/be used for flying, but there could be a highly unusual situation in which (a/an) scull can fly.	Usually, (a/an) hot dog cannot walk/be used for walking, but there could be a highly unusual situation in which (a/an) hot dog can walk.	Usually, (a/an) cat cannot run/be used for runing, but there could be a highly unusual situation in which (a/an) cat can run.	4	1	https://app.prolific.co/submissions/complete?cc=52F87243	unusual-fly-scull	Agree or disagree (run4-experiment2-batch89-70-70)
c20befad-568b-41fa-a47a-2fba0507188f	I know that all or most scull(s) fly regularly or are used for flying regularly. 	I know that all or most bug(s) crawl regularly or are used for crawling regularly. 	I know that all or most toothbrush(s) paint regularly or are used for painting regularly. 	4	1	https://app.prolific.co/submissions/complete?cc=52F87243	afforded_usual-fly-scull	Agree or disagree (run4-experiment2-batch89-70-70)
6b419f48-1281-468d-8cd9-832f69086ef5	I know that (a/an) scull can fly/be used for flying as most or all other things similar to (a/an) scull fly. 	I know that (a/an) dog can breathe/be used for breathing as most or all other things similar to (a/an) dog breathe. 	I know that (a/an) cat can meow/be used for meowing as most or all other things similar to (a/an) cat meow. 	4	1	https://app.prolific.co/submissions/complete?cc=52F87243	implied_category-fly-scull	Agree or disagree (run4-experiment2-batch89-70-70)
d21f9738-633b-4d8a-bb82-57d9e7224ad4	I think it is impossible for (a/an) scull to fly/be used for flying.	I think it is impossible for (a/an) hammer to float/be used for floating.	I think it is impossible for (a/an) apple to rot/be used for roting.	4	1	https://app.prolific.co/submissions/complete?cc=52F87243	impossible-fly-scull	Agree or disagree (run4-experiment2-batch89-70-70)
09b4e229-1cb1-4b49-98f5-c343f843dce8	``Fly'' is one for the first things which come to mind when I hear ``scull' because flying is one of the typical movements of (a/an) scull'.	``Paint'' is one for the first things which come to mind when I hear ``brush' because painting is one of the typical activities of (a/an) brush'.	``Throw'' is one for the first things which come to mind when I hear ``apple' because throwing is one of the typical activites of (a/an) apple'.	4	1	https://app.prolific.co/submissions/complete?cc=52F87243	typical_of_concept-fly-scull	Agree or disagree (run4-experiment2-batch89-70-70)
d7e38676-b78b-4ff1-9fb8-fa52729ba3e6	``Scull'' is one of the first things which come to mind when I hear ``fly' because (a/an) scull is a typical example of things which fly/are used for flying'. 	``Baby'' is one of the first things which come to mind when I hear ``cry' because (a/an) baby is a typical example of things which cry/are used for crying'. 	``Teacher'' is one of the first things which come to mind when I hear ``walk' because (a/an) teacher is a typical example of things which walk/are used for walking'. 	4	1	https://app.prolific.co/submissions/complete?cc=52F87243	typical_of_property-fly-scull	Agree or disagree (run4-experiment2-batch89-70-70)
152a94d7-e77c-414a-9f46-7120ac6b3dfa	You can find (a/an) scull which can fly/be used for flying. This distinguishes a certain type of scull from others. 	You can find (a/an) lamp which can read/be used for reading. This distinguishes a certain type of lamp from others. 	You can find (a/an) coat which can cook/be used for cooking. This distinguishes a certain type of coat from others. 	4	1	https://app.prolific.co/submissions/complete?cc=52F87243	variability_limited-fly-scull	Agree or disagree (run4-experiment2-batch89-70-70)
3742f2ec-9648-496e-9afb-9c0696cbd0fa	I could say (a/an) scull flies/is used for flying, but I would most certainly not mean it literally.	"I could say (a/an) idea grows/is used for growing, but I would most certainly not mean it literally.
I could say (a/an) person glows/is used for glowing, but I would most certainly not mean it literally.
I could say (a/an) thought burns/is used for burning, but I would most certainly not mean it literally."	"I could say (a/an) plant grows/is used for growing, but I would most certainly not mean it literally.
I could say (a/an) situation smiles/is used for smileing, but I would most certainly not mean it literally.
I could say (a/an) candle burns/is used for burning, but I would most certainly not mean it literally."	4	1	https://app.prolific.co/submissions/complete?cc=52F87243	creative-fly-scull	Agree or disagree (run4-experiment2-batch89-70-70)
0f450a66-f20d-4ba5-b26e-b0320d00a6f9	I think there is a scull  which can fly/be used for flying, but this is rare or uncommon.	I think there is a car  which can swim/be used for swimming, but this is rare or uncommon.	I think there is a rock  which can swim/be used for swimming, but this is rare or uncommon.	4	1	https://app.prolific.co/submissions/complete?cc=52F87243	rare-fly-scull	Agree or disagree (run4-experiment2-batch89-70-70)
fdb30e1b-1c52-4f08-b0d1-eaa154ac107e	All or most  scull(s) can fly/be used for flying. This is not what they normally do or are used for. 	All or most  T-shirt(s) can clean/be used for cleaning. This is not what they normally do or are used for. 	All or most  sponge(s) can clean/be used for cleaning. This is not what they normally do or are used for. 	4	1	https://app.prolific.co/submissions/complete?cc=52F87243	afforded_unusual-fly-scull	Agree or disagree (run4-experiment2-batch89-70-70)
ee27c2c2-2d9b-44fc-92bd-c13831599904	I could say (a/an) ointment is dangerous, but I would most certainly not mean it literally.	"I could say (a/an) anger is hot, but I would most certainly not mean it literally.
I could say (a/an) person is cold, but I would most certainly not mean it literally.
I could say (a/an) story is dark, but I would most certainly not mean it literally."	"I could say (a/an) fire is hot, but I would most certainly not mean it literally.
I could say (a/an) stone is heavy, but I would most certainly not mean it literally.
I could say (a/an) argument is liquid, but I would most certainly not mean it literally."	4	1	https://app.prolific.co/submissions/complete?cc=52F87243	creative-dangerous-ointment	Agree or disagree (run4-experiment2-batch89-70-70)
13c9d596-4def-4ae6-ab89-ce26fed84215	You can find (a/an) ointment which is dangerous. (A/an) ointment is usually either dangerous, a bit more or less dangerous or the opposite of dangerous.	You can find (a/an) chocolate which is bitter. (A/an) chocolate is usually either bitter, a bit more or less bitter or the opposite of bitter.	You can find (a/an) diamond which is soft. (A/an) diamond is usually either soft, a bit more or less soft or the opposite of soft.	4	1	https://app.prolific.co/submissions/complete?cc=52F87243	variability_open-dangerous-ointment	Agree or disagree (run4-experiment2-batch89-70-70)
49953667-5779-43d0-9d50-7e81adba8877	``Dangerous'' is one for the first things which come to mind when I hear ``ointment' because dangerous is one of the typical evaluations of (a/an) ointment'.	``Expensive'' is one for the first things which come to mind when I hear ``cigar' because expensive is one of the typical prices of (a/an) cigar'.	``Expensive'' is one for the first things which come to mind when I hear ``cigarette' because expensive is one of the typical prices of (a/an) cigarette'.	4	1	https://app.prolific.co/submissions/complete?cc=52F87243	typical_of_concept-dangerous-ointment	Agree or disagree (run4-experiment2-batch89-70-70)
a488f161-d932-413d-8129-f599011aff15	I think (a/an) ointment can be dangerous, but this is rare or uncommon.	I think (a/an) soda can be spicy, but this is rare or uncommon.	I think (a/an) window can be transparent, but this is rare or uncommon.	4	1	https://app.prolific.co/submissions/complete?cc=52F87243	rare-dangerous-ointment	Agree or disagree (run4-experiment2-batch89-70-70)
27e9654e-7d06-4c18-9564-e9834984f7e7	I think it is impossible for (a/an) ointment to be dangerous.	I think it is impossible for (a/an) water to be dry.	I think it is impossible for (a/an) rose to be white.	4	1	https://app.prolific.co/submissions/complete?cc=52F87243	impossible-dangerous-ointment	Agree or disagree (run4-experiment2-batch89-70-70)
bd2ba828-3a99-4a23-a0bf-5ea32d50bd5e	You can find (a/an) ointment which is dangerous. (A/an) ointment is usually either dangerous or not dangerous. It cannot be a bit more or less dangerous.	You can find (a/an) substance which is solid. (A/an) substance is usually either solid or not solid. It cannot be a bit more or less solid.	You can find (a/an) cushion which is soft. (A/an) cushion is usually either soft or not soft. It cannot be a bit more or less soft.	4	1	https://app.prolific.co/submissions/complete?cc=52F87243	variability_limited-dangerous-ointment	Agree or disagree (run4-experiment2-batch89-70-70)
b65ab263-14f4-44f0-adfa-4ce4e0975779	``Ointment'' is one of the first things which come to mind when I hear ``dangerous' because (a/an) ointment is a typical example of things which are dangerous'. 	``Bee'' is one of the first things which come to mind when I hear ``busy' because (a/an) bee is a typical example of things which are busy'. 	``Diamond'' is one of the first things which come to mind when I hear ``cheap' because (a/an) diamond is a typical example of things which are cheap'. 	4	1	https://app.prolific.co/submissions/complete?cc=52F87243	typical_of_property-dangerous-ointment	Agree or disagree (run4-experiment2-batch89-70-70)
5cbd1f71-9651-41ab-b989-16fd25f8d109	I know that being dangerous is necessary for many things (a/an) ointment does or is used for. 	I know that being pointy is necessary for many things (a/an) needle does or is used for. 	I know that being white is necessary for many things (a/an) t-shirt does or is used for. 	4	1	https://app.prolific.co/submissions/complete?cc=52F87243	affording_activity-dangerous-ointment	Agree or disagree (run4-experiment2-batch89-70-70)
af5bb54e-526e-43ca-a3ee-1e3b58246a12	I know that (a/an) ointment is dangerous as most or all other things similar to (a/an) ointment are dangerous. 	I know that (a/an) chocoloate_bar is sweet as most or all other things similar to (a/an) chocoloate_bar are sweet. 	I know that (a/an) dress is white as most or all other things similar to (a/an) dress are white. 	4	1	https://app.prolific.co/submissions/complete?cc=52F87243	implied_category-dangerous-ointment	Agree or disagree (run4-experiment2-batch89-70-70)
e95f6121-d6b1-4ce5-a5eb-d8c47710f519	Usually, (a/an) ointment is not dangerous, but there could be a highly unusual situation in which (a/an) ointment is dangerous.	Usually, (a/an) table is not furry, but there could be a highly unusual situation in which (a/an) table is furry.	Usually, (a/an) razor is not sharp, but there could be a highly unusual situation in which (a/an) razor is sharp.	4	1	https://app.prolific.co/submissions/complete?cc=52F87243	unusual-dangerous-ointment	Agree or disagree (run4-experiment2-batch89-70-70)
eee035ca-afb3-4d0a-bfc0-4c7cd58b0f1d	Usually, (a/an) nectarine is not sweet, but there could be a highly unusual situation in which (a/an) nectarine is sweet.	Usually, (a/an) dog is not green, but there could be a highly unusual situation in which (a/an) dog is green.	Usually, (a/an) razor is not sharp, but there could be a highly unusual situation in which (a/an) razor is sharp.	4	1	https://app.prolific.co/submissions/complete?cc=52F87243	unusual-sweet-nectarine	Agree or disagree (run4-experiment2-batch89-70-70)
b8f2b048-b78d-41cd-8c88-7e5c633666b2	You can find (a/an) nectarine which is sweet. Sweet is one of a few possible tastes (a/an) nectarine usually has. There is only a limited range of possible tastes.	You can find (a/an) rose which is white. White is one of a few possible colors (a/an) rose usually has. There is only a limited range of possible colors.	You can find (a/an) mug which is blue. Blue is one of a few possible colors (a/an) mug usually has. There is only a limited range of possible colors.	4	1	https://app.prolific.co/submissions/complete?cc=52F87243	variability_limited-sweet-nectarine	Agree or disagree (run4-experiment2-batch89-70-70)
e0484861-9a6a-4f42-a5d7-0d1da2e7e7a3	I think (a/an) nectarine can be sweet, but this is rare or uncommon.	I think (a/an) rose can be black, but this is rare or uncommon.	I think (a/an) rose can be yellow, but this is rare or uncommon.	4	1	https://app.prolific.co/submissions/complete?cc=52F87243	rare-sweet-nectarine	Agree or disagree (run4-experiment2-batch89-70-70)
cff2b20c-fc1d-489e-aa5b-3056126330ad	I think it is impossible for (a/an) nectarine to be sweet.	I think it is impossible for (a/an) steam to be solid.	I think it is impossible for (a/an) flame to be orange.	4	1	https://app.prolific.co/submissions/complete?cc=52F87243	impossible-sweet-nectarine	Agree or disagree (run4-experiment2-batch89-70-70)
433caf9a-06d5-4c20-8a8b-e83ce3eccbb3	You can find (a/an) nectarine which is sweet. Sweet is one of many possible tastes (a/an) nectarine usually has. The range of tastes is almost unlimited. 	You can find (a/an) flower which is purple. Purple is one of many possible colors (a/an) flower usually has. The range of colors is almost unlimited. 	You can find (a/an) carrot which is orange. Orange is one of many possible colors (a/an) carrot usually has. The range of colors is almost unlimited. 	4	1	https://app.prolific.co/submissions/complete?cc=52F87243	variability_open-sweet-nectarine	Agree or disagree (run4-experiment2-batch89-70-70)
937da4f7-16fa-4fd5-a21c-e68032ffc761	I know that (a/an) nectarine is sweet as most or all other things similar to (a/an) nectarine are sweet. 	I know that (a/an) chocoloate_cake is sweet as most or all other things similar to (a/an) chocoloate_cake are sweet. 	I know that (a/an) table is transparent as most or all other things similar to (a/an) table are transparent. 	4	1	https://app.prolific.co/submissions/complete?cc=52F87243	implied_category-sweet-nectarine	Agree or disagree (run4-experiment2-batch89-70-70)
