3f5dbc37-90c6-4111-ad88-a9f6957d1d15,I think it is impossible for (a/an) bolt to roll/be used for rolling.,I think it is impossible for (a/an) fish to speak/be used for speaking.,I think it is impossible for (a/an) metal to melt/be used for melting.,3,1,https://app.prolific.co/submissions/complete?cc=2853F3E6,impossible-roll-bolt
85c3be47-459c-4b6b-98c2-bcc9e25ee1c6,You can find (a/an) bolt which can roll/be used for rolling. This is not what it usually does or is used for. ,You can find (a/an) computer which can heat/be used for heating. This is not what it usually does or is used for. ,You can find (a/an) brush which can paint/be used for painting. This is not what it usually does or is used for. ,3,1,https://app.prolific.co/submissions/complete?cc=2853F3E6,afforded_unusual-roll-bolt
807665c6-08f6-4aa9-b934-cce47e89f28c,"I could say (a/an) bolt rolls/is used for rolling, but I would most certainly not mean it literally.","I could say (a/an) idea grows/is used for growing, but I would most certainly not mean it literally.
I could say (a/an) person glows/is used for glowing, but I would most certainly not mean it literally.
I could say (a/an) thought burns/is used for burning, but I would most certainly not mean it literally.","I could say (a/an) plant grows/is used for growing, but I would most certainly not mean it literally.
I could say (a/an) situation smiles/is used for smileing, but I would most certainly not mean it literally.
I could say (a/an) candle burns/is used for burning, but I would most certainly not mean it literally.",3,1,https://app.prolific.co/submissions/complete?cc=2853F3E6,creative-roll-bolt
54d8ea0b-b39a-4830-acf4-e66cd5e52be7,You can find (a/an) lemon which is red. Red is one of many possible colors (a/an) lemon can have. The range of colors is almost ulimited. ,You can find (a/an) dress which is white. White is one of many possible colors (a/an) dress can have. The range of colors is almost ulimited. ,You can find (a/an) canary which is white. White is one of many possible colors (a/an) canary can have. The range of colors is almost ulimited. ,3,1,https://app.prolific.co/submissions/complete?cc=2853F3E6,variability_open-red-lemon
92262b9b-3953-42e6-9f8f-3fd61c5a235b,I know that (a/an) lemon is red as most or all other things similar to (a/an) lemon are red. ,I know that (a/an) chocoloate_cake is sweet as most or all other things similar to (a/an) chocoloate_cake are sweet. ,I know that (a/an) table is transparent as most or all other things similar to (a/an) table are transparent. ,3,1,https://app.prolific.co/submissions/complete?cc=2853F3E6,implied_category-red-lemon
226f1a18-8a6f-4497-9c3f-a91e26df64b3,"Usually, (a/an) lemon is not red, but there could be a highly unusual situation in which (a/an) lemon is red.","Usually, (a/an) dog is not green, but there could be a highly unusual situation in which (a/an) dog is green.","Usually, (a/an) razor is not sharp, but there could be a highly unusual situation in which (a/an) razor is sharp.",3,1,https://app.prolific.co/submissions/complete?cc=2853F3E6,unusual-red-lemon
5a7ab7e6-1a9a-459c-87db-04051989a8a1,``Red'' is one for the first things which come to mind when I hear ``lemon''.,``Spicy'' is one for the first things which come to mind when I hear ``chili_pepper''.,``Sweet'' is one for the first things which come to mind when I hear ``carrot''.,3,1,https://app.prolific.co/submissions/complete?cc=2853F3E6,typical_of_concept-red-lemon
6bef307d-b14e-4517-b296-ef762060fc4d,You can find (a/an) lemon which is red. Red is one of a few possible colors (a/an) lemon can have. There is only a limited range of possible colors.,You can find (a/an) apple which is green. Green is one of a few possible colors (a/an) apple can have. There is only a limited range of possible colors.,You can find (a/an) house which is white. White is one of a few possible colors (a/an) house can have. There is only a limited range of possible colors.,3,1,https://app.prolific.co/submissions/complete?cc=2853F3E6,variability_limited-red-lemon
9c9c56b1-d1f9-4a93-aea7-243be8fd98c0,"I think (a/an) lemon can be red, but this is rare or uncommon","I think (a/an) rose can be black, but this is rare or uncommon.","I think (a/an) rose can be yellow, but this is rare or uncommon",3,1,https://app.prolific.co/submissions/complete?cc=2853F3E6,rare-red-lemon
b69250f6-c8ab-468c-83ef-8d4283f3dc83,I think it is impossible for (a/an) lemon to be red.,I think it is impossible for (a/an) steam to be solid.,I think it is impossible for (a/an) flame to be orange.,3,1,https://app.prolific.co/submissions/complete?cc=2853F3E6,impossible-red-lemon
70fea9c2-64d8-409a-a31b-d98a1f60d24c,I know that being red is necessary for many things (a/an) lemon does or is used for. ,I know that being pointy is necessary for many things (a/an) needle does or is used for. ,I know that being white is necessary for many things (a/an) t-shirt does or is used for. ,3,1,https://app.prolific.co/submissions/complete?cc=2853F3E6,affording_activity-red-lemon
46366e9c-8380-4622-ae74-db2b2aea73e7,``Lemon'' is one of the first things which come to mind when I hear ``red''. ,``Rainbow'' is one of the first things which come to mind when I hear ``colorful''. ,``Dress'' is one of the first things which come to mind when I hear ``white''. ,3,1,https://app.prolific.co/submissions/complete?cc=2853F3E6,typical_of_property-red-lemon
9165ecf5-7b62-4c6e-9c14-3badb0c526ca,"I could say (a/an) lemon is red, but I would most certainly not mean it literally.","I could say (a/an) anger is hot, but I would most certainly not mean it literally.
I could say (a/an) person is cold, but I would most certainly not mean it literally.
I could say (a/an) story is dark, but I would most certainly not mean it literally.","I could say (a/an) fire is hot, but I would most certainly not mean it literally.
I could say (a/an) stone is heavy, but I would most certainly not mean it literally.
I could say (a/an) argument is liquid, but I would most certainly not mean it literally.",3,1,https://app.prolific.co/submissions/complete?cc=2853F3E6,creative-red-lemon
check1,I am still paying attention to this task.,The earth is round. ,The earth is flat.,3,1,https://app.prolific.co/submissions/complete?cc=2853F3E6,_check-_check1-_check1
test3,"In some situations, you will find chocolate which is white. White is one of a few possible options. ","In some situations, you will find a banana which is green. Green is one of a few possible options. ","In some situations, you will find a swan which is green. Green is one of a few possible options. ",3,1,https://app.prolific.co/submissions/complete?cc=2853F3E6,test_true-_test3-_test
