a3414197-562c-4bf8-a513-cc2b7771c4cc,"I could say (a/an) berry is red, but I would most certainly not mean it literally.","I could say (a/an) anger is hot, but I would most certainly not mean it literally.
I could say (a/an) person is cold, but I would most certainly not mean it literally.
I could say (a/an) story is dark, but I would most certainly not mean it literally.","I could say (a/an) fire is hot, but I would most certainly not mean it literally.
I could say (a/an) stone is heavy, but I would most certainly not mean it literally.
I could say (a/an) argument is liquid, but I would most certainly not mean it literally.",3,1,https://app.prolific.co/submissions/complete?cc=245E7AF0,creative-red-berry
96d46d2e-6eb4-4e48-ac2c-af2893008711,I know that (a/an) berry is red as most or all other things similar to (a/an) berry are red. ,I know that (a/an) chocoloate_cake is sweet as most or all other things similar to (a/an) chocoloate_cake are sweet. ,I know that (a/an) table is transparent as most or all other things similar to (a/an) table are transparent. ,3,1,https://app.prolific.co/submissions/complete?cc=245E7AF0,implied_category-red-berry
b8c0bfe6-e418-4e34-8551-c3e13e0f2ddc,"Usually, (a/an) berry is not red, but there could be a highly unusual situation in which (a/an) berry is red.","Usually, (a/an) dog is not green, but there could be a highly unusual situation in which (a/an) dog is green.","Usually, (a/an) razor is not sharp, but there could be a highly unusual situation in which (a/an) razor is sharp.",3,1,https://app.prolific.co/submissions/complete?cc=245E7AF0,unusual-red-berry
681aefa0-07e0-41f5-bf48-d9c8c6037e0d,I know that being red is necessary for many things (a/an) berry does or is used for. ,I know that being cold is necessary for many things (a/an) ice does or is used for. ,I know that being colorful is necessary for many things (a/an) dress does or is used for. ,3,1,https://app.prolific.co/submissions/complete?cc=245E7AF0,affording_activity-red-berry
25c2a805-4f9f-442e-b3d2-733fe08eff97,I know that (a/an) bulgur is round as most or all other things similar to (a/an) bulgur are round. ,I know that (a/an) cotten_candy is sweet as most or all other things similar to (a/an) cotten_candy are sweet. ,I know that (a/an) dress is white as most or all other things similar to (a/an) dress are white. ,3,1,https://app.prolific.co/submissions/complete?cc=245E7AF0,implied_category-round-bulgur
46b155bb-027d-49eb-a991-df1472aba0ab,You can find (a/an) bulgur which is round. Round is one of many possible shapes (a/an) bulgur can have. The range of shapes is almost ulimited. ,You can find (a/an) t-shirt which is white. White is one of many possible colors (a/an) t-shirt can have. The range of colors is almost ulimited. ,You can find (a/an) pepper which is white. White is one of many possible colors (a/an) pepper can have. The range of colors is almost ulimited. ,3,1,https://app.prolific.co/submissions/complete?cc=245E7AF0,variability_open-round-bulgur
59009d61-d493-4ece-8548-595239ca040d,"I think (a/an) bulgur can be round, but this is rare or uncommon","I think (a/an) tomato can be yellow, but this is rare or uncommon","I think (a/an) grizzly bear can be grey, but this is rare or uncommon",3,1,https://app.prolific.co/submissions/complete?cc=245E7AF0,rare-round-bulgur
3b330a8c-5275-481e-b928-78eb47b414f9,``Round'' is one for the first things which come to mind when I hear ``bulgur''.,``Spicy'' is one for the first things which come to mind when I hear ``chili_pepper''.,``Sweet'' is one for the first things which come to mind when I hear ``carrot''.,3,1,https://app.prolific.co/submissions/complete?cc=245E7AF0,typical_of_concept-round-bulgur
d707b21c-a9f8-48d9-84a3-4186a62989cd,I know that being round is necessary for many things (a/an) bulgur does or is used for. ,I know that being pointy is necessary for many things (a/an) needle does or is used for. ,I know that being white is necessary for many things (a/an) t-shirt does or is used for. ,3,1,https://app.prolific.co/submissions/complete?cc=245E7AF0,affording_activity-round-bulgur
182de33f-eacc-4554-91db-b9369504b59c,I think it is impossible for (a/an) bulgur to be round.,I think it is impossible for (a/an) water to be dry.,I think it is impossible for (a/an) rose to be white.,3,1,https://app.prolific.co/submissions/complete?cc=245E7AF0,impossible-round-bulgur
65d1cd97-faf7-41d7-a296-8eb7e0c1d772,"Usually, (a/an) bulgur is not round, but there could be a highly unusual situation in which (a/an) bulgur is round.","Usually, (a/an) chocolate is not pink, but there could be a highly unusual situation in which (a/an) chocolate is pink.","Usually, (a/an) chocolate is not brown, but there could be a highly unusual situation in which (a/an) chocolate is brown.",3,1,https://app.prolific.co/submissions/complete?cc=245E7AF0,unusual-round-bulgur
b0d9b2bb-ffd5-41ca-aebc-48f319091f41,You can find (a/an) bulgur which is round. Round is one of a few possible shapes (a/an) bulgur can have. There is only a limited range of possible shapes.,You can find (a/an) apple which is green. Green is one of a few possible colors (a/an) apple can have. There is only a limited range of possible colors.,You can find (a/an) house which is white. White is one of a few possible colors (a/an) house can have. There is only a limited range of possible colors.,3,1,https://app.prolific.co/submissions/complete?cc=245E7AF0,variability_limited-round-bulgur
d3054ef1-76aa-4eaa-ab0d-0aee6b2dfa4b,"I could say (a/an) bulgur is round, but I would most certainly not mean it literally.","I could say (a/an) anger is hot, but I would most certainly not mean it literally.
I could say (a/an) person is cold, but I would most certainly not mean it literally.
I could say (a/an) story is dark, but I would most certainly not mean it literally.","I could say (a/an) fire is hot, but I would most certainly not mean it literally.
I could say (a/an) stone is heavy, but I would most certainly not mean it literally.
I could say (a/an) argument is liquid, but I would most certainly not mean it literally.",3,1,https://app.prolific.co/submissions/complete?cc=245E7AF0,creative-round-bulgur
278f017e-acff-48dd-bd90-65f47a07e7ef,``Bulgur'' is one of the first things which come to mind when I hear ``round''. ,``Rainbow'' is one of the first things which come to mind when I hear ``colorful''. ,``Dress'' is one of the first things which come to mind when I hear ``white''. ,3,1,https://app.prolific.co/submissions/complete?cc=245E7AF0,typical_of_property-round-bulgur
check3,I am still focused on this task.,France is a country.,Aamsterdam is a country.,3,1,https://app.prolific.co/submissions/complete?cc=245E7AF0,_check-_check3-_check3
test2,"""Blue"" is one of the first things which come to mind when I hear ""beer"". ","""Red"" is one of the first things which come to mind when I hear ""blood"".","""Grey"" is one of the first things which come to mind when I hear ""fire"".",3,1,https://app.prolific.co/submissions/complete?cc=245E7AF0,test_false-_test2-_test2
